puntuacion_rotten,puntuacion_imdb,direccion,guion,argumento,duracion,genero,titulo,id_pelicula
86,-,Donie Ordiales,"['Donie Ordiales', 'Austin Uchino']","Victor Robinson would like to be a father, but killing, drugs, prostitutes, blood-money, gangsters don't make for a safe place for a 3yr old.",40,Accion,the way out,tt1366984
100,-,"['Daniel Dowding', 'Alex Winter']",Chaz Ahern,"On a dark night, an undercover police operation goes stale, but when things start to turn ugly a masked vigilante shows up unexpectedly... or so it seems.",8,Accion,faceless,tt1366873
,-,Nathaniel Johnson,"['Nat Livingston Johnson', 'Nathaniel Johnson']","James Miller is having quite a day. Accused of stealing drugs, his girlfriend is taken hostage, he's about to lose his job as a cop and gets shot at by the drug dealers who murder his sister. He is now in a race against time to save the woman that he loves.",-,Accion,stopwatch,tt1367119
,-,Michael Dickson,Michael Dickson,"Derek Bryden, a retired Hit-Man in the Witness Protection Program, sets out on a quest for revenge after his wife is murdered during an attempt on his own life.",17,Accion,remnant,tt1367270
,-,"['Maxime Demba', 'Vincent Gatinaud', 'Fabien Gorchon']","['Maxime Demba', 'Vincent Gatinaud', 'Fabien Gorchon']",The latest in virtual reality technology makes it possible for gamers to directly participate in and experience deadly martial arts combat against a cyber opponent. Virtual Vision stretches the boundaries of reality pushing the gamer's skills to the limit.,6,Accion,virtual vision,tt1367295
,-,David Mikalson,David Mikalson,"Stone Rockwell is an action comedy that follows a day in the life of America's top government paid killer Stone Rockwell. When a high profile scientist is kidnapped only Stone can get him back, but once the mission begins he finds out this time the bad guys are making it personal.",17,Accion,stone rockwell,tt1367448
,9.6,Kostas Gerampinis,Kostas Gerampinis,Aggelos is a civil engineer working on a new project that will boost his career up. One day he returns home from work and discovers his girl is missing. At that point he receives a phone call from a stranger that will make him play by his rules so that he would see his girl again.,16,Accion,to kouti,tt1367384
,-,Vincent Nero,Vincent Nero,"Jack, the man to hire for dirty and risky jobs, takes some time off and vacations in London after the death of the love of his life by his own hands. He's quickly called by to duty when The Frenchman rages war against modern art, art students, and pop culture.",20,Accion,the job: blown away,tt1367381
,-,Nicholas Correnti,Nicholas Correnti,A psychedelic super-spy is captured while trying to stop a madman from destroying six of the seven realities.,9,Accion,benny future and the madman from manchester,tt1367312
,8.2,Hal Jordan,Hal Jordan,"Seattle Leary is a lot like you. She hates her job, her personal life is a mess, she seduces men then assassinates them for a shadowy government agency... Then again, maybe she's not like you at all.",14,Accion,the assassin project,tt1367309
,7.5,Peter Marshall Smith,Peter Marshall Smith,"The murder of an elite assassin has broken a long-standing peace between the Cartel and the Yakuza. Now the son of the Street Samurai has taken up his sword, with a mission to find his father's murderers and make them pay in kind.",5,Accion,street samurai,tt1367449
,-,Mario Cornejo,Mario Cornejo,-,-,Accion,stray hearts,tt1369700
,-,Dan Seneres,Montell Baiochi,-,-,Accion,the drill,tt1370184
,-,Garrett Graham,Garrett Graham,A short film depicting a gritty and violent game of Russian roulette.,-,Accion,in a heartbeat,tt1370216
,-,Juris Kursietis,Juris Kursietis,-,42,Accion,rit bus (will have it tomorrow),tt1370878
,-,Roland Gotjé,Roland Gotjé,-,5,Accion,twilight forest,tt1370895
,-,Mike Ryan,Mike Ryan,A vampire hunter tracks down the man who saved him when he was a young boy. After years of training he finally fights the battle he's prepared for all his life.,16,Accion,the hunter's apprentice,tt1374893
81,-,Marcus Dreeke,Marcus Dreeke,-,20,Accion,dust,tt1374868
78,-,Tom Hanson,Tom Hanson,-,-,Accion,apostle,tt1374825
,-,Brock Smith,Brock Smith,"A man in a race again time to save his wife, finds out something far more sinister than her abduction.",-,Accion,visceral,tt1374973
-,-,Nick Talon,Nick Talon,-,-,Accion,righteous indignation,tt1376234
30,-,Leo Kei Angelos,"['Leo Kei Angelos', 'Calvin Ogburn']","One fateful night, two brothers meet to resolve a conflict, and remember a love lost.",8,Accion,rain,tt1377213
,-,Christopher G. Moore,Christopher G. Moore,A man finds that falling asleep at work can lead to some extremely action-packed dreams.,3,Accion,hard stapled,tt1377166
,-,Jakob Thomsen,-,-,-,Accion,don't be late,tt1377282
,-,Mark Roeder,Mark Roeder,-,-,Accion,hit or miss,tt1377305
,-,"['Jack Casadone', 'Zman']",Rajan Gulati,-,15,Accion,thirty six hours: the poet,tt1377385
,-,Luke Daniels,-,"Leo hates going out at the best of times. Today, a mysterious parcel gives him more than he bargained for.",9,Accion,game,tt1377477
94,-,Ben Samuels,Ben Samuels,"After a devastating ambush leaves a young American soldier abandoned in the wintry forests of 1944 France, a chance encounter with a German officer will forever change both their lives.",29,Accion,brothers in arms,tt1377665
,-,Adam Dow,"['Adam Dow', 'Kendrick Redira']",-,11,Accion,master vengeancer,tt1378729
,-,"['Jeremy Hyler', 'Danielle Hoffman']","['Danielle Hoffman', 'Jeremy Hyler']","Three editing students, bored in class, decided to take mushrooms and go out on their own personal adventures.",7,Accion,"tick, tock, trip!",tt1379681
,-,Mark Hannah,"['Remi Drozd', 'Mark Hannah']",-,9,Accion,find my way,tt1380889
,-,Robert Matthews,"['Robert Matthews', 'Eliot Murray']","A team of marines are on a mission in an Iraqi town. With their Sergeant facing death, Corporal Murray is forced to make a critical decision about who is friend, and who is foe.",10,Accion,the man left behind,tt1380915
,9.0,Richard D. Kinsella,Pia Cook,"Seeking revenge for the ultimate betrayal, Robert finds that killing the one you love is far harder than killing strangers on a battlefield.",3,Accion,end of the tour,tt1380794
0,-,Monifa Porter,Monifa Porter,"One in a Million is a re-creation of the creation myth. It is the story of a lesbian couple's dogged pursuit of suitable sperm to start their family. The film is a fast-paced funny action flick--a story of moms-to-be on a precarious journey in cars, 'copters and cyberspace, relentlessly pursuing and welcoming new life.",10,Accion,one in a million,tt1381841
,5.5,Brianna Campbell,Brianna Campbell,"""Shades of Hope"" is the story of two wars; the war in Vietnam and the war at home. Upon returning home from his first tour of duty, Danny finds himself welcomed with contempt for his part in a war he was forced into. Abandoned by his family he re-enlists back into the conflict with no intention of returning home. All hope seems lost until a new recruit named Max joins... Leer todo",14,Accion,shades of hope,tt1381671
,-,Thomas Hyungkyun Kim,Thomas Hyungkyun Kim,A fatal fight between a virgin ghost and a kung-fu exorcist.,4,Accion,chemical fiction,tt1382197
,-,Bennie Woodell,Bennie Woodell,"Scarlet is a hired killer who poses as a prostitute to kill her next target, Harvey. Before she kills him, she tells how she got into the life she now leads.",26,Accion,scarlet widow,tt1382342
,-,Raymond Clark,"['Raymond Clark', 'Steve Russell']",-,5,Accion,the stoyanova incident,tt1382357
80,-,Max Roytman,Tal Vinnik,A Cashier finds a gun pointed at him in a robbery that is not quite what it seems.,10,Accion,convenience,tt1382417
,6.0,Jasmin Tempest,William Shakespeare,Scotland 1057AD. A time forgotten. A tyrant King. A loyal warrior. A choice that will change history.,22,Accion,macbeth's disciple,tt1385589
,7.1,Chris Hartwell,Brian Walton,"Trunk is the story of two young, savvy ""agents"" whose mission is in jeopardy due to their denied, but mutual attraction, proving once again that life and death are easy -it's love that's truly dangerous.",15,Accion,trunk: a love story,tt1385668
,8.9,Erik Lundin,Erik Lundin,Pop-singer Tom Walter is chasing his stalker paparazzi through the most embarrassing sides of his existence.,22,Accion,den perfekta bilden,tt1385960
27,-,"['Samuel Crow', 'Rich Song']","['Reed Clare', 'Samuel Crow']","Most of us are so wrapped up in our fax machines, cellular telephones and stare-of-the-art motor vehicles; we forget sometimes that we are just plain old mammals. We're furry, we hunt, we eat, we breed, we build houses, and in fact we have a lot in common with our evolutionary class mates. This episode of ""On Track"" takes a look at the adaptations and habits that have... Leer todo",25,Accion,kingdom come,tt1387198
,-,Fernando Jay Huerto,Fernando Jay Huerto,Janis and Steven are two of the best assassins in their company. Their skills are put to the test when budget cuts force a massive layoff. A battle royale is put into effect to determine who will stay employed. The number 1 ranked assassin will keep their job and the rest will be terminated... literally.,10,Accion,heart shot grand prix,tt1387376
,-,Charles Card,Charles Card,"A young, arrogant samurai, in pursuit of glory and fame, hunts down and challenges a famous swordsman to a match. Little does he know, the swordsman has other plans for him.",13,Accion,the challenge,tt1391045
,-,Michael Ogasawara,"['Michael Ogasawara', 'Tomas Pais']",Two friends come under attack while trying to decode mysterious signals in a desolate world.,9,Accion,voices of the dust: prelude,tt1391135
,-,Ian Eyre,"['Ian Eyre', 'Birkleigh Foreman']","When a friend is in need, an inner hero is released. Birkleigh waits at a party for her friend Katie but Katie's car has broken down. Reluctantly, Birkleigh drives to rescue her, only to find an abandoned car and a muffled scream from down a dark alley.",-,Accion,the mighty she-ro,tt1391609
,7.2,Raffi Asdourian,Raffi Asdourian,"The traces left by the era of the samurai are still with us today. From this rich history of this ancient warrior culture comes a tale of honor, vengeance and redemption with a dark, sense of meaningless fatality. It is the origin story of a cursed vigilante, Ai, hell-bent on disposing those responsible for her clan's demise. Inspired by the great tradition of samurai... Leer todo",13,Accion,ai,tt1391560
,8.4,Slade Blackburn,Slade Blackburn,Mike thinks his nephew's friends are a bad influence. He also thinks they are planning a school shooting.,10,Accion,roomies: high school white kids,tt1391855
,7.0,Caleb Christofer,Caleb Christofer,"After being kicked out of college, Dick Grayson reunites with his former mentor, Bruce Wayne. Together they set out to stop three of the deadliest villains ever to plague Gotham City. This LEGO, stop-motion animation is exploding with adventure, mind-boggling clues, and rubber nipples. This film features the voice of Heath Ledger's Chicago stand-in as the Joker.",8,Accion,batman rebuilt,tt1391658
,-,Alastair Ferran,"['Danny Eagleton', 'Alastair Ferran']","When scientist Jack Graham returns from the jungles of Peru, he has a new leap in pharmaceutical medicine in his possession. Hunted by those who will stop at nothing to get their hands on it, he is pursued by a pair of hired assassins named Mr Smith and Mr Jones. When Jack inadvertently involves botanist Alicia, soon her life is in danger too. Acting on an impulse he'... Leer todo",22,Accion,board of death,tt1391768
,-,Jeremy Helal,Jeremy Helal,"This lesson is simple, the reason men fight is because they are insecure, one man trying to prove he is stronger, but the highest level you can achieve ...is when you are able to walk away without using force. A man so strong on the inside has no need to demonstrate his power, if you can do this you will never lose.",10,Accion,the art of movement,tt1391761
,-,Laurent Buson,"['Fabien Gorchon', 'Yannick Van Dam']","He only had one brother, after his little brother was assassinated; nothing remained to him other than revenge.",9,Accion,brothers forever,tt1395257
,-,Peter Chen,Peter Chen,"Action Comedy about friendship and acceptance, an Asian American cross culture become friends with a Caucasian man, learn about winning by helping and not hurting each other.",5,Accion,white tiger yellow tiger,tt1395298
,5.9,Dana Skvarek II,"['Brandon Ray', 'Dana Skvarek II']",-,-,Accion,echelon,tt1395180
,-,-,-,Reparto principal,-,Accion,an racán,tt1395785
,-,"['Ashley Smith', 'Ashley A. Smith']","['Ashley Smith', 'Ashley A. Smith']","How To Be A Loan Shark is a short film, about a young Loan Shark, Harvey. He explains to the audience his past and current experiences in the business. Sometimes collecting money is easy, and some times it gets down right dirty. Through a series of short stories told by Harvey, the audience learns of a situation he is currently in. He finds himself in debt to a bigger... Leer todo",27,Accion,how to be a loan shark,tt1396478
33,-,Dan Jackson,Dan Jackson,-,19,Accion,certainty,tt1396451
,-,Patrick Chavis,-,-,-,Accion,hard times in the bokken brotherhood,tt1396473
,-,Jennifer Lin,Jennifer Lin,"Kelly defies the limits of the law when her work visa expires. In a defining moment of rebellion, June and Kelly risk everything they have built together.",7,Accion,look again,tt1396630
,-,Sean Brown,Sean Brown,-,-,Accion,the prefect,tt1396656
,-,Brian Flanagan,Brian Flanagan,"Abigail Alexander is facetious, demanding, and unrelentingly English. Her life as a student in Dublin is, if not up to her high standards, at least tolerable. But then her Irish boyfriend 'does her wrong'. He loses his hat. The one that made him look hot. And nobody else seems to really appreciate the gravity of the situation. So Abigail Alexander gets her cricket bat... Leer todo",10,Accion,bad man,tt1396932
,-,Tam Le,Tam Le,A bag of drugs is found. It turns out the bag is worth a lot of money. Five friends try to find a way to sell it.,20,Accion,snitchers,tt1397000
,-,"['Daniel Astbury', 'Jake Astbury']","['Daniel Astbury', 'Jake Astbury']","Nunchaku explores the journey of a young urban warrior forced to face his demons. Deelo is violently attacked by an intruder at his home, left beaten and bruised. From this moment Deelo's life is shattered throwing him into a world of fear. His desire to extract revenge on the assailant becomes an overwhelming force as his fantasies blur into reality. In the end the u... Leer todo",15,Accion,nunchaku,tt1399293
,-,Moody,Moody,-,12,Accion,mi pen,tt1399660
,6.2,David Seger,"['David Seger', 'Kevin Wilson', 'Ken Ochalek']",-,-,Accion,"hi, i killed the world",tt1399561
,-,Kevin Wiggins,Kevin Wiggins,-,25,Accion,journey of death,tt1399570
,-,Ian Eyre,"['Ian Eyre', 'Dan Rice']","When the pastor is run out of town and the last man of faith, Chris Famer, is fatally bitten by a vampire, it looks like the spiritual forces of Darkness are winning in Sundown. But when Chris resurrects with angel power instead of demon power, the forces of Light have one last hope to save Sundown.",21,Accion,welcome to sundown,tt1401736
71,-,Jesse Blanchard,-,-,-,Accion,run for your life,tt1404716
,5.7,Spicy Mac,"['Dan Barnhill', 'Spicy Mac', 'Raphaello']",-,-,Accion,the life guard man,tt1408299
,6.2,Mark Roeder,Mark Roeder,A man who seriously loves his cat Sam becomes dangerously upset when he discovers that Sam loves a burglar more than than him. The man chases after said burglar with an ax.,6,Accion,an axe to grind,tt1409684
,-,"['Brian Watts', 'Jared Weyerbacher']",Brian Watts,-,12,Accion,out of indiana,tt1409701
,-,"['Suza Kohlstedt', 'Numan Acar']","['Numan Acar', 'Suza Kohlstedt']",Random aggression is a growing phenomenon surround the world.,5,Accion,pure random,tt1410280
20,-,"['Dianna Mc', 'Knight']",-,-,-,Accion,the most dangerous game,tt1413586
96,-,Janet Harvey,Janet Harvey,Lower East Side record store owner Joey Psychotic has a bad day when his debts catch up to him.,10,Accion,gravity,tt1413996
,-,Chris Bailey,"['Bob Destri Hilgenberg', 'Rob Muir']",-,-,Accion,lady d,tt1415275
67,-,Chris Bailey,"['Bob Destri Hilgenberg', 'Rob Muir']",-,-,Accion,lefty,tt1415278
,-,Chris Bailey,"['Bob Destri Hilgenberg', 'Rob Muir']",-,-,Accion,georgy,tt1415875
,-,Chris Bailey,"['Bob Destri Hilgenberg', 'Rob Muir']",-,-,Accion,sean,tt1415895
,8.3,Abigail Steinberg,"['Terry Rossio', 'Jay Krishan', 'Amber Dawn Lee']","Chrissy, the gum chewing hit woman has a dirty laundering job to finish. When things fall apart, and we find out she isn't who we thought, everyone must look for a sign from God, so that murder doesn't spoil the whites. When the sign happens everyone scrambles to determine if it's a sign from GOD or life on it's own terms.",-,Accion,laundry,tt0918541
,-,"['Murilo Cumin', 'Martin Baptistão Neto']","['Murilo Cumin', 'Martin Baptistão Neto']",An old evil rises again and the global world church needs to find a new warrior to save the world through a tournament.,26,Accion,devil my cry,tt10217800
,-,Juan Francisco Pérez Villalba,"['John Reyes Calderón', 'Juan Francisco Pérez Villalba']",A blackjack game that goes wrong.,-,Accion,las cartas,tt10342384
,-,Keivan Mohseni,Keivan Mohseni,-,12,Accion,fifty fifty,tt10732856
,-,Roger van der Weide,Roger van der Weide,-,-,Accion,dt.narubleachballimon-oh,tt10778776
,-,"['Ben Allan', 'Andrew Todd']","['Ben Allan', 'Brendon Bennetts', 'Jeff Clark']",-,7,Accion,new fish,tt11193828
,6.4,-,-,"The story is set in the Sengoku period. A rounin called Nanashi saves a young boy Kotarou at an abandoned temple. Kotarou has no family, is pursued by a mysterious militia organization from China and hires Nanashi as his bodyguard.",3,Accion,sutorendjia - muko hadan,tt11576584
,-,Giorgi Tavartkiladze,Giorgi Tavartkiladze,"Six writers try to create a story of a young man. Their opinions struggle each other, as one thinks the story has to be a crime, while the others develop a love, Bollywood movie, political satire and allegory stories. As one of the writers is kicked out the room, the story starts moving fast.",11,Accion,creativism,tt12068850
28,-,Eric Whiteley,-,An entry into the 7th annual International Lightsaber Choreography Competition.,4,Accion,bounty,tt12106916
,-,Eric Whiteley,-,An entry into the 7th annual lightsaber choreography compeition.,5,Accion,avr advent,tt12106978
,-,Michael J. Hauser,Michael J. Hauser,"An overweight aspiring police officer who lives a dull, tightly controlled life has been told he must lose some weight and get into better shape before he will be able to become an officer. In the meantime he takes up a post working for a quirky private investigator. While investigating one particular case, the man realizes he may be closer to police work than most of... Leer todo",33,Accion,the figure of authority,tt1224141
,6.9,Chandler Tuttle,"['Chandler Tuttle', 'Kurt Vonnegut Jr.']","A short film adaptation of Kurt Vonnegut's Harrison Bergeron, 2081 depicts a dystopian future in which, thanks to the 212th Amendment to the Constitution and the unceasing vigilance of the United States Handicapper General, everyone is ""finally equal...."" The strong wear weights, the beautiful wear masks and the intelligent wear earpieces that fire off loud noises to ... Leer todo",25,Accion,2081,tt1282015
,7.3,Robert W. Kelly,"['Nick Mc', 'Loughlin']","Two assassins compete for a lucrative contract by going head-to-head to kill the same target, the mother of the woman who's employing them, but the target knows they're coming.",-,Accion,calibre,tt1320324
,6.7,Chris Bouchard,"['J.R.R. Tolkien', 'Chris Bouchard', 'Sabina Sattar']",Sauron is preparing to unleash his armies and Gollum is creeping around Middle Earth with crucial knowledge of the Ring's location. He must be found.,38,Accion,the hunt for gollum,tt1323925
,7.8,Stolis Hadjicharalambous,"['Stolis Hadjicharalambous', 'Christopher J. Otis']","Women go missing, Tucker files missing persons report. Tucker meets and gets hints from some strangers where she is.",18,Accion,crossed,tt1326937
,6.6,"['Tony Mc', 'Neal']","['Tony Mc', 'Neal', 'Delta Zulu']","When ex-con and hard-as-nails Jake Green finally gets a chance to see his daughter after six months, he takes her out for a quick bite only to wind up in the middle of an armored car heist. The violent incident leaves a lasting impression on his daughter and influences her choice to pursue a dangerous and lucrative career later in life.",8,Accion,born that way,tt1331044
,6.6,D.K. Johnston,D.K. Johnston,"At the dawn of man's existence the powers of Heaven and Hell each chose a single human representative. Their purpose, to guide and protect mankind. Gifted with immortality, power, and strength the Cypherian line was created. A Cypherian, named Servius, was charged with the protection of Jesus Christ. After the Crucifixion Servius turned his back on his charge and vani... Leer todo",18,Accion,the cypherian,tt1337101
,-,Michael Faulhaber,Michael Faulhaber,"A young police inspector sees in the rescue mission the chance to overcome his own shyness and risks everything. But what happens, if in the final showdown a little boy gets into jeopardy?",25,Accion,die m-akte,tt1337153
46,7.2,Matt Zien,Matt Zien,A sociopathic teenager uses mind games and manipulation to corrupt his wholesome and good-hearted childhood friend.,-,Accion,prince charming,tt1337122
,9.0,Joshua Moise,Joshua Moise,Two down-and-out young men pose as EPA agents to con an insane recluse out of his treasure.,15,Accion,treasury men in action,tt1337208
,6.6,Saul Herckis,Saul Herckis,A soldier reflects on what he cares about most to find peace in the midst of brutality.,5,Accion,warzone,tt1337568
,8.0,Patrick Barry,"['Patrick Barry', 'Jesse Gay']","After a series of mediocre performances, Jesse Sorensen was dropped from his skating sponsorship. Now on the downside of his career, he and a few friends have decided to form their own skate company.",10,Accion,veer!,tt1337723
,8.2,Patrick von Barkenberg,"['Anna Stothard', 'Patrick von Barkenberg']","This is the story of Felix and Maya, separated from each other after a plane carrying biological weapons crashed into a town near their home. Many people died, more went missing. The living were relocated to housing shelters where they would be safe from contamination. Felix was one of the living. Maya was one of the missing.",15,Accion,[sun]dust,tt1339204
,6.1,Ana Lily Amirpour,Ana Lily Amirpour,-,5,Accion,six and a half,tt1339611
,-,Brennen Jones,Christos Stratakos,"A modern take on the classical black and white Film Noir flicks of the 1930's, A Midnight Run takes Joie on an adventure of redemption and revenge after a long estranged childhood friend comes back into his life and convinces him to get involved in a local drug ring.",20,Accion,a midnight run,tt1342899
,7.7,Kevin Richmond,Kemper Sease,Two female assassins trade their souls to the devil to become the best assassin in the world.,33,Accion,vs,tt4625214
,7.7,Kevin Richmond,Kemper Sease,Two female assassins trade their souls to the devil to become the best assassin in the world.,33,Accion,vs,tt1344676
51,-,Brenton Thom,Brenton Thom,"A private investigator, surrounded by corruption, is on a never-ending quest for booze.",9,Accion,film noir,tt1347262
,7.1,Richard Khouri,George C. Bujold,"An American journalist travels to the remote and lawless deserts of Central America to shoot a documentary investigating child trafficking, but is intercepted by forces that do not want his message to be heard.",15,Accion,trafficking,tt1351257
,8.4,"['Matthew Cooke', 'Vincent Lund']","['Matthew Cooke', 'Vincent Lund']",Arthur is as surprised as anyone to learn he's the reincarnation of KING Arthur - but there's no time to contemplate as the forces of dark lore are active once again and only one person can stop them.,13,Accion,arthur's lore,tt1351093
,-,Ian Nicholson,Ian Nicholson,A group of friends at a party are affected by a government-sanctioned mind control project that turns people into zombies.,25,Accion,dead minds,tt1351125
,6.6,Micki Mihich,Micki Mihich,An idiosyncratic contract killer must pass the ultimate test in order to get the ultimate promotion.,20,Accion,the 100th job,tt1351084
,8.8,Jeff Prahl,Jeff Prahl,"In this dramatic, action-packed 35 minute short film, the relationship of two young thieves spirals downhill when their entire crew is destroyed. It spins further and further out of control in a complex web of lies, betrayal, and murder, until it meets an explosive ending.",35,Accion,the knights divide,tt1352726
,-,Will Martin,Will Martin,A young skateboarder sets out to find and kill the drug dealer responsible for the death of a loved one.,28,Accion,roughrider,tt1352781
,8.4,Susan Hippen,Susan Hippen,Nikki and Viv fight off an alley ambush.,-,Accion,nikki and viv,tt1355587
,-,"['Aaron Christian Caine', 'Chris Riordan']",Michael Moeller,"After just outlawing smoking, the Governor fires his assistant, Bill for putting Equal instead of sugar in his coffee. Now bill teams up with a small time crook to expose his former boss and bring down the man.",15,Accion,a state without smoking,tt1357520
,6.4,Josh Lee,Tyler Farr,"A man mistakingly takes a bag of money and two crime bosses fight over getting it back from him. Suspense and action commences through a plot driven story that is full of surprises, down to the last second.",12,Accion,dark exchange,tt1358411
,7.4,Thomas E. Laughlin,Thomas E. Laughlin,"Lithia, a beautiful bride, is forced to make the most important and dangerous decision of her entire life; a decision that will affect her family, her past, and her destiny.",15,Accion,the union,tt1358518
