puntuacion_rotten,puntuacion_imdb,direccion,guion,argumento,duracion,genero,titulo,id_pelicula
17,7.0,Bálint Kenyeres,"['Bálint Kenyeres', 'György Réder']","Before dawn, people will rise and other people will take away their hope.",13,Accion,before dawn,tt0434067
,7.0,Tom Putnam,"['Michael S. Harbour', 'Jeff Malmberg', 'Tom Putnam']","""Broadcast 23"" is a comedy disguised as a horror film. Professor Russell Morgan thinks he's on to the scientific break-through of the century. He couldn't be more right... or more wrong. ""May God have mercy on our souls, Broadcast 23 wasn't a greeting at all...""",7,Accion,broadcast 23,tt0437887
,8.1,Keith Jodoin,"['Keith Jodoin', 'Robert Alan Anderson']",An action serial about a highly trained young woman who's embarking on her career as an international spy and discovering it takes more than good looks to keep things from falling into the wrong hands.,30,Accion,evenfall,tt0444625
,6.4,Didier Bénureau,"['Didier Bénureau', 'Anne Gavard']","Hesitant to have his cat neutered, Rémi inquires about the possibility of a sex life without testicles. A man in search of his sexual identity.",22,Accion,les couilles de mon chat,tt0446975
50,4.1,Alex Ferrari,"['Alex Ferrari', 'Jorge F. Rodriguez']","A gun blast, a flash of light, and a young woman awakens to the comfort of her own bed. Bonnie Clayton has it all, a great relationship, a challenging career, and the burden of a dream that grows more vivid and disturbing with each passing night. But when Bonnie is abducted by a sadistic stranger and his colorful entourage, she discovers that the key to her survival l... Leer todo",19,Accion,broken,tt0446663
,7.4,Ford Austin,Ford Austin,"When an E.T. attempts to return to his home planet, he is cornered by a sexy bounty hunter from space and her sidekick who try to bring him in and collect the bounty on his head. The alien is forced to fight for his life in a battle that kicks off an intergalactic war.",-,Accion,cerebral print: end game,tt0447889
,-,Todd G. Bieber,Todd G. Bieber,"Harold, an upper class fly fisherman, forces Jimmy, a beer drinking good ole boy, out of a prime fishing hole. When the waters turn rough, Harold's only hope for survival is calling for help from the man he just tried to have arrested.",5,Accion,neck deep,tt0449076
,7.9,Chris Hall,Chris Hall,-,6,Accion,nun fu,tt0451146
,-,Hakan Haslaman,Hakan Haslaman,-,-,Accion,way of khan,tt0452704
,8.6,Ian Truitner,Ian Truitner,A day of wrath leaves only one man standing.,-,Accion,dies irae,tt0453357
,8.0,Alex Ranarivelo,"['Eric Anderson', 'Alex Ranarivelo']","A man wakes up in a hospital after a car accident. As he goes in and out of consciousness, he thinks he sees a nurse euthanize the patient next to him. When he tells the doctors what happened, no one believes him.",20,Accion,morphin(e),tt0455640
,-,Fareed Abdelhak,"['Fareed Abdelhak', 'Keith Terrillon']","Los Angeles, California... 75,000 dead. Houston, Texas... 100,000 dead. Time period... two weeks. Cause... Diabolus... a lethal biological agent. FBI Counterterrorist Agent Kam Saab has been on the hunt for the sadistic group of domestic terrorists responsible since these deadly acts arose. His mission leads him to a new metropolitan centre where he is liaising with S... Leer todo",11,Accion,diabolus,tt0457653
,9.3,Ryan Carr,Ryan Carr,-,-,Accion,cop vs. cop,tt0457311
-,-,Mark Edward Lewis,Nick D. Diaz,A Young Business man discovers that he can be a true conqueror with peace.,12,Accion,the crusader,tt0458346
,6.3,Michael Berry,"['A.K. Murray', 'M.B. Murray']","A man's world is invaded by a ferocious bird, thrusting him into an escalating, action-filled battle that transforms his life into something far beyond his dreams.",15,Accion,the day of the grackle,tt0458350
53,7.5,Gabriel Dowrick,David Ratner,In a post apocalyptic Australia a homeless man without a past discovers a baby without a future... But both are more than they appear as destiny collides with kung-fu.,7,Accion,the razor's edge,tt0459523
,2.6,Ethan Tran,Ethan Tran,"""Color Blind"" explores the possibilities of reality with its brandish action sequences and thought-provoking concepts. The two main characters of ""Color Blind"" long for pain simultaneously within their own worlds. By provoking others, They are briefly able to restore what was tragically stolen from them as children.",-,Accion,color blind,tt0458343
83,6.5,Nash Edgerton,Nash Edgerton,Lucky finds himself in a bind - and it's going to take more than a Houdini act to get out of this situation.,5,Accion,lucky,tt0460496
64,7.4,Richard Tucci,Richard Tucci,-,6,Accion,blink,tt0463917
,5.6,Umberto González,Umberto González,A real estate agent gets what is coming to him.,17,Accion,hustler's instinct,tt0464058
21,7.3,Albert Pedraza,Albert Pedraza,-,-,Accion,derailed,tt0463956
,6.6,Itsurô Kawasaki,"['Clamp', 'Midori Goto', ""Jun'ichi Fujisaku""]","The Gang arrives at the Country of Birdcages, a place where everyone has a bird as a pet and a friend. The gang gets separated. Syaoran, Sakura and Mokona meet a princess who warns them of her uncle, the king. Appearances may be deceiving.",30,Accion,gekijouban tsubasa kuronikuru: torikago no kuni no himegumi,tt0466551
,6.5,Kasper Vejlø Kristensen,"['Jonas Borgen', 'Kasper Vejlø Kristensen']",-,8,Accion,jackpot,tt0468497
33,6.0,Junya Okabe,Junya Okabe,-,41,Accion,specter,tt0466136
,7.9,Geva Patz,Geva Patz,A woman is chased by a menacing man. Will anyone save her?,2,Accion,thug,tt0466588
,6.4,Pascale Marcotte,Pascale Marcotte,Two supermarket shoppers reach for the last tube of a rare toothpaste breaking into hand-to-hand battle.,8,Accion,shopping extreme,tt0468866
,9.1,"['Thomas Mahoney', 'Michael Reilly']","['Thomas Mahoney', 'Michael Reilly']","Scott McTiernan, an out of work musician is taken by his would-be fiancé to meet her father. On a simple mission for milk with Bill Ventura, her father, Scott makes an earth-shattering discovery.",11,Accion,alienation,tt0469022
,-,Ford Austin,Ford Austin,-,-,Accion,ninja vs. cerebral print,tt0468817
,5.7,Anthony L. Fletcher,Anthony L. Fletcher,"The Gotham mob wants control of the east end, but only one person stands in there way. . . . Catwoman.",24,Accion,catwoman: nine lives,tt0470709
,7.5,Eric Bomba-Ire,"['Matt Ruggles', 'Nathan Flood', 'Matt Hirsch']",The kidnapping of a little girl forces an over-the-hill action hero to dust off his clothes and come out of retirement.,-,Accion,concrete brown,tt0470992
,7.0,Rocky Jo,"['Damon Chang', 'Rocky Jo']","Bunny & Clydo is non-stop Asian-stylized adrenaline with a heart. An utterly wild and distinctly Asian couple find themselves in the greatest fight of their lives when a jealous rookie Detective is bent on destroying their love. Can Bunny & Clydo find a way to overcome the one man who stands in the way of their happiness, or is it the end of the line for one of our mo... Leer todo",18,Accion,bunny & clydo,tt0470706
,7.4,Mathieu Young,"['Mathieu Young', 'D.J. Gugenheim']","While roommates Don (Kenan Thompson) and Ross (Josh Cooke) meet at a café to argue about cleaning up after Tuesday Night Poker, losing limbs in broccoli picking accidents, and the artistic merit of clay ashtrays shaped like mutilated ponies, an apocalyptic battle is waged right outside their window. Will they ever notice? Will we?",10,Accion,myopia,tt0469145
,7.9,Angelo Bell,Angelo Bell,"Serious is a complex, multi-dimensional character; on one side she is a Special Forces-trained killer working for a nefarious organization called The Committee, which hopes to own the Presidency. On the other side, she is an emotionally torn introvert, the product of an abusive childhood, who must deal with feelings of guilt over her sister's mysterious death. Unlike ... Leer todo",40,Accion,nanny and the professional,tt0472275
,-,Paul Bunch,Paul Bunch,Two burglars make the worst decision of their lives when they choose to rob the home of WENDY WELLS.,8,Accion,wendy wells,tt0472279
,-,Greg van Borssum,Greg van Borssum,"In a surreal world of chaos only one man can stand alone.Two opponents battle it out in a race against time desperate not to find out ""What is the price of a life""",6,Accion,method of entry,tt0475335
,-,Tony Laudati,Tony Laudati,Trekkies and Wookies run for cover when our girls raise intergalactic hell at the 2005 Grand Slam Sci-Fi Summit.,-,Accion,chicks with sticks: live at the grand slam,tt0476447
89,-,"['Damian Mc', 'Lindon']","['Damian Mc', 'Lindon']","Mr Sturge has the perfect plan- get the girl, get drunk and get away with his life.",7,Accion,the drop,tt0476538
,-,-,-,"Lock and Load is giving an inside look on the making of the hostage rescue scene, featuring real Marines and military aircrafts.",30,Accion,lock and load: making '24: season 4',tt0477765
,-,Lucas Longacre,"['Nick Berg', 'Steve Cirbus', 'Lucas Longacre']","After losing his wife and his hearing in a horrific accident, Terry is trapped in a living purgatory. Isolating himself in a condemned building, he struggles with his rage and loss, only venturing out of his self-imposed prison to participate in brutal, unsanctioned, bare-knuckle fights in order to make a couple bucks to survive on. The film begins with Terry in his a... Leer todo",20,Accion,beat,tt0478098
,7.8,-,-,A train crash opens the action on the fourth season of 24. This documentary covers the filming of that season and demonstrates the high production values in place for 24.,18,Accion,blood on the tracks: making '24: season 4',tt0477577
,-,Maxim Jago,Maxim Jago,-,5,Accion,kiss chase,tt0478189
,8.4,Alison Mason,Alison Mason,"A middle class businessman orders a Kazakh bride who is living a double life. While he's at work, she is an elite assassin. When her worlds collide, which one will she choose?",14,Accion,the housewife,tt0479066
,-,Erik A. Candiani,Erik A. Candiani,-,12,Accion,days end,tt0479891
40,8.6,Raffi Bagdasarian,Raffi Bagdasarian,-,12,Accion,consumed,tt0479003
86,5.3,"['Jerod Brennen', 'Justin Lewis']",Jerod Brennen,"When Confronted by Darkness what do you do? You can run. You can hide. You can try to escape. Sometimes, though, you accept that confrontation is... Inevitable",6,Accion,inevitable,tt0479072
45,8.3,Gabe Uhr,Gabe Uhr,"Scripted, shot, and edited in just 51 hours for the 2005 DC 48 Hour Film Project (yeah, it was late), The Paperboy is the action-packed origin of a mildly-empowered superhero who uncovers a white-collar crime. Winner of one of the 48 Hour Film Project's prestigious Audience Awards.",7,Accion,the paperboy,tt0479118
,6.1,Brian Haase,"['Mennette Colón', 'Brian Haase']",A police psychic chasing a serial killer is having a problem with blackouts. Can her psychiatrist help her piece together what is happening through her visions?,6,Accion,visions,tt0480272
,-,"['Justin Seyb', 'Barry Strickland']","['Lynn Michaels', 'Justin Seyb', 'Barry Strickland']",Two local yuppies make the mistake of a lifetime when they antagonize a stranger who enters their bar.,9,Accion,401-k.o.,tt0480503
,3.6,Marty Martin,Marty Martin,"A man who works for the world's leading bio-technologies company, turns against it when he learns the dark secrets hidden inside. He vows to steal the only piece of evidence than can take the enterprise down, which leads him on an intense chase.",18,Accion,got milk? the movie,tt0481739
,5.5,Corey Sosner,"['M. Sean Mc', 'Manus']","The Punisher kills his way up the ladder of organized crime in NYC. He is relentless in his hunt for the Kingpin but before he can complete his revenge, one man stands in the Punisher's way, Wolverine. Straight from the comics. It's the ultimate Battle royal. Skull vs. Claws! Only one will walk away !",13,Accion,punisher: first round,tt0481028
,6.4,Alex Justinger,Alex Justinger,"""The best"" man in the in the business has been assigned a hit...now if he can only find the right house.",13,Accion,gratuitous,tt0481530
58,7.5,Justin Lutsky,Brett Simmons,"When an evening of fine dining unexpectedly turns into a hostage scenario, the waiters must save the day.",25,Accion,bon appetit,tt0481482
,7.0,Jack Paccione Jr.,Jerry White,An action/comedy/horror film centered around the ancient sport of table tennis.,7,Accion,duel at red table,tt0481697
,-,Pierre Vatanapradit,-,"A trip to the mailbox leads to more than just bills and junk mail for Herman Furman. An intruder gets intruded upon, and the confusion sets in.",4,Accion,intrusion confusion,tt0481744
-,8.2,Owen Smith,Jeff Rose,A tribute to family members who fought bravely to protect America in WWII.,7,Accion,battaglia,tt0481670
,-,Olumide Odebunmi,Olumide Odebunmi,"Some have referred to Africa as the land of a thousand lost stories. Well this is one of those stories. A tale concerning a young High Priest who is overcome by the lust of his heart, and ultimately seals his fate.",8,Accion,fate,tt0484351
,3.0,Reinert Kiil,"['Kenneth Dybvik', 'Reinert Kiil']","Fear, friendship, drama and action are the ingredients as we follow boxing champ ""the Killer"" towards the fight of his life. Victory in the supreme viking championship will ensure his fame for eternity, but is ultimate victory worth paying the ultimate price?",15,Accion,boom boom in paradise city,tt0484478
,7.9,"['John F. Mc', 'Carthy']","['Greg Andersson', 'John F. Mc', 'Carthy']",-,6,Accion,hard boiled haggerty,tt0484844
,6.3,Ole Ragnvald Bogstad Takanashi Gran,Ole Ragnvald Bogstad Takanashi Gran,-,14,Accion,action anton,tt0485849
,8.5,Michael Anton,Michael Anton,-,7,Accion,kill johnny,tt0486760
,7.6,Matthew Swanson,Matthew Swanson,"After a chance encounter with a young girl, a shy Japanese insect collector finds himself thrust into a wild chase to recover a stolen beetle.",19,Accion,hiro,tt0486595
,6.3,Nacho Vigalondo,Nacho Vigalondo,-,10,Accion,choque,tt0485877
,7.2,-,-,Rusty Amazonian swords are no match for our rapid-fire stick work at the 2005 Xena 10th Anniversary Convention.,-,Accion,chicks with sticks: kicking xena's ass,tt0487251
82,-,Rabah Brahimi,Rabah Brahimi,-,-,Accion,mirage,tt0488845
,-,Cole Walliser,-,"Clouded with tainted memories of a new acquaintance Amy, Aden finds himself struggling with last night's events and with the trouble he's now in.",10,Accion,night & daze,tt0489243
58,-,Eric Smith,Eric Smith,"A soldier is faced with a choice of saving himself or saving another. Remembering the stories his father told him about his grandfather, a hero in World War II, he realizes that his life is not his own.",6,Accion,hallowed be thy name,tt0490960
,7.5,Christian Genzel,Christian Genzel,A strike team is tasked with stealing and destroying a mysterious project called Mystery Project which is located on the premises of one of the largest companies in the world.,8,Accion,mystery project,tt0493150
55,6.8,P.J. Germain,"['P.J. Germain', 'Casey Kaczorowski', 'Derek Spear']","Ethan (Ben Nisman) is left emotionally scarred when the last of his kin, his sister Kat, is brutally murdered and left in an alley near their apartment. With no family, no job, and nothing left to live for, he searches for the men responsible for Kats death, only to discover that the story goes deeper than he imagined.",21,Accion,purpose,tt0493291
,8.4,"['Brian De Vore', 'Jeffrey De Vore']","['Brian De Vore', 'Jeffrey De Vore']","Alex, a well-off and laid back young man, accidentally becomes victim of an unknown virus. Being number fourteen on the death list of an organization run by the French speaking Francois, he sees no other choice than to escape.",18,Accion,no. 0014,tt0493364
,-,Joshua Barash,"['Joshua Barash', 'Saul Barash']","A man has no peace while trying to write his script at a nighttime café. Constantly bothered by those around him, including the flower salesman, an annoying woman on her cell phone and an annoying cigarette bummer, enough becomes enough, and in an self induced hypnotic state, uses his unique powers of thought to disposes of those he finds annoying.",3,Accion,café annoyé,tt0495300
,8.0,"['Christian Haslecker', 'Christian Genzel']",Christian Haslecker,-,-,Accion,faustrecht,tt0493126
,7.3,"['Ezra Ferguson', 'Terran Gregory']","['Ezra Ferguson', 'Terran Gregory']","""Return"" is the tale of Voldigar of Stromgarde, a grizzled warrior finally returning to his beloved home and bride only to find his past in ruins.",6,Accion,return: a warcraft motion picture,tt0495238
,-,Charlie Cartaya,"['Charlie Cartaya', 'Eduardo Fierro']",-,7,Accion,trivial things that people say in normal letters,tt0496417
,-,Gabriel Sabloff,"['Lil Jon', 'John Troxtel']",-,2,Accion,lil jon: crunkwar part 1,tt0497036
,6.5,Jonathan Barli,Jonathan Barli,"Double-cross, triple cross, the age old problem of the abuse of power. In Film Noir style, dirty detective Nails interrogates Lips, while femme-fatal Rita gets her man, Hank.",15,Accion,should heaven fall,tt0497973
,7.0,Marco Alejandro Santiago,Marco Alejandro Santiago,"Rival gangs of human traffickers engage in a rolling gun battle along a dirt road in the high Arizona desert. Unbeknownst to the traffickers, one of the border crossers, Maria Gonzalez, reverses the situation and saves herself and her son.",6,Accion,once upon a time in the desert,tt0758770
,7.1,Aaron Schoenke,"['Bill Finger', 'David Hammond', 'Bob Kane']","Deep in the basement of Arkham Asylum, a desperate Psychologist has secretly set up an interview with the mass-murdering Joker. As the Clown Prince of Crime reflects on the key moments of his memories, the interview drifts into a game of manipulation that flirts with life and death.",34,Accion,patient j (joker),tt0759932
,7.3,Umut Aral,Umut Aral,"Three men. From different corners of the crime world: A hired gun, Musta; a con man, Cem; and a thief, Ali. By a twist of fate their paths crosses at Central Station and start to work as a team. But their past won't let them go too faraway...",17,Accion,çarpisma,tt0759905
,6.9,Igor Pejic,"['Frédéric Hebuterne', 'Igor Pejic']","A man stands alone in a lovely pastoral landscape of grass, sea, and sky. He is a soldier imagining this peaceful place while his reality is a fierce firefight at a weapons depot. The soldier is skilled. He kills using various weapons; the corpses of his mates gives him pause. We move back and forth between the battle and the scape. What's in store for the soldier?",8,Accion,un monde meilleur,tt0765264
,7.6,Jalmari Helander,"['Jalmari Helander', 'Juuso Helander']",In this sequel to 'Rare Exports Inc' we are shown the horrendous results of abusing Father Christmas.,10,Accion,the official rare exports inc. safety instructions 2005,tt0769542
,5.6,Ryan Travis,"['Ryan Travis', 'Ari Weiner']","Beneath the flashing lights of a smoke-filled nightclub, a rebellious punk rocker named Tyler unleashes years of pent-up frustration through the hard-hitting notes of his electric guitar. While in his rock-and-roll element, he is completely empowered, strong and sexy. In the raging crowd just a few feet in front of him stands Nicole, a head-turning vixen with a tortur... Leer todo",20,Accion,the darkside of happiness,tt0769761
,5.5,Nathan Price,Darren Montgomery,Adam is driving home when he's mistakenly identified for a serial killer at large. Other accidents follow and Adam Waldorf must figure out why these events are happening and whether he can accept the life that fate has dealt him.,20,Accion,ordinary day,tt0772248
,7.4,"['David Purchase', 'Ian Purchase']",David Purchase,-,-,Accion,the 5th rangers,tt0776709
,-,Thierry Lorenzi,Thierry Lorenzi,"Come from the French continent for Corsica, the secret agent John Caffé must make equipe with Isabella Rossa, Chef of the insular military base, in order to save Corsica of an atomic threat.",26,Accion,mission insulaire,tt0800134
,8.0,Ivica Pusticki,"['Ivica Pusticki', 'Aleksandar Zemunik']","A profesional hitman wants to retire. The ""Boss"" does not allow that and instead of the payoff he orders his kill. But the kill fails and the hitman is out to get revenge.",30,Accion,dragonrage,tt0804468
,5.2,Eriq Wities,"['Lauren Selman', 'Eriq Wities', 'Martín Yernazian']",-,-,Accion,the next day,tt0803045
70,7.0,Andrew Greener,Andrew Greener,"Endgame is a dark thriller set in contemporary Belfast. Martin, Played by Shaun Paul McGrath is a kindly school teacher who becomes unwittingly involved in a paramilitary street gun battle. A bold and terrifying escape ends in failure, and Martin is captured and interrogated. As time runs out, his survival hinges on a matter of identity.",18,Accion,endgame,tt0810030
,8.1,Aaron Robson,"['Heather Petrone', 'Aaron Robson']","When Amanda picks up a hitch hiker, Will, a happy-go-lucky ex-convict, she gets more than she bargains for.",22,Accion,due west,tt0819095
,7.1,Fernando Lobo Amaral,Fernando Lobo Amaral,"A crime story about choices and priorities, where guilt ends up taking the leading role.",7,Accion,apneia,tt0820028
,7.3,Slade Blackburn,Slade Blackburn,"After being hired to kill his best friend, the Triggerman hunts down his prey with the most advanced state-of-the-art ""handguns"" ever.",10,Accion,triggerfinger,tt0822040
,-,Chi Yu,Chi Yu,-,25,Accion,victim 2 supervixen,tt0823554
,-,Matt Hilliard-Forde,Matt Hilliard-Forde,-,-,Accion,running towards tomorrow,tt0831334
79,7.8,Torrence Davis,Torrence Davis,-,-,Accion,the young master,tt0832469
100,6.8,Shawn Costa,Shawn Costa,A story of mistaken identity and mistaken intentions.,2,Accion,the run,tt0832457
100,6.8,Shawn Costa,Shawn Costa,A story of mistaken identity and mistaken intentions.,2,Accion,the run,tt0929277
,-,Dan Sanguineti,Dan Sanguineti,"After suffering the humiliation of mistake after mistake on the indoor soccer field, Charlie's nightmares affect his confidence and his ability to perform for his team. The grand final is here and Charlie must now overcome his fear and paranoia and rise to the challenge of facing the Demons one last time.",26,Accion,screwball!,tt0836696
,7.2,Angelo Lopes,Angelo Lopes,Crime boss goes in over his head when he hires a bagman to heist an underboss belonging to the eminent crime syndicate.,11,Accion,syndicate: zeed,tt0840002
,7.1,"['Trever James', 'Luke Rold']","['Trever James', 'Luke Rold']",Mark McKent must return his video to Blockbuster Video before he gets a late fee. To do this takes him on adventure through time and reality.,15,Accion,blockbusters,tt0863006
,7.6,Alexandre Franchi,Alexandre Franchi,"Art is dying, painters are beaten up and ballerinas are set on fire. But Frida doesn't care. She just wants to play her music. Troll Concerto is an apocalyptic fable about the power of music in finding one's destiny.",16,Accion,troll concerto,tt0872342
,-,Michael Love,"['Ron Blecker', 'Michael Love']","Four soldiers are taught the reality of combat by a veteran Sergeant. All lessons come at a price, this one will cost them dearly.",4,Accion,shower of bullets,tt0886533
12,6.0,Not Applicable,-,-,15,Accion,netherworld,tt0907861
,8.7,Teppei Nakamura,Teppei Nakamura,"A sword master, named Ryunosuke, has lost someone who he loved dearly. Having trouble dealing with the past, he is attached to the bottle as he visits his dead lover's grave. One day, Ryunosuke runs into a young girl, Otsuru, who is being chased by a group of bandits. He soon meets two more warriors, Todoh and Matahachi who claim to be looking for Otsuru in order to p... Leer todo",25,Accion,drunken sword,tt0945337
,3.5,Jeff Lunzaga,-,Explores new sides of the Crow myth and introduces brand new characters.,16,Accion,the crow purgatory,tt0946992
4,5.4,Christopher Folkens,Christopher Folkens,-,25,Accion,toxin,tt0950773
,-,James P. Weatherall,Rob Fairhurst,"Specialist military unit Bravo 45 having retrieved A.1.1.4.H; a biological weapon that could infect the world with a plague of Biblical proportions, are on the run to their rendezvous point. They are perused and intercepted by the viruses creator and a terrorist force intent on using it to deadly effect.",12,Accion,a.1.1.4.h,tt0961126
,8.6,Ryan Knight,Ryan Knight,Three soldiers on a simple reconnaissance mission encounter fierce enemy resistance and are pinned down in the snowy Ardennes forest during the Battle of the Bulge.,18,Accion,away from the line,tt0981261
,-,Demetrea Triantafillides,"['Ken Arnold', 'Dan Franko', 'Kevin Jiggetts']",The continuing adventures of Naked Man.,-,Accion,the golden tiki of djbuti buti,tt0992970
,-,Phil De Courcel,Christopher Howell Watson,An unstoppable thief known only as the Black Fox is stealing pieces of an ancient sword to reassemble and exact vengeance on the world. A lone priest charged with guarding the final piece addresses an FBI conference as a last resort.,14,Accion,the broken sword,tt0997211
-,-,Colin Orr,"['Chris Ayala', 'Jessica Maissonet', 'Colin Orr']","A little boy pictures himself as an action hero. He rides out to the park, only to get cornered in a dead end by a gang of bullies. He must then stand his ground, armed only with a squirt gun, a plastic sword, and his imagination.",10,Accion,imagine,tt0997245
,6.9,Luka Hrgovic,"['Marin Busic', 'Luka Hrgovic']",-,21,Accion,epopeja o bureku,tt1050243
,-,Oliver Drawson,"['Oliver Drawson', 'Clayton Ovans', 'Pat Seymour']",-,7,Accion,hell in a head casket,tt10578068
25,-,James Theesfeld,James Theesfeld,Three criminals break into an apartment for a high stakes heist only to find that someone is still home and he's not going down easy.,15,Accion,botched,tt10946932
25,-,James Theesfeld,James Theesfeld,Three criminals break into an apartment for a high stakes heist only to find that someone is still home and he's not going down easy.,15,Accion,botched,tt1424470
,8.0,Chris Vargas,Chris Vargas,'Bike Boy' rumbles with the Motorcycle Toughies to save his kidnapped love in a Kenneth Anger-style revenge flick.,6,Accion,road rash,tt1095026
