puntuacion_rotten,puntuacion_imdb,direccion,guion,argumento,duracion,genero,titulo,id_pelicula
12,4.7,Andrew Shea,John Rafter Lee,An armored car guard's elaborate plan for revenge is threatened by his relationship with an old friend -- a brilliant and unpredictable television preacher.,84,Drama,forfeit,tt0472096
,-,Joe Camareno,Joe Camareno,-,-,Drama,memoirs,tt0473229
,6.4,Miel Van Hoogenbemt,"['Pierre De Clercq', 'Jean-Claude Van Rijckeghem']","Leopold is a widower School Director. His housekeeper announces him on the first day of his retirement, that she will be leaving to her homeland, Romania, in order to be with her daughter who just gave birth to her grandson. Leopold thinks it's time to find a suitable wife, and his friend and neighbour Julian, register him in on an internet date-site. Leopold has an e... Leer todo",107,Drama,man zkt vrouw,tt0472477
42,5.8,Gillian Armstrong,"['Tony Grisoni', 'Brian Ward']","On a tour of Britain in 1926, Harry Houdini (Guy Pearce) enters into a passionate affair with a psychic out to con him.",97,Drama,death defying acts,tt0472071
57,5.9,Robert Davi,"['James Andronica', 'Robert Davi']","The Dukes, a Doo Wop group, were on top of the world at 17, and struggle for survival in 2008. Their manager is desperately trying to get them work but is met with failure at every turn. Finally pushed to the extreme, they pull a heist only a fool would attempt, which leaves them even more desperate. When all seems lost, they find themselves. Underneath the laughter, ... Leer todo",96,Drama,the dukes,tt0470737
49,5.9,James Franco,"['Merriwether Williams', 'James Franco']",-,79,Drama,good time max,tt0469913
82,7.0,Mike Nichols,"['Aaron Sorkin', 'George Crile']",-,102,Drama,charlie wilson's war,tt0472062
,5.1,Okacha Touita,"['Michel Alexandre', 'Nadia Char', 'Yasmina Khadra']","In the civil war that tears apart Algeria in the 1990s, police chief Brahim Llob hunts down Islamists extremists on a daily basis. Having become the favorite target for them, it is with fear that he goes every morning to his office at the Central Commissariat of Algiers. Annoying for the power in place, preparing to publish a whistle-blower book, Morituri, Llob is obl... Leer todo",116,Drama,morituri,tt0470865
55,7.6,"['Jennifer Capraru', 'Roger Spottiswoode']","['Judith Rascoe', 'Michael Donovan', 'Roméo Dallaire']","The story of General Romeo Dallaire's frustrated efforts to stop the madness of the Rwandan Genocide, despite the complete indifference of his superiors.",112,Drama,shake hands with the devil,tt0472562
36,8.0,Joy Dietrich,Joy Dietrich,"Estranged from her family due to a childhood indiscretion with her white brother, a young Korean adoptee seeks to regain a sense of home by exploring ties with the East Asian Americans she meets in her new apartment building, until her brother shows up at the door, stirring long lost feelings that she has tried to bury.",-,Drama,tie a yellow ribbon,tt0472196
16,5.8,Christopher Cain,"['Christopher Cain', 'Carole Whang Schutter']",A love story set during a tense encounter between a wagon train of settlers and a renegade Mormon group.,111,Drama,september dawn,tt0473700
38,5.4,"['Nicholas Di', 'Bella']","['Nicholas Di', 'Bella', 'Paul Root']",A seventeen-year-old photographer gets caught up in murder when he breaks his own rules and falls in love with one of his teenage models.,89,Drama,cherry crush,tt0473464
85,7.2,Andrés Baiz,"['Andrés Baiz', 'Mario Mendoza']","Based on the Mario Mendoza's book and inspired by true events, tells three interconnected stories happening in the eve of the infamous Pozzetto Massacre.",95,Drama,satanás,tt0473697
,5.9,"['Ben Reding', 'Dominik Reding']","['Ben Reding', 'Dominik Reding']","Almost casually, the young concrete worker Bastian kills a tramp. The police believe it was an accident and so the murder remains undiscovered for the time being.",107,Drama,für den unbekannten hund,tt0475278
39,7.1,Eva Aridjis Fuentes,Eva Aridjis Fuentes,"Lawrence (played by Frank Wood), a photographer living on his own in New Jersey, rekindles a relationship with his old flame Caroline (played by Paige Turco) shortly before she dies in an accident. Her 16 year-old son Johnny (played by Ryan Donowho) has nowhere to go and Lawrence takes him in. Lawrence tries hard to be a father to Johnny but Johnny repeatedly rejects ... Leer todo",110,Drama,the favor,tt0475268
,6.6,Mark Norfolk,Mark Norfolk,"Julius Beauregard has lost his job, his wife and his only child. But just as he decides to end it all he meets an angel and takes her on a journey through the entrails of his own mind.",96,Drama,crossing bridges,tt0475244
89,7.0,Adrienne Shelly,Adrienne Shelly,-,108,Drama,waitress,tt0473308
32,5.7,Andrew Lau,"['Craig Mitchell', 'Hans Bauer']",-,105,Drama,the flock,tt0473356
,6.1,Matthew Scott Harris,Matthew Scott Harris,God gives the owner of a small neighborhood hardware store in Chicago the task of altering his customers' lives by the dimension of three inches - in any manner they desire.,99,Drama,dimension,tt0473351
,6.6,Marcelo Schapces,"['Julio Cardoso', 'Pablo Fidalgo', 'Paula Romero Levit']",-,110,Drama,la velocidad funda el olvido,tt0474979
0,6.4,Michael Mayer,"['Michael Mayer', 'D. Cory Turner']",Four best friends plot to rob a bank during their high school graduation ceremony in order to help out one of the teen's sick relatives.,89,Drama,graduation,tt0475286
25,5.5,Gary Walkow,"['Gary Walkow', 'Alain Silver']","Having been kicked out of his house by his wife, writer Richard McMurray crashes on the couch of two sexy co-eds where he just might find the inspiration to complete his second novel.",79,Drama,crashing,tt0475243
47,6.3,Sunu Gonera,"['Kevin Michael Smith', 'Michael Gozzard', 'J. Mills Goodloe']",The determined Jim Ellis starts a swim team for troubled teens at the Philadelphia Department of Recreation.,109,Drama,pride,tt0475355
44,5.6,Mark Freiburger,"['Travis Beacham', 'Mark Freiburger', 'Christopher J. Waild']",A mysterious drifter lures two boys into uncovering the secrets of a sleepy southern town.,88,Drama,dog days of summer,tt0475255
,4.3,David Serrano,"['David Serrano', 'Alberto San Juan']",During the Spanish transition to democracy a newcomer director is trying to make a movie dealing with censorship troubles and the erotic trends that cinema industry imposes.,112,Drama,días de cine,tt0475567
4,3.4,W. Scott Peake,"['Geoff Nicholson', 'W. Scott Peake', 'Gina Viola']","In this outlandish black comedy, mild-mannered Eric takes his wife and children on what he believes will be a final happy holiday before his kids leave the nest, but instead he is is thrust into a world of sexual decadence, headless corpses, sadistic police officers, and one wise old man.",94,Drama,permanent vacation,tt0475431
,5.4,Miles Montalbano,Miles Montalbano,"A portrait of three restless young urbanites searching for meaning in love, sex, drugs, and political rebellion.",90,Drama,revolution summer,tt0476007
47,6.4,Harmony Korine,"['Harmony Korine', 'Avi Korine']",-,112,Drama,mister lonely,tt0475984
,3.7,Hansal Mehta,Hansal Mehta,"After losing his love to the son of a gangster, a loyal gang-member must try and protect his family.",113,Drama,raakh: a poem masked in blood,tt0476847
43,6.7,Neil Jordan,"['Roderick Taylor', 'Bruce A. Taylor', 'Cynthia Mort']",-,122,Drama,the brave one,tt0476964
,6.0,Daniel Espinosa,Daniel Dencik,"Shmuli is alone with his 5 years old son and lives with his parents. He works as security guard to make money to fulfill his dream of moving to USA. He falls in love with the young and beautiful Amina, but their love is troubled as he is Jewish and she is from Pakistan.",90,Drama,uden for kærligheden,tt0476461
78,4.1,Guddu Dhanoa,Guddu Dhanoa,A docile man gets enraged when a politician's son throws acid on her face and later kills the miscreant. He is then hunted by the police and politicians who wants him dead.,128,Drama,big brother,tt0476762
93,8.2,"['Ethan Coen', 'Joel Coen']","['Joel Coen', 'Ethan Coen', 'Cormac Mc', 'Carthy']",-,122,Drama,no country for old men,tt0477348
,4.0,Pavel Ruminov,Pavel Ruminov,"In present-day Moscow ghosts of three little girls killed by their insane mother randomly pick a person to watch over for a three days. If during this ""probation period"" person's moral standards appear not to be high enough The Daughters then kill him using telekinesis.",123,Drama,myortvye docheri,tt0477340
8,5.9,Mennan Yapo,Bill Kelly,-,96,Drama,premonition,tt0477071
84,6.5,Jeffrey Blitz,Jeffrey Blitz,"Looking for answers to life's big questions, a stuttering boy joins his high school debate team.",101,Drama,rocket science,tt0477078
62,4.6,Dan Gildark,"['Grant Cogswell', 'Dan Gildark', 'H.P. Lovecraft']","A Seattle history professor, drawn back to his estranged family on the Oregon coast to execute his late mother's estate, is reaquainted with his best friend from childhood, with whom he has a long-awaited tryst. Caught in an accelerating series of events, he discovers aspects of his father's New Age cult which take on a dangerous and apocalyptic significance.",100,Drama,cthulhu,tt0478126
,7.9,Srdan Golubovic,"['Srdan Golubovic', 'Melina Pota Koljevic', 'Srdjan Koljevic']","A couple finds out their son urgently needs an expensive heart surgery. While struggling to find the money, the father is approached by a mysterious man proposing a sinister deal.",106,Drama,klopka,tt0478813
44,6.5,Martin Hynes,Martin Hynes,"When his mother dies, a teenager takes a road-trip in a stolen car to find his long-lost brother. Along the way he discovers a profound connection with the car-owner and with himself as well.",93,Drama,the go-getter,tt0479289
64,6.5,Thomas Gilou,"['Jean Cosmos', 'Thomas Gilou', 'Messaoud Hattau']","Set in France during the struggle for Algerian independence, Messaoud's mother is terminally ill and his father, needing to work long hours in the factory, can't look after him, so decides to put him and his older brother Abdel in foster care. Sent to the countryside, Abdel has to work on a farm, but Messaoud is taken in by a childless woman, who conceals his Arab ori... Leer todo",124,Drama,michou d'auber,tt0478705
74,7.2,Paul Haggis,"['Paul Haggis', 'Mark Boal']",-,121,Drama,in the valley of elah,tt0478134
,5.9,Anders Rønnow Klarlund,"['Rasmus Botoft', 'Anders Rønnow Klarlund']","A satirical drama revealing the consequences of the Danish government's ""New Copenhagen Criteria"", a new policy aiming at securing the nation's survival. Citizens who fail to meet the criteria - those who have received more from society than what they have contributed - are eliminated.",94,Drama,hvordan vi slipper af med de andre,tt0478365
,6.4,Félix Viscarret,"['Fernando Aramburu', 'Félix Viscarret']",-,108,Drama,bajo las estrellas,tt0479221
29,4.9,Philippe Caland,Philippe Caland,"Fashion designer Amer Atrash, perpetually on the verge of success, is undergoing a personal crisis in both his marriage and his business. Attributing his misfortune to bad karma from a wrongdoing committed fifteen years prior, he sets out to correct his mistake, and in doing so, experiences a spiritual awakening.",87,Drama,ripple effect,tt0479140
42,5.5,Ernst Gossner,"['Ernst Gossner', 'Richard Marcus']","""South of Pico"" is an emotionally charged drama in which four strangers witness an unimaginable tragedy and are catapulted into the defining moment of their lives. Set present day in Los Angeles, a chauffeur, a waitress, a doctor and a young boy each deal with life's daily challenges, only to find themselves at the scene of an accident the moment it happens. Riding on... Leer todo",86,Drama,south of pico,tt0478273
,7.5,S. Shankar,"['Swanand Kirkire', 'S. Shankar', 'Sujatha']",A software engineer comes to India in order to serve the nation and invest in its welfare. A few corrupt officials and politicians try to stop him while he tries to do good for the poor.,188,Drama,sivaji,tt0479751
89,6.2,"['Greg Mc', 'Lean']","['Greg Mc', 'Lean']",-,99,Drama,rogue,tt0479528
43,5.5,Dan Reed,Dan Reed,"After surviving a gang rape and mugging, a middle aged businesswoman and her 23 year old boyfriend plot to murder their attackers, but find themselves conflicted about carrying out their plans.",80,Drama,straightheads,tt0480011
10,5.0,Paul Auster,Paul Auster,"Internationally acclaimed novelist Paul Auster (""New York Trilogy"", ""The Book of Illusions"", ""Man in the Dark"") explores the art of writing in the darkly comical THE INNER LIFE OF MARTIN FROST. Having completed his fourth novel, Martin Frost accepts the invitation of friends to spend a few weeks in their vacant country house. On his first morning there, he awakes to f... Leer todo",94,Drama,the inner life of martin frost,tt0479074
,5.1,Robert P. Olsson,"['Björn-Erik Karlsson', 'H.P. Lovecraft', 'Robert P. Olsson']","Tore Forsman is an old man, most people would call strange or even mad. He lives in an old house on the country side. All his life he has kept something locked and sealed under his house. When he suddenly dies a relative, Adam, makes a trip to late Tores cabin. Adam has two friends with him, Björn and Jens. The spirit of Tore is somewhere to be found and that's a good... Leer todo",-,Drama,kammaren,tt0479936
68,7.2,Francis Lawrence,"['Mark Protosevich', 'Akiva Goldsman', 'Richard Matheson']",-,101,Drama,i am legend,tt0480249
,6.7,Simón Bross,"['Ernesto Anaya', 'Simón Bross']","Intertwining stories of abuse, adultery, and anorexia center around a Mexico City family with an obsessed mother.",103,Drama,malos hábitos,tt0480556
,6.9,Ernesto Contreras,Carlos Contreras,-,98,Drama,párpados azules,tt0481320
65,6.8,Peter Hedges,"['Pierce Gardner', 'Peter Hedges']",-,98,Drama,dan in real life,tt0480242
42,4.9,Amir Mann,Amir Mann,"John Reilly wakes up in an African Hospital with only fragments of his memory in tact. An officer of the local regime, Mugambe, accuses him of being an American spy.",95,Drama,the fifth patient,tt0481519
58,6.8,Steve Buscemi,"['David Schechter', 'Theo van Gogh', 'Theodor Holman']","After falling out with his editor, a fading political journalist is forced to interview America's most popular soap actress.",84,Drama,interview,tt0480269
35,5.6,Stanley Tucci,"['Theo van Gogh', 'Tom Erisman', 'Renée Fokker']","Affected by tragedy, a married couple decide to role play a blind date.",80,Drama,blind date,tt0480268
,7.0,Daryush Shokof,"['Sam T. Fard', 'Daryush Shokof', 'Jack Taylor']",An old man Jacuzzi and his Lolita beauty Jessica are so long and deeply in love that the pressure of it pushes them to blind perspectives where they decide to get it all over with on this very day. They are fed up with the God and the world and the other orders he has set on Earth for human beings to go through. They reject the idea that they have to die once their ti... Leer todo,85,Drama,a2z,tt0480751
,3.7,Ivan Nichev,"['Steven Cornwall', 'Menahem Golan']","Turkish and Neo Nazi gangs battle over territory and drug trafficking in Berlin, while a serial killer is on the loose. This action thriller brings several cultures together wanting to dispose of evil and stop the violence.",102,Drama,children of wax,tt0479880
,5.8,Giuseppe Ferrara,"['Giuseppe Ferrara', 'Daniele Aliprandi']","The story of trade unionist Guido Rossa, killed in 1979 by Riccardo Dura, a member of the Red Brigades.",102,Drama,guido che sfidò le brigate rosse,tt0481278
,6.9,Fabrizio Cattani,"['Fabrizio Cattani', 'Chiara Laudani', 'Pascal Zullino']",A pregnant woman tries to escape from the criminal who owns her and finds shelter from a diviner who lives in solitude.,89,Drama,il rabdomante,tt0480990
33,6.1,Francis Ford Coppola,"['Mircea Eliade', 'Francis Ford Coppola']",-,124,Drama,youth without youth,tt0481797
50,5.8,Daniel Krige,Daniel Krige,"Pete & Jerry are cousins living in Sydney's Western Suburbs, where life consists of drinking, getting stoned, getting in fights and hanging out. But things change forever when Pete and Jerry both fall in love with the same girl.",90,Drama,west,tt0480053
,6.8,Nick Peterson,Nick Peterson,-,74,Drama,speed of light,tt0480943
42,6.3,Scott Hicks,"['Carol Fuchs', 'Sandra Nettelbeck']",-,104,Drama,no reservations,tt0481141
,5.1,Damian Lee,"['Damian Lee', 'Daniel Matmor']",Redemption and damnation share a bed of hope in a love story between a suicidal psychiatrist and a drug addicted homicidal cop. How far can one fall ... how bad can one become ... and still find forgiveness?,95,Drama,king of sorrow,tt0480821
50,6.0,Andrew C. Erin,"['Andrew C. Erin', 'Peter Ferland', 'Olson Huff']","In order for a big-city doctor to get the job of a lifetime, he must spend his summer in Dunn's Rock, North Carolina. Arriving with his 10-year old son, he discovers what is most important and learns to enjoy the simple things in life.",102,Drama,simple things,tt0481583
,4.9,Pál Sándor,"['Pál Sándor', 'Zsuzsa Tóth']",-,104,Drama,noé bárkája,tt0483093
,7.2,"['César Charlone', 'Enrique Fernández']","['César Charlone', 'Enrique Fernández']",A small South American village is in a flurry over the Pope's 1988 visit.,90,Drama,el baño del papa,tt0482901
,6.2,Jacob Thuesen,Lars von Trier,Erik wants to make films. He starts 1979 at the Danish Film School. The many written and unwritten rules give him difficulty fitting in.,91,Drama,de unge år: erik nietzsche sagaen del 1,tt0482358
,5.0,Kevin Lewis,"['Kevin Lewis', 'Huntley Ritter']","A wrongfully-convicted man finds that even after he is proven innocent, there's other justice in the world besides the law, and when his daughter is abducted, he has no choice but to seek revenge.",91,Drama,the third nail,tt0482613
,4.7,Jorge Hernandez Aldana,"['Jorge Hernandez Aldana', 'Guillermo Arriaga']",A schizophrenic man commits suicide after his girlfriend cheats on him with his best friend.,102,Drama,el búfalo de la noche,tt0483577
,6.0,Alejandro Lozano,Tony Dalton,-,95,Drama,sultanes del sur,tt0483817
26,6.2,Randall Miller,"['Jody Savin', 'Randall Miller']","A professor of chemistry wins the Nobel Prize. His wife joins him to Stockholm but his PhD. working son gets kidnapped. The kidnapper demands $2,000,000 = prize sum.",110,Drama,nobel son,tt0483756
96,6.8,Scott Anderson,"['Scott Anderson', 'William Shakespeare']","""Now is the winter of our discontent..."" With these timeless words, Duke Richard - lounging on his sun deck - sets his murderous plans in motion. His goal: to eliminate the hated rival Lancaster dynasty, and reign as undisputed king. Standing between him and the throne are his brothers Clarence and King Edward, his nephews the Princes, his bitter adversary Queen Eliza... Leer todo",-,Drama,richard iii,tt0483789
,6.0,Augusto Tamayo San Román,"['Cynthia', 'Augusto Tamayo San Román']","The story centers on Enrique Aet (Diego Bertie), the eldest child of well-to-do Lima family whose engineer father died in 1886 when Enrique was 10. 21 years later, he has followed his father's calling and heads a road project into the Amazonian jungle, the goal being nothing less than to unite the country.",135,Drama,una sombra al frente,tt0483321
13,5.0,Don Most,"['Jeff Arbaugh', 'Stan Holland', 'Don Most']","Base on true events, Moola is a comedic look at some everyday folks who find themselves up against the odds in the powerful world of the mega-corporation.",108,Drama,moola,tt0483796
50,5.0,J.J. Lask,J.J. Lask,A successful New York businessman leads a double life as a computer thief.,100,Drama,on the road with judas,tt0484224
,7.1,Simone Scafidi,"['Simone Scafidi', 'Andrea Riva']",-,103,Drama,gli arcangeli,tt0484475
57,6.4,"['Banjong Pisanthanakun', 'Parkpoom Wongpoom']","['Aummaraporn Phandintong', 'Banjong Pisanthanakun', 'Sophon Sakdaphisit']",Deceased Siamese twin returns to haunt surviving sister,105,Drama,alone,tt0484090
,4.7,David L. Cunningham,"['John Hodge', 'Susan Cooper']",-,99,Drama,the dark is rising,tt0484562
30,5.7,Jake Paltrow,Jake Paltrow,A former pop star who now writes commercial jingles for a living experiences a mid-life crisis.,93,Drama,the good night,tt0484111
,3.5,Adam Rifkin,Adam Rifkin,"A philosophical caveman yearns for more out of life than sticks, stones and raw meat.",88,Drama,homo erectus,tt0484207
27,6.4,Mike Newell,"['Ronald Harwood', 'Gabriel García Márquez']",-,139,Drama,love in the time of cholera,tt0484740
,5.9,Niels Laupert,Niels Laupert,"Teenage dropouts Adam and Tommek pass their days hanging out and drinking in their grim housing complex, but as grinding boredom combines with Adam's need to prove himself and Tommek's penchant for petty crime, the two make a bet that plunges them into shocking and sudden violence.",80,Drama,sieben tage sonntag,tt0484888
,5.7,Othello Khanh,"['John Board', 'Othello Khanh', 'Bernard Leroy-Deval']","Saigon Eclipse is inspired by the ""Story of Kieu"", the classic Vietnamese epic poem written by Nguyen Du in the early 19th century. Our story revisits and updates the poem's principal themes of filial devotion, redemption and woman's submission; themes structuring Asian feudal society. The principal characters were retained and reinterpreted. Kieu, a beautiful and tal... Leer todo",90,Drama,sai gon nhat thuc,tt0485146
,5.2,Nikkhil Advani,"['Nikkhil Advani', 'Rahul Awate', 'Suresh Nair']","Six couples in love must face different problems caused by love itself. Do they resolve their issues and face life anew, or do they succumb under pressure ?",216,Drama,salaam-e-ishq,tt0485272
25,4.5,Lorraine Senna,Namrata Singh Gujral,A wannabe Hollywood player sets out to Americanize an Indian girl from the Himalayas.,90,Drama,americanizing shelley,tt0485185
0,4.3,Nicolas Roeg,"['Dan Weldon', 'Fay Weldon']","Powerful supernatural forces are unleashed when a young architect (Kelly Reilly) becomes pregnant after moving to an isolated and mysterious valley to build a house. And when the neighbouring farmers take against the unborn child, it's her very survival that is threatened.",-,Drama,puffball,tt0484881
,6.4,Jérôme de Missolz,Jérôme de Missolz,About the short life of a photographer who takes mostly naked photos of herself and others in strange places until she commits suicide.,75,Drama,le corps sublimé,tt0485759
,6.9,Cyril Gelblat,Cyril Gelblat,"Frida, a 75-year-old Ashkenazi, loses her memory and confuses past and present.",110,Drama,les murs porteurs,tt0485411
,7.1,Ed Radtke,"['M.S. Nieson', 'Ed Radtke']",A young kid escapes life on the streets of New York City by stealing video cameras with his friends and retreating into the footage he's found.,85,Drama,the speed of life,tt0486022
44,5.8,Gregory Jacobs,"['Joe Gangemi', 'Steven Katz']",-,91,Drama,wind chill,tt0486051
10,6.7,Jieho Lee,"['Jieho Lee', 'Bob De', 'Rosa']","A drama based on an ancient Chinese proverb that breaks life down into four emotional cornerstones: happiness, pleasure, sorrow and love. A businessman bets his life on a horse race; a gangster sees the future; a pop star falls prey to a crime boss; a doctor must save the love of his life.",95,Drama,the air i breathe,tt0485851
70,6.8,D.J. Caruso,"['Christopher Landon', 'Carl Ellsworth']",-,105,Drama,disturbia,tt0486822
,6.1,Alan Brown,Alan Brown,"Set in New York in the Summer of 2005, this film is about the relationship between two Americans: a wounded Iraqi War veteran who struggles to live with his psychological and physical scars, and a young filmmaker who accompanies him to a cabin in the Catskills to document his story.",87,Drama,superheroes,tt0486021
,6.3,Mateu Adrover,Mateu Adrover,-,94,Drama,fuerte apache,tt0486323
,5.4,"['Gregory Alosio', 'Sharon Angela', 'Jeff Mazzola']",Luca Palanca,Four short films form a single story about Brooklyn residents and their hangouts.,-,Drama,made in brooklyn,tt0486620
,6.3,Cristina Ionescu,Lia Bugnar,"Stefan is a young manager in a big advertising agency, happily married and having a young daughter. He suddenly falls in love with a woman he sees on the street, at a light stop. His life changes completely as he is desperately trying to find the woman of his dreams.",90,Drama,dupa ea,tt0487152
,6.9,André Téchiné,"['André TéchinéLaurent Guyot', 'Viviane Zingg']","Paris, 1984: A group of friends contend with the first outbreak of the AIDS epidemic.",112,Drama,les témoins,tt0487273
,5.8,Garrett Clancy,Garrett Clancy,"Ten years after his first novel flopped, K.C. Corcoran hopes to get his life back on track by writing another book and heads to a remote mountain cabin to work on it. But the locals prove more hazardous than he could have guessed.",94,Drama,cold ones,tt0486561
47,5.2,Tony Herbert,Tony Herbert,-,85,Drama,speed dating,tt0486209
,6.6,Emmanuelle Cuau,"['Agnès Caffin', 'Emmanuelle Cuau']","The tough lives of two ordinary individuals : Alex, an accountant and his wife Béatrice, a taxi driver.",102,Drama,"très bien, merci",tt0487505
37,4.9,Jeff Glickman,Josh Ben Friedman,"An unlikely friendship is formed over the obsession of Zelda Sparks. Being a toxic relationship between Craig Blackshear and Zelda, Craig does his best to get her out of his life and his head. Luckily for Craig she decides to leave town so he's able to live normally. When Zelda makes a reappearance in town after three years Craig recedes back into her web of toxicity.... Leer todo",95,Drama,killing zelda sparks,tt0487144
60,7.4,Abdellatif Kechiche,"['Abdellatif Kechiche', 'Ghalya Lacroix']",-,151,Drama,la graine et le mulet,tt0487419
,7.1,Michael Apted,-,Six intertwining stories showcase the social impact of soccer across the world.,100,Drama,the power of the game,tt0487987
,6.5,Vince Parenti,"['Bruce Bellocchi', 'Vince Parenti']",A light drama that takes us on a journey that explores what happens when a member of the Daveda family changes what he was taught to believe in order to find true happiness.,-,Drama,the longest yard sale,tt0489213
