puntuacion_rotten,puntuacion_imdb,direccion,guion,argumento,duracion,genero,titulo,id_pelicula
,5.3,Crispin Glover,Crispin Glover,"What Is It? is a bewildering, unnerving, surreal, blackly comic film from the visionary mind of Crispin Glover that tells the inner and outer struggles of a young man facing villains and demons on multiple planes.",72,Drama,what is it?,tt0118141
,7.4,"['Tim Burton', 'Mike Johnson']","['Tim Burton', 'Carlos Grangel', 'John August']",-,77,Drama,corpse bride,tt0121164
67,4.6,Mikey Jackson,Mikey Jackson,"Neil, a punk rock vegetarian, is being forced to go into the family butcher business. He decides to save the world instead.",76,Drama,shooting vegetarians,tt0146272
29,5.3,William Kaufman,"['Holt Boggs', 'William Kaufman', 'Matt Beckham']","""The Prodigy"" tells the story of small-time enforcer Truman Fisher's vicious conflict with a sadistic assassin who has chosen the unwilling Truman to be his successor. The assassin, who goes by the alias Rains and whose exploits have become the source of legend among Truman's underworld colleagues, drives Truman, through the pressure of constant violence and grief, to... Leer todo",-,Drama,the prodigy,tt0160706
,7.2,Murad Gumen,Murad Gumen,-,-,Drama,eve's preyer,tt0187838
,6.4,Gabriela Tscherniak,Gabriela Tscherniak,One night in Berlin approaching the year 2000 - a portrayal of the city's youth experiencing the excesses of the Berlin nightlife.,45,Drama,berlin nights,tt0195551
,-,Derek Lebrero,Derek Lebrero,"At the end of his first love, Pace leaves on a road trip with his buddy and discovers that not even Thousands of Miles can clear his conscience.",-,Drama,thousands of miles,tt0196155
,-,Edward G. Norris,Edward G. Norris,Four narratives all dealing with infidelity. The husband who discovers his late wife had led a double-life; the cheating husband who can't bear the thought of his own wife's affair; an old man who dreams of the married woman who got away.,76,Drama,death-defying acts,tt0195565
49,5.0,Steve Balderson,"['Steve Balderson', 'Clark Balderson']","A young boy who lives in a dysfunctional home went to the carnival and met a singer. Shortly after, a murder took place. The town's sheriff is seeking answers. The singer is trying to escape her environment so is the boy. But both has to face their own horror.",112,Drama,firecracker,tt0204322
37,6.0,Roger Spottiswoode,"['Patricia Highsmith', 'William Blake Herron', 'Donald E. Westlake']",Professional swindler hides the death of a famous artist in order to earn money by selling pictures on his own behalf.,101,Drama,ripley under ground,tt0219171
,8.1,Robert Fleet,"['Robert Fleet', 'Stephan Szpak-Fleet']","A homeless dying veteran, trying to find a Unicorn he believes lives in the mountains above Los Angeles, convinces a Latina immigrant to join his quest, provoking a tragic-comic chase as they are followed by the Border Patrol and her Lowrider cousins.",97,Drama,last mountain,tt0234084
91,7.7,Deepa Mehta,"['Deepa Mehta', 'Anurag Kashyap']","Set in colonial India against Gandhi's rise to power, it's the story of 8-year-old Chuyia, who is widowed and sent to a home to live in penitence; once there, Chuyia's feisty presence deeply affects the lives of the other residents.",117,Drama,water,tt0240200
,7.2,Bashar Shbib,Bashar Shbib,"What's a girl to do when her biological clock is ticking, yet marriage and a husband are the furthest thing from her mind? SILENT MEN follows the trials and tribulations of one very modern-minded young woman, Patricia, as she tries to plan out her motherhood. With the enlisted help of her best friend Liam she interviews on video dozens of men to find a suitable potent... Leer todo",87,Drama,silent men,tt0242882
75,5.6,Chris Jaymes,Chris Jaymes,"The youngest son of a legendary Hollywood producer, a Robert Evans type, accepts a bribe from his father to document his death.",96,Drama,in memory of my father,tt0251744
20,4.9,W.W. Vought,W.W. Vought,"In the tradition of V for Vendetta, Underworld and X Men, Johnny Virus takes place in the Chicago Underworld of futuristic 1940's.",100,Drama,johnny virus,tt0263495
,7.9,Jeff Kennedy,Jeff Kennedy,A peek through the keyhole into a world tinged with mental instability. A place where patients and doctors help heal one another through shared faith and friendships.,115,Drama,heaven's neighbors,tt0279121
,7.0,Kraig Kuzirian,"['Raffi Alexander', 'Kraig Kuzirian', 'Anahid Nazarian']",Two cousins who were best friends as boys in Beirut reunite in Los Angeles 17 years later.,95,Drama,pomegranate,tt0279683
,6.9,Gustavo Corrado,Gustavo Corrado,"A young man murders a tango singer and, oppressed by guilt, begins a sinuous and obsessive path of redemption that will lead him to finally occupy the place left empty by the artist.",91,Drama,garúa,tt0283354
45,5.5,Barbara Kopple,"['Stephen Gaghan', 'Jessica Kaplan']",-,85,Drama,havoc,tt0285175
,6.9,David E. Rice,David E. Rice,A group of long time friends discover they are not who they thought they were on an evening out in the city.,94,Drama,lava lounge,tt0289275
,-,Néstor Lescovich,-,-,99,Drama,corazón voyeur,tt0288484
,6.7,Tristán Bauer,"['Tristán Bauer', 'Miguel Bonasso', 'Edgardo Esteban']",-,100,Drama,iluminados por el fuego,tt0288569
47,6.8,Chris Columbus,"['Jonathan Larson', 'Stephen Chbosky']",-,135,Drama,rent,tt0294870
41,6.0,Kayvan Mashayekh,"['Belle Avery', 'Kayvan Mashayekh']","Kamran is a 12-year-old boy in the present day who discovers that his ancestor is 11th-century mathematician, astronomer, and poet of Persia Omar Khayyam. The story has been passed down in his family from one generation to another, and now it is his responsibility to keep the story alive for future generations. The film takes us from the modern day to the epic past wh... Leer todo",95,Drama,the keeper: the legend of omar khayyam,tt0294806
41,5.1,Henry Jaglom,"['Victoria Foyt', 'Henry Jaglom']",A clothing designer tries to save her struggling boutique store by having a tumultuous weekend sale of her shop's inventory by playing on the addictions of shopping for the women of Beverly Hills.,106,Drama,going shopping,tt0295605
69,6.2,David Beaird,David Beaird,"After a series of bad relationships, a man orders a mail order bride and receives more than he bargained for.",107,Drama,the civilization of maxwell bright,tt0299135
,5.9,Dan Pita,Radu F. Alexandru,-,105,Drama,second-hand,tt0302189
39,3.3,Nick Gregory,"['Nick Gregory', 'Kirk Aanes']","Two married couples are about to give new meaning to the phrase Love Thy Neighbor. When these best friends become more than just friends, one simple game leads to another. A twisted comedy about relationships, deception, and consequences.",89,Drama,love thy neighbor,tt0304356
97,5.4,Raul Inglis,Raul Inglis,Life in the 50's with the hopper family !,-,Drama,better days,tt0308028
17,4.5,Elizabeth Dimon,Elizabeth Dimon,"Although reluctant to do so, island recluse Tess offers her home to two strangers, Sam and Nigel, allowing them to heal their wounds but desperate to get them out of her home.",-,Drama,terror island,tt0310022
43,4.8,Peter Wade,Peter Wade,"The true story of a suburban teenager whose one mistake leads to a life changing punishment. Peter Madigan, a 15-year-old from the suburbs commits a senseless act, causing a commuter train to derail killing the engineer.",92,Drama,tracks,tt0310243
67,8.6,Christopher Glatis,Christopher Glatis,"An intense and emotional one-day journey in the life of Hollywood down-and-out actor, as he descends into despair and revenge.",81,Drama,callback,tt0315354
0,4.4,Jordan Walker-Pearlman,Jordan Walker-Pearlman,A painter living in exile returns home where his family endured generations of racial violence. There he begins to fantasize the people around him as a series of portraits in order to bury the pain and find something beautiful to feel.,96,Drama,constellation,tt0315431
67,5.1,Monika Mitchell,"['Frank Cassini', 'John Cassini']","A talented, but struggling actor is willing to go to any length to get a job - including ""break a leg""... especially those of other actors.",98,Drama,break a leg,tt0315323
55,6.4,Wayne Wang,"['Kate Di', 'Camillo', 'Joan Singleton']",-,106,Drama,because of winn-dixie,tt0317132
,6.9,Eduardo Mignogna,"['Graciela Maglie', 'Eduardo Mignogna']","After the funeral of his daughter Ema, Frank Osorio travels for the first time to Buenos Aires to tell his granddaughter Alina about her mother's death. But Frank has two big secrets: the first one is about the identity of Alina's father and the second one is related to a crime.",92,Drama,el viento,tt0318765
71,6.5,Mike Mills,"['Walter Kirn', 'Mike Mills']",-,96,Drama,thumbsucker,tt0318761
,6.1,Atilio Perin,"['Jimmy La', 'Valle', 'Juan Carlos Muñiz']","Four retirees inexperienced in the art of crime, plan to kidnap a businessman for ransom.",88,Drama,dar de nuevo,tt0319250
40,7.3,Ridley Scott,William Monahan,-,144,Drama,kingdom of heaven,tt0320661
,2.8,Daniel Fridell,"['Daniel Fridell', 'Liam Leon', 'Grace Maharaj']",30-year-old Jon is released after seven years in prison and decides to put all his criminal activities behind him and start a new life.,90,Drama,blodsbröder,tt0321463
,-,Óscar Aizpeolea,Óscar Aizpeolea,-,115,Drama,el fuego y el soñador,tt0322346
,6.4,Alejandro Hartmann,Alejandro Hartmann,-,95,Drama,clon,tt0321722
,6.8,Ruba Nadda,Ruba Nadda,"One day, when Sabah least expects it, she falls in love with the wrong man. She's Muslim, he's not. Unbeknownst to her family, she goes on a whirlwind affair before both culture and love collide.",86,Drama,sabah,tt0325191
,6.5,Tizuka Yamasaki,Tizuka Yamasaki,"In 1908, Titoe leaves her country, Japan, to try her luck in Brazil. Her intention is just to get rich and return in five years. But life has other plans for her.",131,Drama,gaijin - ama-me como sou,tt0325444
44,5.0,Jay Anania,Jay Anania,"Two strangers refuse to leave the seaside home of a couple, which leads to sexual tension and crime.",85,Drama,her name is carla,tt0326367
38,6.6,John Dahl,"['William B. Breuer', 'Hampton Sides', 'Carlo Bernard']",-,132,Drama,the great raid,tt0326905
39,5.3,Michael Parness,Michael Parness,A suicidal comedy about two young lovers who get married and escape from a mental institution in search of new ways to die...and the white light.,115,Drama,my suicidal sweetheart,tt0328121
60,5.3,Akbar Khan,"['Mohafiz Hyder', 'Akbar Khan', 'Fatima Meer']","The story of Shah Jahan...the love of his life...the life of his love...and his monument to love, the Taj Mahal.",164,Drama,taj mahal: an eternal love story,tt0328503
43,6.2,"['Bobby Farrelly', 'Peter Farrelly']","['Lowell Ganz', 'Babaloo Mandel', 'Nick Hornby']",Lindsay is stuck in the middle of her relationship with Ben and his passion for the Boston Red Sox.,104,Drama,the perfect catch,tt0332047
,7.7,Jordi Torrent,Jordi Torrent,-,97,Drama,l'est de la brúixola,tt0336392
67,5.8,Michael Phillip Edwards,Michael Phillip Edwards,"When Christopher confronts his own violent temper which threatens his wife and children, he flies home to Jamaica and engages in an exorcism of the spirit, from his memories of his abusive, philandering, and hard-living father Henry, whose name for his only son was ""Runt"".",-,Drama,runt,tt0337122
32,3.0,Vasiliy Chiginskiy,"['Oleg Kapanets', 'Alex Kustanovich']","Its codename is Sabertooth, a top-secret Russian stealth fighter jet that could tip the world's military strategic balance. But when someone begins assassinating the project's top test pilots, maverick C.I.A. boss Henry York (Armand Assante) launches a surveillance of international arms dealer Dick Murdock (Malcolm McDowell).",109,Drama,mirror wars: reflection one,tt0337678
50,7.4,Goran Gajic,"['Danielle Durini', 'Aleks Lyons', 'Tommy G. Warren']",When a woman is faced with her greatest fear...her husband and friends and affected in ways they had never expected.,88,Drama,the inner circle,tt0337646
50,7.4,Goran Gajic,"['Danielle Durini', 'Aleks Lyons', 'Tommy G. Warren']",When a woman is faced with her greatest fear...her husband and friends and affected in ways they had never expected.,88,Drama,the inner circle,tt0918531
17,4.8,John Irvin,"['Andrew Charas', 'Robert Malkani']",A detective tries to hunt down a serial killer who broadcasts his murders live on the internet.,87,Drama,dot.kill,tt0337610
21,5.1,Stu Pollard,Stu Pollard,"In the perfectly normal town of Louisville, KY, there is a perfectly normal man living the perfect life. David Dailey is a man who has it all: A great career, a community that adores him, and an enduring marriage. But beneath the surface, David's idyllic world is crumbling. He's haunted by a series of mysterious notes that warn of an imminent fall from grace. His sult... Leer todo",94,Drama,keep your distance,tt0337656
43,4.1,"['Tim Mc', 'Cann']","['Tim Mc', 'Cann']",A desperate man ventures into a dangerous and sordid underworld of crime and pornography in search of his severed genitalia which is held for ransom by his disgruntled former girlfriend.,78,Drama,nowhere man,tt0338294
33,4.9,Tony Fisher,Tony Fisher,"After a failed romance, Matt dates a string of women and falls for his mate?s girlfriend in his quest to understand the opposite sex.",80,Drama,the trouble with men and women,tt0337735
,6.9,Christian Alvart,Christian Alvart,-,127,Drama,antikörper,tt0337573
7,5.1,Katrina Holden Bronson,Katrina Holden Bronson,-,100,Drama,daltry calhoun,tt0339642
,6.3,Anand Tucker,Steve Martin,"A film adaptation of Steve Martin's novel about a complex love triangle between a bored salesgirl, a wealthy businessman and an aimless young man.",106,Drama,shopgirl,tt0338427
,5.3,"['Julian Adams', 'A. Blaine Miller']","['Julian Adams', 'Weston Adams', 'Joshua Lindsey']","The true love story of the conflict between Captain Robert Adams' dedication to the south, and his love for Eveline McCord, his beloved from the north. Produced, written, and directed by the descendants of Robert and Eveline, this American Civil War tale is an explosive, richly detailed saga of fierce combat, honor and the will to risk all that's precious for love or ... Leer todo",96,Drama,strike the tent,tt0339743
37,6.5,Thomas Vinterberg,Lars von Trier,-,105,Drama,dear wendy,tt0342272
,8.1,Topher Straus,"['Smith Glover', 'Topher Straus']",-,-,Drama,krush,tt0342640
50,7.2,Lars von Trier,Lars von Trier,-,139,Drama,manderlay,tt0342735
35,6.5,Florent-Emilio Siri,"['Robert Crais', 'Doug Richardson']",-,113,Drama,hostage,tt0340163
,4.7,Lars Johansson,Lars Johansson,"Eskil is forty years old and loads luggage at Arlanda airport. At home in the small town where Eskil grew up, however, everyone believes that he is a doctor.",86,Drama,halva sanningen,tt0342504
66,7.0,Louis Leterrier,Luc Besson,-,103,Drama,unleashed,tt0342258
,5.7,Monty Lapica,Monty Lapica,A pill-popping mom has her drug-abusing teen son abducted into a private intervention facility that means well.,107,Drama,self medicated,tt0341569
,7.9,Rob Nilsson,Rob Nilsson,"NEED is film #6 in the nine film 9@ Night cycle. A cinema portrait of 40-50 inner city characters living in the San Francisco Tenderloin circa 2001-2005 cast from the Tenderloin yGroup Actor's Ensemble. NEED goes into the shady alleys and smoky bars explored in many films with ""noir"" pedigree and genre intentions but takes a different tack. It tries to avoid the stere... Leer todo",95,Drama,need,tt0342823
,6.2,"['Stephen Quay', 'Timothy Quay', 'Weiser Quay']","['Alan Passes', 'Stephen Quay', 'Timothy Quay']",Dark fairy-tale about a demonic doctor who abducts a beautiful opera singer with designs on transforming her into a mechanical nightingale.,99,Drama,the pianotuner of earthquakes,tt0342882
79,6.5,Andy Garcia,"['Guillermo Cabrera Infante', 'D. Daniel Vujic']",A wealthy Havana club owner and his family are torn apart by the violent sociopolitical upheaval brought about by the transition from the dictatorial regime of Batista to the Marxist revolution led by Fidel Castro in 1950s Cuba.,144,Drama,the lost city,tt0343996
,7.6,Klaus Härö,"['Veikko Aaltonen', 'Heikki Hietamies', 'Jimmy Karlsson']","During World War II, more than 70,000 Finnish children were evacuated to neutral Sweden to avoid the conflict. From the award-winning Klaus Härö (Elina - Som om jag inte fanns (2002)), ""Mother of Mine"" tackles that painful patch of history in a tale of 9-year-old Eero, a child who increasingly feels abandoned by his biological Finnish mother and yet not attached to hi... Leer todo",111,Drama,äideistä parhain,tt0343221
,6.7,Alan Berger,Alan Berger,"Presented with an ultimatum by the Mrs. (she wants another child; Tom thinks one's enough, especially since their brood is in rehab: ""What are you going for, group discount?""), Tom finds himself out in the world, alone. Tom's life goes in a tailspin as he juggles alimony and rehab payments while his job goes south, courtesy of his corrupt partner Mike. Yet he manages ... Leer todo",78,Drama,halfway decent,tt0345370
,6.5,Ketan Mehta,"['H. Banerjee', 'Farrukh Dhondy', 'Ranjit Kapoor']",This is a film about the leader of the 1857 mutiny and his fight against the British rule.,150,Drama,mangal pandey: the rising,tt0346457
,4.2,Bob Decout,"['Bob Decout', 'Thierry Forte']",-,94,Drama,les gens honnêtes vivent en france,tt0347056
40,6.7,"['Leslie Mc', 'Cleave']","['Leslie Mc', 'Cleave']","Two exes take a dual-purpose road trip: allow Margaret (Catherine Kellner), a freelance photographer, to complete her assignment to check up on toxic waste sites along the U.S.-Canadian border, and deliver Jay (Ebon Moss-Bachrach) home to his mother's house in Detroit. The trip takes a turn for the weird as they begin to suspect they are trapped.",92,Drama,road,tt0347884
36,6.1,David Mackenzie,"['Patrick Mc', 'Grath', 'Patrick Marber', 'Chrysanthy Balis']",-,99,Drama,asylum,tt0348505
52,7.0,Lasse Hallström,"['Mark Spragg', 'Virginia Korus Spragg']",-,108,Drama,an unfinished life,tt0350261
,6.2,Colette Bothof,Arend Steenbergen,"Two passionate people, Marleen and Vince, embark on a scorching love affair. They are sucked down by the fierceness of their feelings..",95,Drama,zwarte zwanen,tt0350374
,7.6,Shyam Benegal,"['Atul Tiwari', 'Shama Zaidi']",-,208,Drama,netaji subhas chandra bose: the forgotten hero,tt0349878
80,8.0,Ron Howard,"['Cliff Hollingsworth', 'Akiva Goldsman']",-,144,Drama,cinderella man,tt0352248
38,3.9,Eric G. Johnson,Eric G. Johnson,"Tweek City is a week in the life of Bill, a potentially closeted, half-Latino, small-time speed dealer in San Francisco's Mission District. Bill is stuck on an endless walk from one empty experience to the next. Only Bill's friend Jerm has the ability to connect and ground him in reality. When Jerm makes an ill-advised stage dive, Bill plunges into a downward spiral t... Leer todo",86,Drama,tweek city,tt0351885
,7.3,Mark Mueller,"['Virtic Brown', 'Rajan Shandil']",-,93,Drama,will unplugged,tt0353008
,6.5,Nikolaj Feifer,Nikolaj Feifer,"Karen is a young girl living in an orphanage. She has a hard time accepting the death of her only brother, and every night she talks about the world she thinks he is really living in; a special world where he may be able to trick death and come back to her.",50,Drama,solopgang,tt0354034
55,7.1,Catherine Hardwicke,Stacy Peralta,-,107,Drama,lords of dogtown,tt0355702
26,6.1,David Anspaugh,"['Geoffrey Douglas', 'Angelo Pizzo']","Based on a true story, this film tells the tale of the 1950 U.S. soccer team, who, against all odds, beat England 1 - 0 in the city of Belo Horizonte, Brazil. Although no U.S. team has ever won a World Cup title, this story is about the family traditions and passions which shaped the lives of the players who made up this team of underdogs.",101,Drama,the game of their lives,tt0354595
47,5.9,Kriv Stenders,"['Kriv Stenders', 'David Snell']","""The Illustrated Family Doctor"" is a dark comedy, that centres on the story of Gary Kelp, a young man who condenses reference books for a company called the Info Digest.",102,Drama,the illustrated family doctor,tt0355563
47,6.5,Rebecca Miller,Rebecca Miller,-,112,Drama,the ballad of jack and rose,tt0357110
,-,Javier van de Couter,Javier van de Couter,-,65,Drama,perro amarillo,tt0357005
52,6.3,Thomas Bezucha,Thomas Bezucha,-,103,Drama,the family stone,tt0356680
13,4.2,Stephen Kay,"['Eric Kripke', 'Juliet Snowden', 'Stiles White']",-,89,Drama,boogeyman,tt0357507
,6.2,Gustavo Postiglione,Gustavo Postiglione,-,65,Drama,ipanema,tt0356747
82,7.8,James Mangold,"['Johnny Cash', 'Gill Dennis', 'James Mangold']",-,136,Drama,walk the line,tt0358273
,6.3,Erich Lyttle,-,"Despite living in one of the most affluent countries in the world, millions of people in the United States live in poverty, and hundreds of thousands are homeless. Jaymo, an aspiring filmmaker, suddenly finds himself homeless and living out of his car. Desperate to find his way out, he begins shooting a documentary about the overlooked homeless people in this sharply ... Leer todo",90,Drama,have you seen clem,tt0359389
40,5.6,Matthew Cole Weiss,"['Matthew Perniciaro', 'Timm Sharp']",Standing Still is the story of a popular yet drunken actor who reconnects with a group of his college friends for a wedding several years after graduation.,90,Drama,standing still,tt0360016
36,4.1,Stephanie Sinclaire,Stephanie Sinclaire,"The tale of two sisters, bound by more than blood, who bring home a man on a dare, only to see the situation spiral out of control.",88,Drama,silence becomes you,tt0359984
,7.5,Joshua Rofé,Joshua Rofé,-,-,Drama,brooklyn battery,tt0359243
,-,Patricia Martín García,"['Patricia Martín García', 'Elsa Ramos']",-,102,Drama,el jardín de las hespérides,tt0361767
,4.6,Mark Clayborne,Keith Moody,"Ron (Brice McMillon) is a rapper who becomes the victim of flimflam thanks to his record label's duplicitous CEO (Maleik Ramsey). The rat refuses to fork over $1 million in bank royalties for it seems he funneled the cash into drug deals with the Russian mob. So, Ron joins forces with his brother, a narc and the DEA to set up the mogul. But when the deal finally goes ... Leer todo",90,Drama,the record deal,tt0361400
84,7.2,Peter Jackson,"['Fran Walsh', 'Philippa Boyens', 'Peter Jackson']",-,187,Drama,king kong,tt0360717
55,6.3,Don Roos,Don Roos,"Happy Endings weaves multiple stories to create a witty look at love, family and the sheer unpredictability of life itself.",128,Drama,happy endings,tt0361693
,4.5,Luis Ortega,"['Carolina Fal', 'Luis Ortega']","The godmother and Pearl are the world for ""la nenita"", a world delimited by the four walls of a one room with a single window that faces nowhere. They only alter the space and the monotony, the sessions of blood transfusion to which Pearl must be subjected and the almost anonymous sexual encounters of the girl.",83,Drama,monobloc,tt0362873
,6.6,Julia Solomonoff,Julia Solomonoff,-,88,Drama,hermanas,tt0362718
95,7.2,Carroll Ballard,"['Carol Cawthra Hopcraft', 'Xan Hopcraft', 'Carol Flint']",An orphaned cheetah becomes the best friend and pet of a young boy living in South Africa.,100,Drama,duma,tt0361715
60,4.1,Dharmesh Darshan,"['Dharmesh Darshan', 'Raj Sinha']","Anjali sacrifices her love for Raja after her sister's death and marries her brother-in-law. Years later, she meets Raja and is torn between him and her loyalties.",151,Drama,bewafaa,tt0363472
98,2.5,Sam B. Lorn,Sam B. Lorn,"Faced with the pressures of family, tradition, and culture, a Cambodian woman is forced into a marriage to a man she doesn't know. Love has its own plan when she meets another man and falls in love. Now she must choose to honor her family's wishes or follow her heart.",93,Drama,lovesick,tt0363778
100,6.5,Art Jones,Art Jones,"""Lustre"" chronicles a change in heart, a spiritual awakening through the rise of an unlikely holy man. Filmed on the streets of New York in the year after the Twin Towers fell, ""Lustre"" tells a story of renewal in uncertain times.",81,Drama,lustre,tt0363779
,5.6,Steven Woodcock,"['John Braine', 'Steven Woodcock']",A reserved schoolteacher battles against family conflict when he falls in love with the 'wrong' young woman.,91,Drama,the jealous god,tt0363713
12,5.9,Al Corley,Rodney Patrick Vaccaro,-,106,Drama,bigger than the sky,tt0363504
67,6.9,Van Fischer,Tim Boughn,"Like most kids, Ned idolized his father and dreamed of following in his footsteps. Unfortunately, his father was a two-bit crook who spent most of his life in jail. Without a family of his own, Ned falls in with the Aryan Brotherhood. Soon after, Ned is placed in a mental hospital where he is mesmerized by a young black girl who believes Adolf Hitler was reincarnated ... Leer todo",97,Drama,neo ned,tt0364556
,7.0,Robert Guédiguian,"['Georges-Marc Benamou', 'Gilles Taurand']",A young journalist (Lespert) helps the French President compile his memoirs.,116,Drama,le promeneur du champ de mars,tt0364301
13,3.6,Karl Kozak,"['Karl Kozak', 'Don J. Rearden']","When a group of poachers are found dead in the deep forests of the Pacific Northwest, a mob of revenge hungry hunters pursue the beast while four high school seniors try to save it.",85,Drama,the unknown,tt0364616
,7.6,Israel Adrián Caetano,"['Victoria Carreras', 'Roberto Gispert', 'Daniel Kuzniecka']",-,80,Drama,después del mar,tt0365117
74,6.8,Mike Binder,Mike Binder,-,118,Drama,the upside of anger,tt0365885
,6.8,"['Martín De Salvo', 'Vera Fogwill']",Vera Fogwill,-,97,Drama,las mantenidas sin sueños,tt0365479
,-,Jim Boukis,"['Yiorgo Aretos', 'Allison Cameron Gray']",Overcoming one's addictions is more difficult as it appears. A satirical look at the dysfunctions of American Culture.,79,Drama,lickin' the quits: a slice of american culture,tt0365437
73,6.9,Stephen Gaghan,"['Stephen Gaghan', 'Robert Baer']",-,128,Drama,syriana,tt0365737
