puntuacion_rotten,puntuacion_imdb,direccion,guion,argumento,duracion,genero,titulo,id_pelicula
,7.2,Anne Riitta Ciccone,Anne Riitta Ciccone,"Three different stories in three different European countries, which are intertwined and almost echo each other. A young hostess afraid of flying, a painter working with a young talented Romani girl and a reporter who is in a state of trauma through experiences from war, keeping him from functioning normally and working.",123,Drama,il prossimo tuo,tt0847901
,3.0,Kalaprabhu Thanu,-,"Yuvraj and Deepali's relationship goes through several challenges when Yuvraj's cousin Reema, who loves Yuvraj, tries to interfere in their lives.",118,Drama,sakkarakatti,tt0848638
78,6.5,Spencer Parsons,"['Line Langebek Knudsen', 'Spencer Parsons']",-,112,Drama,i'll come running,tt0850674
,6.6,Andrey Slabakov,Andrey Slabakov,Two very similar families are settling in two identical houses in a new fashionable neighborhood built near a complex of panel-apartment buildings. The couples are in their forties. The husbands are moderate professionals and the wives are housewives without children and with firmly fixed habits. Step by step they find out how similar they are and step by step they co... Leer todo,100,Drama,hindemidth,tt0853186
,6.7,Kaige Chen,"['Kaige Chen', 'Geling Yan', 'Kuo-Fu Chen']","A biographical account of Mei Lanfang, China's greatest opera star.",150,Drama,mei lanfang,tt0851532
,5.7,Mircea Daneliuc,Mircea Daneliuc,"In a village where bird flu is declared, three young men eager to immigrate get in touch with a businessman who may facilitate their entry into the Foreign Legion.",91,Drama,legiunea straina,tt0853129
,4.4,Adam Martin,Arnfinn Christensen,"Sarah Good is a 14 year old American girl and a talented show jumper. Therefore, no one understands why she suddenly loses control of her horse at a show, and badly injures herself. Sarah herself knows why she fell. In the middle of her jump she had a vision of her long lost grandmother Gudrun Schillingmeyer saying good bye. At the same time an old lady is put to rest... Leer todo",100,Drama,monocerus,tt0852982
,5.8,"[""Derrick 'D-Reck' Dixon"", 'Trey Haley']","[""Derrick 'D-Reck' Dixon"", 'CJ Johnson', 'Chris Johnson']","Movie that chronicles Mikes Jones' real life rise to fame as an aspiring rapper from the streets who finds his path in life through music in his hometown of Houston, Texas.",90,Drama,american dream,tt0855006
,7.6,Yôji Yamada,"['Teruyo Nogami', 'Yôji Yamada', 'Emiko Hiramatsu']",Based on childhood days of Teruyo Nogami.,133,Drama,kâbê,tt0855852
27,6.7,Neil Thompson,"['Geoff Thompson', 'Jim Cartwright']","An underworld drama set in the early 1980s, about a lonely factory worker whose life is transformed when he becomes a nightclub doorman.",95,Drama,clubbed,tt0856778
50,6.1,Noam Murro,Mark Poirier,Into the life of a widowed professor comes a new love and an unexpected visit from his adopted brother.,95,Drama,smart people,tt0858479
80,6.8,Chris J. Ford,Chris J. Ford,A fading smalltime barber is forced to hire the last person on earth he'd want working in his shop - a woman.,99,Drama,the village barbershop,tt0859644
50,5.7,"['Logan Miller', 'Noah Miller']","['Logan Miller', 'Noah Miller']",The true story about a father struggling to make amends with his twin sons as they pursue their dreams of professional baseball.,108,Drama,touching home,tt0860870
44,6.5,Fernando Meirelles,"['José Saramago', 'Don Mc', 'Kellar']",-,121,Drama,blindness,tt0861689
22,5.4,Lindsey Christian,"['Sia Barnes', 'Erica Chamblee', 'Lindsey Christian']","When Jasmine ""Jazz"" Morgan loses her mother to a long-time battle with lung cancer, she can only focus on one thing - becoming a famous singer. Ignoring the wishes of her father, Blair Morgan a strict doctor who prefers that she return to college, Jazz spends the summer entrenched in the hyper-sexualized, drug-influenced DC music scene, dragging along her younger, mor... Leer todo",79,Drama,jazz in the diamond district,tt0861779
74,6.8,Christine Jeffs,Megan Holley,-,91,Drama,sunshine cleaning,tt0862846
85,7.2,Elissa Down,"['Elissa Down', 'Jimmy The Exploder']",-,97,Drama,the black balloon,tt0865297
57,5.5,Geo Santini,"['Jason Hice', 'Geo Santini', 'Christine Conradt']","When Troy turned on crime boss Dmitri Debartolla he was forced to leave Los Angeles and lay low in Miami. After two years, and the loss of his leg in a shootout with a Cuban crime syndicate, Troy returns to LA to reclaim what is rightfully his. A reunion with his former partners in a rundown hotel sets the stage for an explosive encounter where past and present collid... Leer todo",95,Drama,hotel california,tt0866435
62,6.9,Saul Dibb,"['Jeffrey Hatcher', 'Anders Thomas Jensen', 'Saul Dibb']",-,110,Drama,the duchess,tt0864761
12,4.9,Gregor Jordan,"['Bret Easton Ellis', 'Nicholas Jarecki']",-,98,Drama,the informers,tt0865554
,5.1,Richard Kaponas,Brian Eric Johnson,-,95,Drama,ranchero,tt0867411
38,4.6,Vince Di Meglio,"['Tim Rasmussen', 'Vince Di Meglio']",-,92,Drama,smother,tt0867591
12,3.5,Douglas A. Raine,"['Scott Kenyon Barker', 'Douglas A. Raine']",A documentary filmmaker finds himself drawn into the seedy world of a snuff filmmaker with a mysterious dark side.,84,Drama,from a place of darkness,tt0867295
48,6.4,Dan Ireland,"['Dennis Yares', 'E.L. Doctorow', 'Michael Gilio']",-,121,Drama,jolene,tt0867334
,5.2,Charlie Levi,Charlie Levi,"Katherine is a typical teenager. Today's her funeral. The four adults in her life have a lot on their mind - and it's not all about Katherine either. With a frankness that's strikingly disarming as well as frequently self-serving, the grown-ups struggle with being... well... grown-up.",90,Drama,childless,tt0867270
43,4.2,Jason Paul Collum,Jason Paul Collum,"Two years after their loved ones were murdered in obsessive rage, the survivors are dragged into a horrific psychological breakdown - and blood soaked plan for revenge.",103,Drama,october moon 2: november son,tt0870176
93,7.7,Ron Howard,Peter Morgan,-,122,Drama,frost/nixon,tt0870111
,7.4,Daniel Davila,"['Karim Ahmad', 'Daniel Davila', 'Cliff Traiman']","In a rundown apartment complex in San Francisco's Tenderloin, a septuagenarian seer is waiting for his final message. For decades the eccentric recluse has chronicled the phrases of the Wheel of Fortune and deciphered their hidden meaning - the details of a mission to save his neighbors from their troubles.",95,Drama,harrison montgomery,tt0870118
97,4.6,Cornelia Duryée,Cornelia Duryée,"The Dark Horse is a story of struggle and redemption. Dana, a ballet teacher, reluctantly returns to her childhood home to discover it is about to be sold. To save the farm, and the family, she must tame her mother's dangerous black horse, and ride him to victory in the year's biggest dressage competition.",105,Drama,the dark horse,tt0870101
25,6.6,Yen Tan,"['Alessandro Calza', 'Yen Tan']",-,87,Drama,ciao,tt0870089
,4.1,K.P. Kumaran,"['Henrik Ibsen', 'K.P. Kumaran']","Albert Samson, a successful architect, and Alice are leading an unhappy married life because of Samson's ambitious and egoistic nature. Hilda Varghese enters Samson's life and changes it completely.",-,Drama,akasha gopuram,tt0867235
,4.2,Robert Malenfant,"['Jacques Haitkin', 'Jacques Haitkin', 'Robert Malenfant']","Matt and Julia aren't having the greatest relationship on earth. They've got a successful advertising agency but Matt suspects his wife of having an affair and is getting so obsessed with this thought that he's actually asked his co-worker Trevor Jones to have her followed. Trevor, who wants to become partner in the company, does as requested and when he brings pictur... Leer todo",93,Drama,clean break,tt0867464
66,6.8,Cédric Klapisch,Cédric Klapisch,-,130,Drama,paris,tt0869994
44,5.8,Christian Duguay,"['Agatha Dominik', 'John Cox']",-,99,Drama,boot camp,tt0870204
60,6.2,"['Darren Grodsky', 'Danny Jacobs']","['Darren Grodsky', 'Danny Jacobs']","A disillusioned medical student is stranded for a summer in a remote community of counterculture pot farmers, the last place in the world he imagined he would discover himself.",97,Drama,humboldt county,tt0870122
38,7.0,Sarab Neelam,"['Sarab Neelam', 'V. Prasad']","As a Sikh man with a full beard and turban, Amrit Singh is often the target of racial profiling. But when he sees his dreams of becoming Chief of Surgery at a state-of-the-art transplant center dwindle because of his appearance, Amrit goes against a tradition he's maintained his whole life and cuts his hair. Hiding this decision from his girlfriend and family in Toron... Leer todo",97,Drama,ocean of pearls,tt0871438
90,5.2,Duane Hopkins,Duane Hopkins,"A group of young people grow up together in a small, rural community in the Cotswolds.",93,Drama,better things,tt0872245
25,4.9,Tate Taylor,Tate Taylor,"Lucy has always used food to escape life's problems, but when this self-titled ""fat friend"" lures her group of old college buddies to the Montana wilderness, she reveals a new self - skinny, beautiful and still flawed.",99,Drama,pretty ugly people,tt0874425
40,6.2,Geoffrey Haley,Geoffrey Haley,A man (Bentley) who makes his living composing other people's suicide notes enters into a romance with the sister (Ryder) of a recent client.,90,Drama,the last word,tt0876233
12,5.7,"['Hunter Hill', 'Perry Moore']","['Hunter Hill', 'Perry Moore']","A desperate young man, on the run from a dangerous drug dealer, returns to his mother, years after a family tragedy drove them far apart, to hide. However, his old and new life are about to collide.",93,Drama,lake city,tt0875705
60,6.6,Paula van der Oest,Paula van der Oest,"Bookkeeper Jacob newest client is the talented and flamboyant actress Anne. They first meet each other on her houseboat, the morning after the premiere of Anne's new theatrical play. Jacob soon discovers that Anne has made a mess of her personal finances and that she has several debts. She may even have to sell her houseboat. Anne gets into a blind panic as she defini... Leer todo",90,Drama,tiramisu,tt0875701
,5.8,Pascal-Alex Vincent,"['Pascal-Alex Vincent', 'Olivier Nicklaus', 'Martin Drouot']",Twin 18-year-olds hitchhike to their mother's funeral in Spain. The journey changes their lives forever.,80,Drama,donne-moi la main,tt0877700
,5.7,Michael Almereyda,"['Michael Almereyda', 'Katya Apekina', 'James Robison']","A year after Hurricane Katrina, Henry, a surgeon in the affluent Garden District of New Orleans, is attempting to get his life back on track. He is remarrying his ex-wife, renovating her house and restarting his medical practice. But things begin to derail when he runs into an old flame, Hyde, a younger woman was has returned to New-Orleans to become a relief worker i... Leer todo",78,Drama,"new orleans, mon amour",tt0878700
,5.4,Peter Kahane,"['Kurt Held', 'Peter Kahane', 'Ronald Kruschak']",A female-led gang of orphaned teenagers fights corruption.,99,Drama,die rote zora,tt0878709
,-,Georges Terryn,-,"On Flanders' biggest movie set, Tania, the make-up artiste wants to make her debut in front of the camera. The cast is not amused and teach her how to act.",75,Drama,make-up,tt0878818
50,5.6,Edward Anderson,Edward Anderson,A late night airport shuttle ride home descends into darkness.,107,Drama,shuttle,tt0880648
40,5.8,Erik S. Weigel,"['Salvatore Interlandi', 'Erik S. Weigel']","Elliot, 31, a product of the Washington D.C. foster care system, has spent most of his life moving from place to place. When he is contacted by Matthew, a childhood friend from ""the system"" dying of cancer, Elliot goes to be by his side. At the funeral, he meets Gray and Lily, two friends of Matthew, both aimless in their present lives. Motivated by their sense of los... Leer todo",91,Drama,el camino,tt0884038
60,5.3,Matthew Miele,Matthew Miele,Ensemble drama about conversations overheard in a bistro: two chess players see unfolding dramas; a couple endures an uncomfortable blind date; a marriage crumbles; and film-noir fans think that they're witnessing a real-life murder.,99,Drama,eavesdrop,tt0882765
,6.1,Daniel Lee,"['Ho-Leung Lau', 'Daniel Lee', 'Guanzhong Luo']",-,102,Drama,three kingdoms,tt0882978
14,3.8,Anant Mahadevan,"['Daphne Du Maurier', 'Anant Mahadevan', 'Sameer']","Middle-classed, slender and petite Jia Rao meets Gajner's recently widowed Kunver Vikram Aditya Singh Sesodia, both fall in love, get married, and re-locate to live in his palace in Rajasthan. Jia finds out that everyone in the vicinity still believes that Vikram's first wife, Anamika, who allegedly met a sudden death, may still be alive, and actually witnesses an app... Leer todo",-,Drama,anamika: the untold story,tt0885398
,6.5,Carlos González Morantes,"['Carlos González Morantes', 'César Jaime']",-,90,Drama,crepúsculo rojo,tt0886472
78,7.0,"['Ethan Coen', 'Joel Coen']","['Joel Coen', 'Ethan Coen']",-,96,Drama,burn after reading,tt0887883
77,7.0,Jaffar Mahmood,Jaffar Mahmood,"Ray's half Pakistani and half white. When his parents' marriage dissolves, Ray's perspective of Ms. Right falls deeply into question.",86,Drama,shades of ray,tt0886531
17,6.1,Bill Maher,Zac Stanford,The drama follows a twelve-year-old girl's struggle to come to terms with her mother's abandonment.,101,Drama,sleepwalking,tt0888693
29,6.1,Shawn Garry,Trinidad Jiménez,"A young Spanish girl develops an acute emotional crisis after her mother's death. When a letter written by the deceased mother surfaces, the grieving daughter departs to South America for answers.",100,Drama,desierto sur,tt0886476
,-,Todd Densmore,Todd Densmore,"Rob, Kevin, and Cameron walk through a life of drugs, women, and stealing to get by. But when a dark secret is brought to light, the three embark on a journey of self-realization and finally find out what it is like to feel again.",100,Drama,damaged goods,tt0888688
38,4.8,Susan Montford,"['Edward Bryant', 'Susan Montford']","A woman out late for Christmas Eve shopping is soon terrorized by a small gang of troublemakers, and she must fight for her life.",86,Drama,while she was out,tt0887971
97,7.5,Kathryn Bigelow,Mark Boal,-,131,Drama,the hurt locker,tt0887912
40,5.5,Peter Tolan,Peter Tolan,A television producer with a penchant for drinking and gambling is sent to Las Vegas to convince his troubled niece to enter rehab.,96,Drama,finding amanda,tt0889134
31,7.0,Roger Spottiswoode,"['Jane Hawksley', 'James Mac', 'Manus', 'Simon van der Borgh']",-,125,Drama,the children of huang shi,tt0889588
44,6.2,James Bolton,"['James Bolton', 'Jim Grimsley']","Based on the novel ""Dream Boy"" by Jim Grimsley, this film chronicles the relationship between two gay teenagers in the rural south in the late 70's.",88,Drama,dream boy,tt0889595
,5.9,Róbert Alföldi,"['Róbert Alföldi', 'Attila Bartis', 'Betti Berényi']",-,108,Drama,nyugalom,tt0891549
67,7.1,Steven Soderbergh,"['Peter Buchman', ""Ernesto 'Che' Guevara""]",-,134,Drama,che: part one,tt0892255
,7.5,John Lavachielli,John Lavachielli,-,-,Drama,wednesday again,tt0892393
62,5.1,John Krueger,John Krueger,Two brothers are forced to confront a terrible crime that was hidden in their past.,110,Drama,the fall,tt0460791
62,5.1,John Krueger,John Krueger,Two brothers are forced to confront a terrible crime that was hidden in their past.,110,Drama,the fall,tt0893325
22,6.0,Paris Leonti,Paris Leonti,"Alex masterminds an ambitious plan to steal millions of untraceable cash that is stacked in the underground vaults of The London Exchange Bank, waiting for its last journey, Incineration. Lucky, Matty, Terry, Chubby, Norman and Jay make up his unlikely gang of robbers. Setting up their alibi, the gang check in for a flight and join in with thousands of England support... Leer todo",99,Drama,daylight robbery,tt0893401
57,6.0,"['Gerald Mc', 'Morrow']","['Gerald Mc', 'Morrow']","A portrait of the broken lives of four people (a vigilante detective, a worried parent, an awkward man looking for love and a suicidal artist) as they all struggle to cope in their religiously-dystopian city.",98,Drama,franklyn,tt0893402
18,4.5,Alan Pao,"['Kyle Kramer', 'Corey Large', 'S.A. Lucerne']","A young, wealthy club kid's life spirals downward into an out-of-control world of drugs, sex and violence.",98,Drama,loaded,tt0893406
47,6.0,Rajkumar Santoshi,"['Ranjit Kapoor', 'Dushyant Kumar', 'Sameer']",A popular Bollywood actor witnesses a murder but refuses to come forward to identify the killer(s).,142,Drama,halla bol,tt0892874
27,5.8,Jodie Markell,Tennessee Williams,"A rebellious socialite defies social conventions for a once-in-a-lifetime shot at true love, only to see her hopes shattered after a priceless diamond vanishes into thin air. Adapted from a long-lost Tennessee Williams screenplay.",102,Drama,the loss of a teardrop diamond,tt0896031
,4.8,Hark Tsui,Hark Tsui,"After her husband is killed in a mysterious accident, a widow is haunted by images of things she has never seen or experienced.",118,Drama,sam hoi tsam yan,tt0896815
32,5.5,Yam Laranas,"['Eric Bernt', 'Shintaro Shimosawa', 'Yam Laranas']","An ex-con moves into an old apartment building, where he encounters a domestic problem involving a police officer, his wife, and their daughter. When he tries to intervene, however, a mysterious curse entraps him.",96,Drama,the echo,tt0897347
,6.0,Lucas Fernández,"['Lucas Fernández', 'Eduardo del Llano']","""Óscar. The Color of Destiny"" is a revealing portrayal of a forgotten icon of French Surrealism: Spanish painter Óscar Domínguez, contemporary of Picasso. The film rediscovers the life of a talented artist who was ignored after he committed suicide, fifty years ago, victim of a serious illness which had disfigured his body: the Elephant Man's disease. The film is stir... Leer todo",108,Drama,óscar. una pasión surrealista,tt0899303
17,6.1,William Olsson,Alex Metcalf,"In 1963, during the swirl of glamour and intrigue that turned President John F. Kennedy's Washington into Camelot, a lonely 13-year-old Catholic school boy comes of age.",93,Drama,an american affair,tt0899138
,5.9,Leandro Ferreira,Luís Mário Lopes,-,90,Drama,do outro lado do mundo,tt0900924
17,8.0,Ashok Baker,"['Ashok Baker', 'Ashley Michaelis']","'Reflections' is a social drama turned thriller that looks at how teenagers are stereotyped within society simply by the clothes they wear and the first impressions they give. It is a thought provoking and intelligent look at how things aren't always what they first appear to be. The theme runs throughout the story of Thomas Dean Anderson, also known as Tom, and his s... Leer todo",95,Drama,reflections,tt0899164
10,5.1,Carolyn Miller,Carolyn Miller,A young married couple encounters a stranger who threatens their marriage and their lives.,85,Drama,under still waters,tt0902337
75,5.5,Jon Hewitt,"['S.P. Krause', 'Shayne Armstrong', 'Jon Hewitt']",Three teenagers blackmail a serial killer.,91,Drama,acolytes,tt0902952
,7.5,Vivi Stafford,Vivi Stafford,"Barry Berry is extra special. But that doesn't stop him from losing his job, or getting an ultimatum from his friend Mary. Next, poor Barry gets an out-of-the-blue demand from an ex-lover who is insisting he meet their child Erin. When it can't seem to get any worse, Barry fails desperately as he tries to impress both Mary and Erin while teaching touch therapeutics to... Leer todo",107,Drama,extra ordinary barry,tt0903133
100,4.8,Paul Holahan,Brooke Purdy,"Unexpectedly pregnant with no means to raise a child, Dina and Ronnie decide to sell their unborn baby over the Internet. Their plan begins to unravel when the couple they've chosen, Paul and Maria, turn out to have an agenda of their own.",93,Drama,hindsight,tt0902281
72,7.0,Erick Zonca,"['Roger Bohbot', 'Michael Collins', 'Camille Natta']",-,144,Drama,julia,tt0903627
,7.4,"['Gregori J. Martin', 'Darnell Williams']","['Gregori J. Martin', 'Roger Newcomb']",-,95,Drama,manhattanites,tt0906048
51,5.4,Sean Ellis,Sean Ellis,-,93,Drama,the broken,tt0906734
95,6.4,Erica Dunton,Erica Dunton,Twenty-seven is more than just a number. It is a lifetime.,94,Drama,the 27 club,tt0906783
16,5.1,David Michael O'Neill,Shawn TDavid Michael O'Neill,A day trader (Embry) and his fiancée (Robertson) get caught up in high stakes gambling.,91,Drama,player 5150,tt0906773
20,4.2,Brin Hill,"['Brin Hill', 'Matt de la Peña']","A skinny high school junior and basketball prodigy from Venice, California burdened with early life tragedy (callous foster care) and Obsessive-Compulsive disorder, Sticky manages to surpass his limits whenever he has a ball in his hands.",102,Drama,ball don't lie,tt0906727
65,6.4,John Humber,Chad J. Shonk,"A girl with the supernatural ability to see through other peoples' lies, falls in love with a mysterious boy who always tells the truth.",89,Drama,dakota skye,tt0907848
-,5.7,Ashlon Langley,Ashlon Langley,"William Dane (Astin) is a down-on-his-luck hospice worker who loses his job. With his sick mother (Duke) under his care and no source of income, he finds a job with an eccentric and once-prominent author. The author, Tander Welch (Pryor), is very sick and asks William to do a job that seems outside of his moral boundaries but first he must travel across the country an... Leer todo",86,Drama,the four children of tander welch,tt0910553
,7.6,Doris Dörrie,Doris Dörrie,"After Rudi's wife Trudi suddenly dies, he travels to Japan to fulfill her dream of being a Butoh dancer.",127,Drama,kirschblüten - hanami,tt0910559
54,3.1,Gerson Sanginitto,"['Eliese Besemer', 'Paul Johnson', 'André Lima']","Martial arts champion Andre Lima's fighting days ended with his wife's death. The past nine years Andre has struggled to rebuild his world around his two children. When his daughter's health suddenly fails, his finances collapse.",86,Drama,beyond the ring,tt0910993
71,6.3,Kornél Mundruczó,"['Yvette Biro', 'Kornél Mundruczó']","A man comes home to meet his mother and sister after many years away. He finds his mother living with a new boyfriend, and his sister to be grown-up. He begins to settle down in this new place by building a new home for himself on the delta. But when his sister moves in with him and the two begin a romance, there are tragic consequences.",92,Drama,delta,tt0910860
,6.6,Andrea Martínez Crowther,Andrea Martínez Crowther,Esmeralda is a lonely teenager with a strange obsession : she gathers lost or left behind objects and keeps them in a box underneath her bed. This story tells the backgrounds of these objects.,98,Drama,cosas insignificantes,tt0910855
18,5.1,Tracey Hecht,Tracey Hecht,"While collaborating with an urban designer (Collins), an architect (Wilson) begins to second guess the perfect life he has constructed for himself and his family.",80,Drama,life in flight,tt0910915
64,6.0,Hideo Nakata,"['Tsugumi Ôba', 'Takeshi Obata', 'Hirotoshi Kobayashi']","A spin-out sequel to the popular Japanese thriller. This time it focuses on the character ""L.""",129,Drama,l: change the world,tt0912597
48,6.8,Randall Miller,"['Jody Savin', 'Randall Miller', 'Ross Schwartz']",-,110,Drama,bottle shock,tt0914797
40,5.6,Zackary Adler,John Bell,"Asks the question, Is it really possible to relate to ones parents and siblings after being replaced by the family dog? . . . Perhaps as friends - weird friends?",86,Drama,familiar strangers,tt0914845
,7.7,Mark Herman,"['John Boyne', 'Mark Herman']",-,94,Drama,the boy in the striped pyjamas,tt0914798
,6.8,Thomas Roth,Thomas Roth,"The life story of 1980s Austrian superstar Falco, the man behind the monster hit ""Rock Me, Amadeus."" The story of Johann ""Falco"" Hölzel from his childhood, the road from a band to his solo career, to his tragic death.",109,Drama,"falco - verdammt, wir leben noch!",tt0915457
,5.0,Russ Emanuel,"['Emilio Iasiello', 'Mark Mc', 'Quown']","A doctor tries to solve the mystery of a man with no name, multiple personalities and burns on his hands. Who is he and what happened to him?",91,Drama,p.j.,tt0914380
54,4.0,Chris Angel,Chris Angel,Carl becomes so obsessed with his fear of a terrorist nuclear attack on Los Angeles that he destroys his marriage.,89,Drama,this is not a test,tt0915473
0,4.2,Steven Tanenbaum,Steven Tanenbaum,"Coming Soon is a film about that one, often unnoticed moment that can change everything.",94,Drama,last call,tt0914362
,6.6,Hüseyin Karabey,"['Ayça Damgaci', 'Hüseyin Karabey']","Three years ago, in real-life, Hama Ali, a charismatic actor from Iraq famous locally for his performance as Iraq's version of Superman, met Ayca on a film-set. He and Ayca, a fiery actress from Turkey, had a passionate love affair before returning to their respective homes.",93,Drama,gitmek: benim marlon ve brandom,tt0920460
,7.2,Ole Christian Madsen,"['Lars Kristian Andersen', 'Ole Christian Madsen']",-,130,Drama,flammen & citronen,tt0920458
,6.4,Aku Louhimies,"['Leena Lander', 'Jari Olavi Rantala']",There is civil war in Finland. Between whites vs reds. A woman soldier of reds is captured by the whites. She is ordered to be executed.,115,Drama,käsky,tt0920461
71,7.2,"['Kenn Mac', 'Rae', 'Simon Mac', 'Rae']","['Simon Mac', 'Rae', 'Kenn Mac', 'Rae']",A grumpy old man living in an idyllic coastal town who can't see he has the perfect life.,101,Drama,the view from greenhaven,tt0918639
79,7.5,John Patrick Shanley,John Patrick Shanley,-,104,Drama,doubt,tt0918927
,4.4,Stu Brumbaugh,Stu Brumbaugh,"When two friends from the city take a vacation to the wilds of Montana, they find themselves lost in the depths of the big sky country.",84,Drama,iron ridge,tt0918629
,6.6,Olivier Marchal,Olivier Marchal,-,125,Drama,mr 73,tt0920470
