puntuacion_rotten,puntuacion_imdb,direccion,guion,argumento,duracion,genero,titulo,id_pelicula
,6.4,Kirill Mikhanovsky,Kirill Mikhanovsky,"Jusce, a lobster fisherman from a northeastern village in Brazil, is in love with Ana, interested only in a dream life through images she sees in television soap opera. When Jusce?s old friend, Rogério, moves back into town to be a buggy driver, her attention is divided. Jusce has the support of his fishermen friends to try, for the last time, to win Ana.",111,Drama,sonhos de peixe,tt0423232
23,5.5,Billy Kent,"['Sarah Bird', 'Billy Kent', 'Adam Wierzbianski']",Priscilla Chase is a woman who has never had an orgasm.,88,Drama,the oh in ohio,tt0422861
29,5.3,Stephen Purvis,Chris Haddock,-,94,Drama,el cortez,tt0423372
76,6.6,Laurie Collyer,Laurie Collyer,-,96,Drama,sherrybaby,tt0423169
52,7.7,"['Paul Mc', 'Guigan']",Jason Smilovic,-,110,Drama,lucky number slevin,tt0425210
,7.2,Sven Taddicken,"['Ruth Toma', 'Claudia Schreiber']","Max is very ill. He decides to steal in his own company. But when he tries to run away with the money, he has a car accident that takes him to Emma's pigs farm.",99,Drama,emmas glück,tt0424992
,6.5,Shajoon Kariyal,Girish Puthencherry,The film opens with a mother and son coming to Hardwar to perform last rites of her elder son who had run away from home and is believed to have died. But the mother sees her long lost son on the banks of River Ganga and takes him back to the family. He is Bharath Pisharody a brilliant Sanskrit professor who is respected and loved by everyone including his cousin and ... Leer todo,135,Drama,vadakkum nathan,tt0425610
,6.1,Varun Khanna,Varun Khanna,-,100,Drama,american blend,tt0425478
59,5.6,Brandon David Cole,Brandon David Cole,"The true story about the rise and fall of a group of suburban marijuana dealers from Bristol, Connecticut who were arrested by the State Police and DEA in 2001.",88,Drama,bristol boys,tt0424867
0,5.4,Joel Bender,"['Michael D. Sellers', 'Manette Rosen', 'Joel Bender']","Based on real events, Paul Bernardo and his wife, Karla Homolka, kidnap, sexually abuse, and murder three young girls.",102,Drama,karla,tt0424938
63,6.7,Patrick Hogan,Patrick Hogan,"A coming-of-age story of a young man in a band who meets a girl way out of his league. What could go wrong? Plenty, when adding in the challenging parents and his lovable but annoying best friend.",105,Drama,pope dreams,tt0425359
20,5.1,Duane Adler,Blaze Lovejoy,"A gritty, heartfelt drama about a brother and sister who both start out with the American Dream of running their own business and being successful. Teresa goes about this dream in a good way, meaning she works hard and treats people right. Her brother, Solomon, is a hustler who borrows money from loan sharks to open a music store. When he doesnt pay, the sharks come a... Leer todo",94,Drama,god's waiting list,tt0425069
26,4.7,Eric Byler,"['Kimberly-Rose Wolter', 'Eric Byler']","Gabe and Kakela are happily engaged couple in the mountain of Calabasas, CA. Gabe works as a horse riding instructor and Kakela is a trying-to-be writer. They live in house complex with Nina who is currently separated from her husband. One day, their long-time friend Tre rushes in and asks for short stay after his break-up with his girlfriend. Two men and two women st... Leer todo",87,Drama,tre,tt0425558
50,6.7,Meneka Das,Meneka Das,"Set in a country coming of age, Little Box Of Sweets is a simple love story about a young girl's journey to fight for her dreams and the love of the man who inspired her! A little village in North India is Asha's (Meneka Das) world. Whatever she knows and wants is right here in her humble existence with her grandparents and soul mate Lalli (Sheenu Das). Then Seth (J... Leer todo",-,Drama,little box of sweets,tt0425198
,5.5,Geretta Geretta,Geretta Geretta,During changing times a White family find themsleves falling in-love with their Black next door neighbors.,90,Drama,whitepaddy,tt0425648
77,4.8,Carl Thibault,Carl Thibault,"A mechanic at his father's garage during the late 1970s, Matt dreams about leaving his small town existence and pursuing grander ambitions. But strong feelings for a new girlfriend and deep family ties may prevent Matt's ultimate escape, despite pressure from best friend Schultz to take off immediately. Coming-of-age story in a small town.",94,Drama,the garage,tt0424107
63,6.6,Terry Green,Terry Green,Two young women accuse nine black youths of rape in the segregated South.,105,Drama,heavens fall,tt0425094
54,5.8,Nick Guthe,Nick Guthe,"A rebellious girl hooks up with an escort agency, where her stepfather is a client.",91,Drama,mini's first time,tt0425253
,6.0,"['Peter Mc', 'Gennis']","['Peter Mc', 'Gennis']",A street artist (Pete) gets pulled in by a flamboyant mob wanna-be (Tony) who offers him easy work in a local cemetery. Things get sticky when Tony's supposable girlfriend Angie (The Rose) takes a liking to the artist and the true nature of the work is revealed. Pete falls for the new girl on the block Rachael (The Spider) who soon becomes a much needed distraction fr... Leer todo,89,Drama,in,tt0426490
35,5.6,Ari Ryan,"['Jon Lindstrom', 'Tom Schanley']","Two separate teams of jewel thieves, one low-rent and one upscale, both desperate, converge on the same score at the exact same time, and a simple job turns out very complicated and very bloody.",105,Drama,the hard easy,tt0425087
,7.5,Marwan Hamed,"[""Alaa' Al-Aswany"", 'Wahid Hamed']","Meditations on corruption, fundamentalism, prostitution, homosexuality, and drugs in central Cairo.",165,Drama,omaret yakobean,tt0425321
,6.6,Sijie Dai,"['Sijie Dai', 'Nadine Perront']",At the house of a famous Chinese botanist teacher his daughter and a female intern fall in love with each other - a forbidden love that must be kept secret.,105,Drama,les filles du botaniste,tt0425985
33,4.9,Theo Avgerinos,Matthew Perniciaro,"Unless Darren can survive New York's largest drug mogul, write a paper on Dante's ""Inferno,"" escape three thugs chasing the wrong guy and sell fifty pills of ecstasy to make his tuition payment, he'll never date the girl of his dreams.",85,Drama,fifty pills,tt0426462
76,7.0,John Jeffcoat,"['George Wing', 'John Jeffcoat']","After his entire department is outsourced, an American novelty products salesman (Hamilton) heads to India to train his replacement.",103,Drama,outsourced,tt0425326
,5.7,Marc Clebanoff,Marc Clebanoff,"The world outside has ceased to exist. Brandon, his girlfriend Katie and his younger brother Guy have finally decided that it is better to die at their own hands in the company of the ones they love, then to continue living helplessly, confined to a dark, miniscule abandoned storefront.",82,Drama,unspoken,tt0426613
,7.3,Niels Arden Oplev,"['Steen Bille', 'Niels Arden Oplev']","A boy, inspired by Dr. Martin Luther King Jr., challenges a repressive school authority in 1969 Denmark.",109,Drama,drømmen,tt0425235
35,5.3,Jeff Mahler,Jeff Mahler,-,99,Drama,inside,tt0425132
15,4.3,Andrzej Sekula,Adam Haynes,"""The Pleasure Drivers"" lays out three separate interconnected stories involving an adulterous therapist, a young sociopath call girl, a vicious lesbian hit woman, a white trash kidnapper, and a brain-damaged ex-cult guru. It's described as funny, sexy, edgy and dangerous. The Pleasure Drivers energetically explores the shadow side of Los Angeles and how it gleefully r... Leer todo",99,Drama,the pleasure drivers,tt0425357
69,5.3,Ana Kokkinos,"['Rupert Thomson', 'Ana Kokkinos', 'Andrew Bovell']","An erotic mystery about power and sex, the entanglement of victim and perpetrator, and a man's struggle to regain his lost self.",118,Drama,the book of revelation,tt0424863
28,6.7,Agnieszka Holland,"['Stephen J. Rivele', 'Christopher Wilkinson']",-,104,Drama,copying beethoven,tt0424908
,5.8,"['Randall Rubin', 'Jonathan Schroder']","['Randall Rubin', 'Jonathan Schroder']",Two misunderstood suburban kids challenge society and run from the police while documenting all of their deeds with a digital camera.,99,Drama,jimmy en judy,tt0425151
47,7.2,Neil Armfield,"['Luke Davies', 'Neil Armfield']",-,108,Drama,candy,tt0424880
46,5.5,Mark Hammond,Brendan Foley,"Johnny Was is a gritty gangster drama set in the tough city of Brixton, London. Johnny (Vinnie Jones) is trying to escape his violent past by living a simple ""quiet life"".",93,Drama,johnny was,tt0426501
55,6.9,Nick Cassavetes,Nick Cassavetes,-,122,Drama,alpha dog,tt0426883
,6.2,Giacomo Martelli,"['Giacomo Martelli', 'Iñigo Dominguez', 'Riccardo Brun']","Estranged by the degree of corporate influence within the largest U.S. listening station in the world, an aging NSA officer defects and mounts a clandestine counter-listening station high in the Italian alps.",105,Drama,in ascolto,tt0427461
68,6.5,Allen Coulter,Paul Bernbaum,-,126,Drama,hollywoodland,tt0427969
55,6.3,Laurence Malkin,"['Chad Thumann', 'Laurence Malkin']",-,87,Drama,five fingers,tt0428541
24,4.7,John Stimpson,John Stimpson,"An urban family leaves city life behind for the confines of rural New England. Little do they know that their new home once belonged to the Keyes family, a clan who experienced the tragic loss of their daughter some 250 years ago.",93,Drama,the legend of lucy keyes,tt0428765
67,6.0,Cam Archer,Cam Archer,A lyrical telling of the coming of age of a 13-year-old boy who learns to cope with his newfound sexuality and his unrequited love for the cool kid in school.,88,Drama,wild tigers i have known,tt0430768
39,4.6,Henry Jaglom,Henry Jaglom,"In the City of Angels, a young Iowan girl (Frederick) fresh off the bus falls in love with a promising actor (Kirk).",100,Drama,hollywood dreams,tt0431124
,6.7,Nanni Moretti,"['Nanni Moretti', 'Heidrun Schleef', 'Francesco Piccolo']",-,112,Drama,il caimano,tt0429727
,4.1,K.S. Adiyaman,"['K.S. Adiyaman', 'Rumi Jaffery']","Ayaan tricks a model into marrying him, when she leaves her diary in his family's garage, allowing him to follow her around.",152,Drama,shaadi karke phas gaya yaar,tt0430589
,4.6,Marc Esposito,Marc Esposito,"This is the story of Franck and Tina. Franck loves Tina, but she can't love him. The man of her life has just died and she's having a nervous breakdown. During a journey to Asia, where Tina attempts rediscover her zest for life, Franck gradually becomes indispensable as a guide, traveling companion and, soon, friend... Will Tina eventually fall in love with him ?",103,Drama,toute la beauté du monde,tt0429187
,6.1,Mark Redfield,"['Mark Redfield', 'Stuart Voytilla']",A dramatic retelling of the last weeks in the life of poet Edgar Allan Poe with theories about the cause of his mental breakdown and premature death in 1849 Baltimore.,80,Drama,the death of poe,tt0430001
52,5.0,Teresa Suarez,Teresa Suarez,"Three flatmates in Mexico City face uncertainties: Lucía who has a great job as an art director for TV commercials is abusing alcohol and cocaine. She risks losing her job, going to prison for assault, and she's woefully in love with a bullfighter who may be two-timing her. Carmen, an artist without income, can be manic - snorting lots of cocaine and hanging out with ... Leer todo",110,Drama,así del precipicio,tt0429609
6,4.4,Michael Caton-Jones,"['Joe Eszterhas', 'Leora Barish', 'Henry Bean']",-,114,Drama,basic instinct 2,tt0430912
44,6.4,Steve Taylor,"['Henry O. Arnold', 'Ben Pearson', 'Steve Taylor']","Ethan Jenkins (Michael W. Smith) and Jake Sanders (introducing Jeff Obafemi Carr) are both passionate pastors who worship the same God from the same book--but that's where the similarity ends. White and well-to-do Ethan is comfortable in his music ministry at the media-savvy suburban mega-church, The Rock; Jake is a street smart African-American who ministers to the g... Leer todo",102,Drama,the second chance,tt0429068
,6.6,Oskar Roehler,"['Oskar Roehler', 'Michel Houellebecq']","Two half brothers in Berlin, 30+, one an introverted scientist, the other a sexually frustrated teacher, have no love life. That's about to change.",113,Drama,elementarteilchen,tt0430051
,6.9,Tanuja Chandra,"['Tanuja Chandra', 'Glenn Russow']",A Muslim bike messenger develops a friendship with a married Sikh woman whose husband is killed in the September 11 terrorist attacks.,82,Drama,hope & a little sugar,tt0430193
,3.8,John Penney,John Penney,-,90,Drama,zyzzyx rd,tt0429277
50,5.9,Richard Claus,"['Daniel Musgrave', 'Richard Claus', 'Cornelia Funke']","After their mother dies, two boys flee their mean aunt and head for Venice, Italy, where they meet Scipio, the mysterious ""Thief Lord."" Along with a small gang of abandoned kids, the boys start robbing the rich to support themselves.",98,Drama,the thief lord,tt0430674
32,6.4,Jessica Bendinger,Jessica Bendinger,-,103,Drama,stick it,tt0430634
,6.5,Jean van de Velde,"['Maarten Lebens', 'Jean van de Velde']","The start of the career of Herman Brood, who lived his life filled with sex, drugs and rock 'n roll. Guided by his manager they aim to take over the USA with his music.",103,Drama,wild romance,tt0430592
47,6.1,Michael Mann,"['Michael Mann', 'Anthony Yerkovich']",-,132,Drama,miami vice,tt0430357
20,6.0,Michael O. Sajbel,"['Stephan Blinn', 'Mark Andrew Olsen', 'Tommy Tenney']","In Biblical times, a girl disguises her Jewish origins when the Persian king comes looking for a new bride among his subjects.",123,Drama,one night with the king,tt0430431
20,3.8,John R. Carter,Scott Schafer,-,91,Drama,fatwa,tt0431058
58,6.2,Mark Fergus,"['Mark Fergus', 'Hawk Ostby']",-,101,Drama,first snow,tt0432289
20,6.4,George Hickenlooper,"['Captain Mauzner', 'Simon Monjack', 'Aaron Richard Golub']",-,100,Drama,factory girl,tt0432402
,5.8,Manolo Nieto,Manolo Nieto,"David, has just failed his university examinations and has one year to re-write them. Ruben, his father, a pragmatic and successful businessman, has been paying for David's education, the pursuit of which he considers a waste of time. Ruben wants David to work and make himself useful and he strikes a deal with him: David can stay and study for his exams at Ruben's hou... Leer todo",90,Drama,la perrera,tt0431321
,4.2,Kevin Lewis,Kevin Lewis,"Upon returning from the Iraq War, Matt Taylor is unable to recognize the hometown he left behind. Leaving one war for another, he is forced to conquer his own inner demons, as well as those of his countrymen",102,Drama,dark heart,tt0430984
41,5.7,"['Colin Brady', 'Christopher Reeve', 'Daniel St. Pierre']","['Robert Kurtz', 'Jeff Hand', 'Howard Jonas']",A boy begins a grand journey to return Babe Ruth's baseball bat before the deciding game of the 1932 World Series comes to a close.,87,Drama,everyone's hero,tt0430779
70,6.8,Q. Allan Brocka,"['Matthew Rettenmund', 'Philip Pierce', 'Q. Allan Brocka']","A successful male escort describes in a series of confessions his tangled romantic relationships with his two roommates and an older, enigmatic male client.",88,Drama,boy culture,tt0433350
,6.8,Dana Nechushtan,Franky Ribbens,"Dennis is a taxi driver trying to start out his own company. One day, he gets the opportunity to buy a scarce and expensive but lucrative license.",90,Drama,nachtrit,tt0433686
,4.3,Alber Ponte,Alber Ponte,-,-,Drama,el don de la duda,tt0433549
,5.8,Reza Badiyi,Michael Houston King,Life affirming spiritual drama about love and loss set in the lush surroundings of Central Florida. Spencer Krane has returned to the town where he was raised. It is the news that his grandmother has suffered a debilitating stroke that prompts his visit. What starts as a simple visit home becomes so much more. It becomes a journey of consequence.,93,Drama,the way back home,tt0432855
85,7.5,Mira Nair,"['Sooni Taraporevala', 'Jhumpa Lahiri']",-,122,Drama,the namesake,tt0433416
93,7.9,"['Eric Quizon', 'Mark Solomon']","['Matthew Feig', 'Romeo Joven', 'Allan Tijamo']",-,-,Drama,wrinkles,tt0433665
17,6.4,Robert Edwards,Robert Edwards,A soldier recounts his relationship with a famous political prisoner attempting to overthrow their country's authoritarian government.,110,Drama,land of the blind,tt0433405
,6.2,Marco Bellocchio,Marco Bellocchio,A film director falls in love with the daughter of a prince.,97,Drama,il regista di matrimoni,tt0433624
92,7.2,Ham Tran,"['Ham Tran', 'Lam Nguyen']","Thirteen years after the end of the Vietnam War, a family who was tragically affected by the war are forced to emigrate to America.",135,Drama,journey from the fall,tt0433398
-,7.1,Lee Toland Krieger,Lee Toland Krieger,"After Chris's (Josh Janowicz) mother dies, he is left to take care of himself and his alcoholic father (Bill Buell). He picks up odd jobs to help with the bills but still falls short as his father's condition worsens. Things take a turn for the better when Chris's cousin Brian (Barrett James) gets him a job working for a Brooklyn drug dealer. Chris is able to pay the ... Leer todo",92,Drama,december ends,tt0433364
54,6.0,Michael Mayer,"['Mark Rosenthal', 'Lawrence Konner', ""Mary O'Hara""]",-,95,Drama,flicka,tt0434215
80,4.7,Joel Miller,Joel Miller,"Fueled by original music by members of Guns N' Roses, Bad Religion, No Doubt, Skid Row, Toad the Wet Sprocket, Hootie & The Blowfish and more... The Still Life tells the story of artist Julian Lamont who struggles to pick up the pieces of his tattered life in this poignant drama. A reclusive alcoholic, Julian creates a new art genre called Destructionism, and his work... Leer todo",96,Drama,the still life,tt0435751
72,5.8,Nicole Holofcener,Nicole Holofcener,-,88,Drama,friends with money,tt0436331
46,6.4,Tony Goldwyn,"['Paul Haggis', 'Gabriele Muccino']",-,115,Drama,the last kiss,tt0434139
49,4.6,Geoffrey Wright,"['Geoffrey Wright', 'Victoria Hill', 'William Shakespeare']","A contemporary retelling of Shakespeare's ""Macbeth"" set in the ganglands of Melbourne.",109,Drama,macbeth,tt0434541
77,6.7,Menhaj Huda,Noel Clarke,-,89,Drama,kidulthood,tt0435680
,5.1,Brice Cauvin,"['Jérôme Beaujour', 'Brice Cauvin', 'Pierre Schoeller']","After 10 years and two children together, Philippe and Marion, finally decide to take a honeymoon Holiday in Venice. At the train station, a abandoned bag filled with money will bring them to a different journey. A journey of doubt where reality never quite lies where it seems, leading from separation to reconciliation.",95,Drama,de particulier à particulier,tt0436216
,4.4,María Teresa Costantini,"['María Teresa Costantini', 'Walter Jacob']","Esta es la historia de Juana, Sebastián y Elisa. Estos tres personajes habitan el mismo edificio en una imaginaria Buenos Aires. La ciudad esta vacía, diferente. Todo sucede en pocas cuadras a la redonda. Juana es una joven artista plástica desocupada, algo desquiciada y con graves problemas económicos. Desesperada y como ultimo recurso, pide ayuda a sus padres, que ... Leer todo",105,Drama,el amor y la ciudad,tt0436062
,6.3,Miguel Albaladejo,"['Miguel Albaladejo', 'Juan Carlos Delgado']",-,115,Drama,volando voy,tt0435517
25,4.6,Don Michael Paul,Samuel Vartek,A troubled young boy and his father on a road trip stumble upon a rural farm where the elderly owner has sinister plans for the both of them involving witchcraft and evil.,92,Drama,the garden,tt0436343
,5.0,"['Florian Mischa Böder', 'Peter Bösenberg', 'Gerrit Lucas']","['Florian Mischa Böder', 'Peter Bösenberg', 'Gerrit Lucas']","Julia discovers her desire to plunge to the depths of her soul, Clara must come to terms with a brain tumor diagnosis, Maleen tries to liven up her relationship with the pianist Sascha, Mona is tied to the bed by her boyfriend and the psychologist Roman Fischer and his wife Carmen are confronted with a guest who showed up for dinner and doesn't want to leave: Eva. Thi... Leer todo",93,Drama,die österreichische methode,tt0436013
0,4.9,William Tyler Smith,"['Julian Hoxter', 'William Tyler Smith', 'Bhargavi C. Mandava']","A married couple decides to test the boundaries of their relationship with a seductive Spanish woman. When an unlikely relationship ensues, all three are forced to rethink their definition of love.",103,Drama,kiss me again,tt0436460
97,7.3,Stephen Frears,Peter Morgan,-,103,Drama,the queen,tt0436697
53,5.7,Rajkumar Santoshi,"['Rajat Arora', 'Tigmanshu Dhulia', 'Shridhar Raghavan']",A slacker abducts the family of a crime kingpin to avenge the death of his brother.,150,Drama,family: ties of blood,tt0437182
74,5.4,Julian Gilbey,"['Julian Gilbey', 'Will Gilbey']",Former small-time criminals get back into crime to help a friend settle a debt.,96,Drama,rollin' with the nines,tt0437459
,7.0,M. Frank,M. Frank,"Set in a Vietnamese populated Sydney suburb, Ra Choi is the story of four street kids down on their luck and trying to make a life for themselves. It's a moving and emotional journey where the strength of the human spirit is often the only hope they have in their intertwined lives. Each is on a path of discovery, fighting for a level of existence that most of us take ... Leer todo",117,Drama,ra choi,tt0437450
75,6.7,Phillip Noyce,Shawn Slovo,"A drama about terrorism in Apartheid-era South Africa, revolving around a policeman and a young man who carries out solo attacks against the regime.",101,Drama,catch a fire,tt0437232
61,6.6,Sanaa Hamri,Kriss Turner,"Kenya McQueen, an accountant finds love in the most unexpected place when she agrees to go on a blind date with Brian Kelly, a sexy and free-spirited landscaper.",99,Drama,something new,tt0437777
,6.9,Jaime Mariscal,"['Jaime Mariscal', 'David J. Miller']",A film that chronicles a young mans return to the streets where he grew up and the events that unfold after he reunites with a childhood friend.,107,Drama,welcome back to the barrio,tt0437545
,6.8,Jean-Martial Lefranc,Jean-Martial Lefranc,-,100,Drama,l'équilibre de la terreur,tt0437691
,7.4,Doug Atchison,Doug Atchison,"Akeelah, a young gifted girl, comes from a dysfunctional family and is on the verge of quitting school. She discovers that she has a high aptitude for spellings and enters a spelling bee contest.",112,Drama,akeelah and the bee,tt0437800
17,5.0,Filip Halo,Filip Halo,"Five small time criminals plan the kidnapping of a rich girl. Everything that could go wrong with the plan actually goes wrong, leading them to a weird massacre.",91,Drama,brutal,tt0437888
33,4.6,Gregory Hatanaka,"['Gregory Hatanaka', 'Norith Soth']","A woman, after finding she is dying of a brain disorder, begins a surreal journey which descends into violence and madness.",89,Drama,mad cowgirl,tt0438204
,6.5,Hwan-kyung Lee,"['Young-seok Kim', 'Hwan-kyung Lee']",Shi-Eun (Su-jeong Lim) is a woman whose love for riding horses makes her face trials and tribulations.,123,Drama,gakseoltang,tt0438986
,4.6,Ignacio Rinza,Jose Carlos Gutierrez,"An international crime war rages after an American Mafioso start to infringe on Mexican mobsters' turf, and the Korean underworld jumps in and pits the two against one another.",95,Drama,gente comun,tt0438053
,6.8,Maria Ripoll,Albert Espinosa,-,100,Drama,tu vida en 65',tt0439860
46,5.4,Julia Taylor-Stanley,"['Noel Langley', 'Julia Taylor-Stanley']","A struggling young actress, a fledgling director and an ambitious playwright become embroiled in an emotional love triangle as they strive for recognition, fame and fortune in a world on the brink of World War II.",107,Drama,these foolish things,tt0439848
32,5.0,Ash Christian,Ash Christian,"A gay theater-obsessed Texan high school senior has his heart set on Broadway stardom with an eye out for love. With the help of his 300-pound best girl friend, he embarks on a winning journey of self discovery.",82,Drama,fat girls,tt0439179
,6.1,Zhuangzhuang Tian,Cheng Ah,A Chinese man becomes an expert player of the traditional game of Go.,104,Drama,wu qingyuan,tt0439885
100,7.1,Kunal Kohli,"['Shibani Bathija', 'Kunal Kohli']",A sweet blind girl Zooni meets a flirty Rehan. She ignores her friends' warnings. It's her time to discover life. Is she making the right love choice?,168,Drama,fanaa,tt0439662
,6.7,Ricardo Van Steen,"['Carlos Didier', 'João Máximo', 'Pedro Vicente']","The biopic of Noel Rosa, one of the best brazilian poets and composers.",99,Drama,noel: poeta da vila,tt0438329
,6.3,Jin-gyu Cho,"['So-yeon Jo', 'Eui-Mok Jung', 'Su-jin Kang']","When Aryong, the daughter of a triad boss from Hong Kong is accused of killing the boss of a competing triad, she is goes into hiding in Korea. Upon arriving, she is guided by a nimble but loyal Gi-chul and his motley crew, who are assigned to protect her until her return.",115,Drama,jopog manura 3,tt0439654
31,4.4,David Rodriguez,"['David Rodriguez', 'Ben Carlin']","Drugs, sex, and the allure of fast money blur the boundaries between two very different sides of society.",105,Drama,push,tt0438296
9,3.9,"['Gino Cabanas', 'Dick Fisher']","['Myer Grovic', 'Brian Mazo']","Cut off by her wealthy father, a young woman talks her boyfriend into robbing a check cashing spot. Things don't quite work out for the couple, however, who are now being pursued by the cops.",85,Drama,cut off,tt0439311
,6.9,Konstantin Lopushanskiy,"['Konstantin Lopushanskiy', 'Vyacheslav Rybakov', 'Arkadiy Strugatskiy']","The writer is invited to the town of Tashlinsk by the mutants who emerged after an unnatural and constant rain causing the evacuation of the city, and by the children who are studying the unearthly knowledge of mutants.",105,Drama,gadkie lebedi,tt0439581
83,6.3,Brian Jun,Brian Jun,"During a Midwestern winter, two working-class brothers must cope with their recently incarcerated father.",95,Drama,steel city,tt0439833
25,7.2,Victor Salva,"['Kevin Bernhardt', 'Dan Millman']",-,-,Drama,peaceful warrior,tt0438315
32,6.1,Ryan Murphy,"['Ryan Murphy', 'Augusten Burroughs']",-,116,Drama,running with scissors,tt0439289
