puntuacion_rotten,puntuacion_imdb,direccion,guion,argumento,duracion,genero,titulo,anio
nan,-,Brigitte Tamar,Brigitte Tamar,"Zoe, a 17-year-old recovering addict, drives carefree through the desolate landscape. Homeless and alone, it relieves her to see Britt a recognizable face hitchhiking in the desert. She welcomes Britt into her car, but the drive quickly takes an ominous turn, as Zoe faces her rea... Leer todo",14,Drama,wastoid,2022
nan,-,Jasmine Capon,Jasmine Capon,"A naive 16-year-old illegally sells images of herself online for validation, while struggling to save her reputation from being ruined by one of her customers.",12,Drama,indelible lives,2022
97,-,Austin Caley,Austin Caley,A young man relives the precious memories within his childhood home forcing him to decide whether to stay or leave forever.,-,Drama,the house,2022
nan,-,Christina Green,Christina Green,"When 19-year-old Alex learns that she is not biologically related to her mom, she sets off on a road trip to meet her egg donor for the first time. Dedicated by the filmmaker to her own parents and her egg donor.",25,Drama,fugue to washoe county,2022
nan,-,Alfie Beecher,Alfie Beecher,A twisted relationship blossoms after a lonely teenage serial killer indulges in her first 'big kill': a cat incidentally belonging to another serial killer.,-,Drama,anything you can do,2022
nan,7.8,Giulia Grandinetti,Giulia Grandinetti,"In a dystopian Rome, a law asses that Roma families cannot have more than three children. What price are we willing to pay today, just to find a place in the world?",17,Drama,tria - del sentimento del tradire,2022
91,7.7,Gauri Adelkar,Gauri Adelkar,An in-home caregiver balances her duties with the illness of her own mother.,-,Drama,the gift,2022
nan,-,Kimberly B. Flores,Kimberly B. Flores,-,-,Drama,in pieces,2022
nan,-,Bobby Cullen,Bobby Cullen,"Tara Hill is a glorious region of rugged naturalistic beauty that rises above the sea. This is where feral free spirit Tara, after whom the hill was named, spends her years. And like the rest of the female vampires that are scattered about the slopes, she is governed by Max. Thou... Leer todo",15,Drama,tara hill,2022
100,-,"['Joe Mc', 'Stravick']",Shelley Lowry Frazer,-,-,Drama,torn,2022
nan,-,"['Blair Allen', 'Simon Patrick Berman']","['Blair Allen', 'Simon Patrick Berman']",-,17,Drama,dog human vs. power human,2022
nan,-,A.J. Ogilvie,A.J. Ogilvie,"A lo-fi glimpse into the lives of two roommates with opposite work schedules who, out of the blue, choose to abandon the routine in their lives.",11,Drama,capricious company,2022
nan,-,Ryan Craver,"['Rali Chaouni', 'Donovan Tolledo']","At the end of summer, an Asian-American 13-year-old pierces his own lip as a last ditch effort to win over a skater boy, who also happens to be his best friend.",-,Drama,fat lip,2022
nan,-,Marjorie A. Thomas,Marjorie A. Thomas,-,13,Drama,(im)pure,2022
nan,-,D.M. Meyer,D.M. Meyer,A writing student and a past writing professor meet again at a party that the professor's husband has for his faculty. They dance around the obvious attraction until they must face each other's passion.,-,Drama,opening the montrachet,2022
nan,-,Tigran Chakhoian,Tigran Chakhoian,-,-,Drama,the most creative,2022
nan,-,Christian York,Christian York,"Down on his luck creatively and financially Tyler Barnes is contacted out of the blue by his estranged ""sister"" Madeline who happens to be a professional ballet dancer in the same town as him. After she informs him that she is performing as the lead with her dance troop, she invi... Leer todo",-,Drama,the recital,2022
nan,-,-,Joanna Abrot,-,-,Drama,on a draw,2022
nan,-,Jennifer Copping,Jennifer Copping,An empathetic therapist struggles to hold the line between reality and recurring nightmares when her client's dreams enter her own.,-,Drama,the masks we wear,2022
nan,-,Jules Citro,Jules Citro,"Over the course of a picnic date, Jack, an established musician, promises a young songwriter, Juliet, help to get ahead in the industry. He is as charismatic as he is manipulative and easily regains her trust each time he shatters her heart.",13,Drama,old enough,2022
nan,-,Eliott Margueron,Eliott Margueron,"Guillaume lives alone in a tower apartment. He spends his days dreaming and reinventing his life until Abel and Jeanne, a young couple, move above his flat. Guillaume starts to project his own existence on the couple and begins a fantasized love triangle with them.",15,Drama,succulente,2022
nan,-,Seán Treacy,Seán Treacy,"When naive teen David witnesses his best friend inappropriately engage with a girl at a party, he falls into a moralistic crisis as he reconsiders the values of his friends while also confronting the overwhelming guilt of his inaction.",-,Drama,the least i can do,2022
nan,-,Adam Ciancio,Llewellyn Michael Bates,"Oscar , a man who has Cerebral Palsy works as caption writer. His best friend Rachel is making a documentary about him. During the filming Oscar comes to terms with the news of a sick parent by finding solace in the last place he thought.",10,Drama,laughter club,2022
83,-,Hon Hoang,Hon Hoang,"BREAKDOWN has been selected and screened at several film festivals including the 2022 VietFilm Festival and the 2022 Asian World Film Festival in Los Angeles, CA.",-,Drama,breakdown,2022
nan,-,Emma Pitcairn,George Robinson,-,-,Drama,in a heartbeat,2022
nan,-,Diksha Verma,Diksha Verma,-,6,Drama,nazar,2022
nan,-,Paula Andrea Cajiao,Paula Andrea Cajiao,-,-,Drama,shell-shocked,2022
nan,-,Kristi Lopez,Kristi Lopez,-,-,Drama,sicatriz,2022
nan,-,Maia Pecci,Maia Pecci,"It's been three months since their break-up and Lei can't stop dreaming of Ian, so she invites him out of the blue to the site of their first date to finally admit to him why, while not so subtly wrapping him up in her latest video project.",10,Drama,the grey in between,2022
nan,-,Serena Chloe Gardner,Serena Chloe Gardner,Summer's world turns upside down after the sudden death of her brother Steven. A self-proclaimed punk rocker and art student by day. Her work begins to suffer by continual nightmares as PTSD plagues her life both asleep and awake. Summer tries to overcome her grief with the help ... Leer todo,-,Drama,summer,2022
71,-,Samuel Bossman,Samuel Bossman,"In a world devastated by climate change, a scavenger goes from island to island scratching out an existence in search of life and survival. But is he being watched and by what?",7,Drama,open water,2022
nan,-,Denli Chavez,Denli Chavez,-,-,Drama,pagbutwa halin sa kahidalman,2022
nan,-,Alon Borten,Alon Borten,The looming conclusion of David and Robert's relationship in Los Angeles comes to a head when they agree to spend one last romantic weekend together.,20,Drama,this is for you,2022
-,-,Thalia Macey,David Macey,A noble lady seeks justice for the death of her betrothed.,30,Drama,best man wins,2022
nan,-,Jacob Nurse,-,-,-,Drama,mr. scotty's time machine,2022
nan,-,Mikey Manschot,"['River Fallon', 'Fausto Lucignani']","Two young homeless men struggle to forget the pain of their pasts and open their hearts to new love: Leo, who was discharged from the military a decade ago for psychiatric issues, and Joe whose husband was killed in the Iraq war. Will they overcome their personal tragedies and al... Leer todo",-,Drama,on the sidewalk,2022
nan,9.1,Conor Forrest,Conor Forrest,"On an idyllic afternoon at the beach, Philly faces his unrequited love for his roommate, Jamie, while trying to distance himself from their trio friendship.",10,Drama,used furniture,2022
nan,-,"['Chris Herrera', 'Austin Koncerak']",Austin Koncerak,A mental asylum patient tries envisioning living a normal life by entering a false reality to a happier time while stuck inside of a cell room battling his real life demons.,17,Drama,cycle of violence: erik,2022
nan,-,Heidi Nyburg,Heidi Nyburg,A little girl spends an unnerving afternoon with her estranged father where she's left with only her imagination to stop time and escape impending disaster.,-,Drama,five and a half,2022
nan,-,Christopher Siaens,Julie A Stehouwer,"An abuse awareness story, but also about survival and overcoming.",6,Drama,the girl on camera,2022
nan,-,Marta Chessa,"['Camilla Campanelli', 'Marta Chessa', 'Alice Di Stefano']",-,-,Drama,gratia plena,2022
nan,-,Michael Donte,Michael Donte,It follows two queer boys as they form a unique bond while they work as ushers at their Baptist church.,20,Drama,the spirit god gave us,2022
nan,-,Ryan Monolopolus,Ryan Monolopolus,-,-,Drama,muerte,2022
nan,-,Rico Shay,A.D. Sommerio,"Terrell Jones has all the ingredients anyone needs to give up. His father deceased, leaving him ""man of the house"", to take care of his younger sister and now drug addicted mother. He doesn't live in the best of neighborhoods and his only other real friend is his girlfriend Trace... Leer todo",-,Drama,in memory of,2022
nan,-,Shane Tully,"['Andrea Figliomeni', 'Shane Tully']",A young woman struggles with thoughts of killing her best friend.,10,Drama,exposure therapy,2022
nan,-,Hugo Arvizu,Hugo Arvizu,-,13,Drama,güicho,2022
nan,-,André Joseph,André Joseph,"When a black high school student in a reputable prep school becomes the victim of a vicious form of cyber bullying, his history teacher makes it her mission to bring those responsible to task.",29,Drama,dismissal time,2022
77,-,Drew Haddad,"['Drew Haddad', 'Olivia Lauren']","Music video for ""House of Cards"" by Olivia Lauren.",5,Drama,house of cards,2022
nan,-,Ayana Chatterjee,"['Savita Mullapudi', 'Vandana Nair']","ACHAAR is the story of Girija, who feeds her soul on her mother's pickles & designs she crafts on fabric. When pandemic isolates the young student from her craft & pickles, will she find a way back to the flavors she loves the most?",23,Drama,achaar (pickle),2022
nan,8.5,Louise Hylland,Kat Stephie,-,20,Drama,en af drengene,2022
nan,-,Brian Glassford,"['Daniel Pierce', 'Brian Glassford']",A young pastor's world is turned upside-down when he's suddenly thrust into a dangerous hostage situation. The only way he'll be able to get anyone out alive is by bravely reaching out to appeal to the soul of a violent gunman.,-,Drama,uncommon negotiator,2022
nan,-,Carleton Rodgers,Carleton Rodgers,"For teenager Danny, with regards to musical taste - he did it his way. He got a kick out of Sinatra not Sheeran. Regrets? Potential social isolation. But will his love for Ol' Blue Eyes get under his skin - or be his salvation?",-,Drama,i'll be frank,2022
nan,-,Ibrahim Alhendawi,-,-,15,Drama,forgot to forget,2022
nan,-,Niels Justesen,Niels Justesen,-,-,Drama,hvem skriver du med?,2022
nan,-,-,Brittany Anders,-,-,Drama,almost rooted,2022
nan,-,David Herrera,David Herrera,"As life endures, assisted suicide is apparently the only escape for a married couple that turns 80. Would they change their decision after visiting their childhood town for the last time?",-,Drama,la vida nueva,2022
nan,-,Luca Guardabascio,Luca Guardabascio,"Arturo Spegel is a marine captain that suddenly loose his wife, from that moment all is life start to change.",-,Drama,teneri germogli di brughiera,2022
nan,-,Kylie Wittmer,Kylie Wittmer,-,-,Drama,what you want,2022
nan,-,Rebecca Towns,Rebecca Towns,"A recently engaged woman, living the 'suburban dream', plays with fire after meeting her best friend's new neighbour.",-,Drama,white picket fence,2022
nan,-,Brody Bernheisel,Brody Bernheisel,-,6,Drama,a mother's nature,2022
nan,-,Fabian Siebecke,Fabian Siebecke,"""Succeed To Escape"" is a story about five young adults locked into a basement room and have to face trials to be freed. During these trials, they face their conflicts within themselves and with each other.",27,Drama,succeed to escape,2022
-,-,Elizabeth Hughes,Thomas Fiander,-,-,Drama,lux,2022
nan,-,-,"['Baz Quintans', 'Jeremiah Rivas']",-,-,Drama,"sincerely,",2022
nan,-,"['Lawrence Mc', 'Gaffie II']","['Lawrence Mc', 'Gaffie II']",Story about a wife's relentless pursuit to find her husbands killer and the detective and private investigator who solved the case.,-,Drama,the corpse in room 348,2022
nan,-,Suzanne Moreau,Suzanne Moreau,A friend in need is a friend indeed - or are they? Two best childhood friends go to summer camp for the first time together - and it tears them apart.,-,Drama,blood buddies,2022
nan,-,Hanna Jordan,Hanna Jordan,-,-,Drama,punkin,2022
nan,9.5,Ima von Wenden,Amanda Dee,"When the two flatmates, complete opposites, both platonically involved with the presently absent landlady, find themselves in a pandemic lockdown, they have to learn to get along overcoming their differences.",20,Drama,waiting for eve,2022
73,-,Gabriel Savodivker,Gabriel Savodivker,Two neighbors at odds must decide whether or not to save each other when a life-threatening situation arises.,20,Drama,neighbors,2022
nan,-,-,-,Three kids get separated in a forest after one of them disappears from the trail.,21,Drama,astray,2023
nan,-,Christopher Siaens,Christopher Siaens,"A domestic violence awareness story. An abused girl fights within herself to break free of a controlled, manipulative relationship.",2,Drama,in control of me,2023
nan,-,"['Carol Del Mar', 'Paulina Zamorano']",Carol Del Mar,A grieving teen's sleepwalking disorder spirals into a nightmare.,-,Drama,bury a dream,2023
nan,-,Lillian Lamour,Deanna Culver,"A broken young woman videotapes herself, reciting a poem of how her husband and his friends sexually abuse her.",-,Drama,pieces of my husband & his friends,2023
nan,-,Tim Eickhoff,"['Tim Eickhoff', 'Timo Martens']",2030. In a new world. Pregnancies are forbidden. Emily must make a life changing decision.,21,Drama,2030,2023
40,-,Christopher Baiza,Christopher Baiza,"In the shadows of uncertainty, between logic and wonder, shadow and light, Harold Johnson finds himself in the twilight zone.",-,Drama,xmas,2023
nan,-,Bradley Cope,Bradley Cope,R.A.T follows the story of seventeen year-old Kyle Williams who is categorized as being on the Autism spectrum. This short film is made to raise awareness for those with Autism and Anxiety.,-,Drama,r.a.t,2023
nan,-,Linglin Yuan,Linglin Yuan,"This film focuses on Zhou Shan as the main line and Yue Xiaoyu as the auxiliary line. In the most severe moment of the Wuhan epidemic, Zhou Shan and Yue Xiaoyu met each other, and they both had a common wish, hoping that the Wuhan epidemic will be eradicated. Zhou Shan is the rep... Leer todo",-,Drama,first mission,2023
nan,-,Jason J. Tavares,Jason J. Tavares,"Silent proclivities are barely kept hidden, draining one's soul like a person bedridden, seeping to the surface in a spiteful, malicious manner - leaving you vulnerable to mocking and banter.",3,Drama,silent proclivities,2023
nan,-,Joe Milici,Joe Milici,-,-,Drama,the pendant of persia,2023
nan,8.1,Emy-Mirel Ivasca,Emy-Mirel Ivasca,A boy sees from the window of his apartment a child playing alone with a ball every day.,-,Drama,zidane roulette,2023
nan,-,Dustin Nowlin,Dustin Nowlin,Members of a broken family go to a motel to work out their differences.,12,Drama,incidental,2023
nan,-,Hunter Logan,Hunter Logan,"After their friend survives a suicide attempt, a group of straight-A students mount a protest against the stress of high school that jeopardizes their friendships, their futures, and their school's funding.",15,Drama,shadows fall behind you,2023
nan,-,Jesse Vega,-,A young man struggles to deal with letting go of his past by reaching out to an ex-lover to rekindle the love they once had.,-,Drama,tell me(lies),2023
nan,-,Nyle Manzano,Nyle Manzano,"An aging father dreams of a fantasy world and yearns to connect with his son Lee, a young spirited man with a bright future ahead of him.",-,Drama,the heroic,2023
24,-,"['Edward Kearns', 'Garrett Midkiff']",Edward Kearns,"Fresh out of prison in the wake of 9/11, routine is Loran's cell on the outside. Days bagging groceries blur into the glow of TV dinners, until a visit from his son awakens the past. Promises of purpose and pictures of a grandchild. At a price. Does he risk his freedom for the sa... Leer todo",20,Drama,restitution,2023
nan,-,Vivienne Abitia,Stacey Ellis,-,-,Drama,this end,2023
97,-,Vivienne Abitia,Stacey Ellis,-,-,Drama,roll with it,2023
nan,-,Kyle Dunbar,"['Kyle Dunbar', 'Christian Tribuzio']",An actor travels to a lonely cabin to prepare for a new role and finds a mask that may help him get into character.,-,Drama,ask the mask,2023
nan,-,Thomas Gidlow,Thomas Gidlow,"After struggling with PTSD for years, former soldier Clyde Duncan nearly succumbs to the battle within despite efforts from his friends and support group when an argument with his wife escalates into a brutal, life-threatening situation.",5,Drama,inimicus,2023
nan,-,Patrice Burton,Patrice Burton,-,-,Drama,the love we knew,2023
nan,-,Mitchell Cole,Mitchell Cole,-,22,Drama,choose the right,2023
nan,-,Frederick Tabiyus Nah IV,"['Emiah Reilly', 'Elijah Washington']","Two black college students have found solace in one another while attending an Ivy League University, where minorities are far and few. Jeremiah and Jasmine are the yin to each other's yang. However, a life altering situation has been troubling Jeremiah and has begun affecting hi... Leer todo",-,Drama,pending...,2023
nan,-,Michael O'Connor,Ninon Schubert,"Two sisters look forward to celebrating the fact that one of them has overcome a serious illness. But an insurmountable obstacle stands in the way, until a photograph reveals a magical solution.",12,Drama,11:53,2023
nan,-,Deniz Kezik,"['Deniz Kezik', 'Can Çelik']","In a hill village far from sight, the rainfall intensifies day after day and causes a power outage. In a village house that's facing a lake and surrounded by greenery, the days have gotten hard and the dilapidated mudbrick wall in the backyard has gotten weaker each day. The wall... Leer todo",22,Drama,as night falls,2023
71,-,Gee Sahota,Gee Sahota,"Lifeline is a psychological drama about Max, a troubled and overworked finance whiz in London's financial district, who's trying to hold it together. He suffers recurring nightmares and takes too many prescription pills to numb his problems, which are connected to his absent wife... Leer todo",11,Drama,lifeline,2023
nan,-,"['Miles August', 'Chris Paicely']","['Miles August', 'Chris Paicely']","As their relationship comes to a bitter end, Sophie leaves Matt a parting gift, a small device called ALUS. Designed to behave like a mother, ALUS helps Matt with all of his daily needs. When Matt sees just how intelligent the little device actually is, he decides to use it to fu... Leer todo",-,Drama,alus,2023
nan,-,Ellie Skye Dowek,Ellie Skye Dowek,-,-,Drama,machane,2023
100,7.4,Callum Barratt,Callum Barratt,Lana meets her Brother James for the first time in 13 years to talk about her enigmatic past.,-,Drama,here we are,2023
nan,-,Thomas Gardner,Thomas Gardner,"Set before the events of the acclaimed short 'The Fronts of War', Private William Mawlbury is tasked on finding his close friend Albert, who went missing during a routine patrol.",-,Drama,the prelude to war,2023
nan,-,Felix Igori Ramos,Felix Igori Ramos,-,-,Drama,for the sake of the kids,2023
nan,-,Samuel Kay Forrest,Samuel Kay Forrest,"A young woman visits Christ the Redeemer in Rio to decide if she should keep her unborn child after leaving her abusive boyfriend. She prays for the strength to make her own choice, knowing that abortions are criminalized in Brazil.",-,Drama,"her body, her choice!",2023
94,-,Emily Skye,Emily Skye,-,-,Drama,her,2023
nan,-,Ellie Skye Dowek,Ellie Skye Dowek,A multiversal jump gone wrong leaves our hero's mind fractured.,13,Drama,a trip through the multiverse,2023
nan,8.3,Elias Avramidis,Elias Avramidis,"Laura, a young homeless woman from London, finds shelter in an underground train station where she encounters a psychology professor waiting for his next train.",17,Drama,doglike,2023
nan,-,Vivienne Abitia,Stacey Ellis,-,-,Drama,how he lived,2023
nan,-,Joe Fuller,Sam Bristow,"Michael is inspired by his estranged father to become a chef, but his mother disagrees. Using the help of his friend, a chef in an upmarket restaurant, can he prove to his mother he has what it takes?",3,Drama,fortissimo,2023
nan,6.4,André Gil Mata,"['André Gil Mata', 'Franz Kafka']","..so the past and the future merge into a single present, in the terrible and unusual life of the Cursed Courtyard. "" Ivo Andric""",43,Drama,pátio do carrasco,2023
nan,-,Maya Jai Pinson,Mignon Pinson,"Kids are more focused on Dexter's unique birth mark than his beautiful and loving heart. Then one day, he has enough courage to point out the main abuser.",-,Drama,dexter's heart,2023
nan,-,Meredith Hoarau,Meredith Hoarau,"Just out of prison, Marisa thinks only of taking revenge on Raphaël and Jeremih, the two brothers who betrayed her 15 years earlier.",-,Drama,érinyes,2023
nan,-,-,Bella Cruz,-,-,Drama,2 cops a latte and a ring,2023
nan,-,Andy Pett,"['Christoffer Karlsen', 'Andy Pett']","Geir has had enough of life and decides to end his. But no matter how hard he tries, he can't seem to succeed at it.",-,Drama,nesten død,2023
nan,-,Rich Toulmin,"['Kieran Jenkins', 'Rich Toulmin', 'Cathy Wippell']","Luke unwillingly yearns for his former relationship. Unable to forget the love for his abusive ex, his life is torn apart by the breakup's emotional fallout. How will he move on if he can't confront or express his feelings?",-,Drama,remnants of a broken heart,2023
nan,-,Brendan Marler,Brendan Marler,-,-,Drama,chester,2023
nan,6.6,David A. Flores,David A. Flores,A young woman works with a digital copy of her mom to investigate the sudden disappearance of her real mom.,15,Drama,likeness,2023
nan,-,Johnny Read,Johnny Read,"A man contemplates life, love and loss as he grieves for a father he never met, in a country he doesn't know.",-,Drama,the bridge,2023
-,-,Max Jeffrey,"['Callie Harlan', 'Christie Williams']",-,7,Drama,scratched,2023
nan,-,Josiah Swanson,Josiah Swanson,The plot is unknown.,-,Drama,box,2023
nan,-,Nick Karamousadakis,Nick Karamousadakis,-,23,Drama,matter of chemistry,2023
nan,-,Daakyehene Ababio,Daakyehene Ababio,-,24,Drama,lineage,2023
nan,-,George Turnbull,George Turnbull,"Ten years after the mysterious death of her mother, Mary must confront the ghosts from her past.",25,Drama,where can i run?,2023
-,7.3,Parker Viale,"['Parker Viale', 'Moorea Welch', 'Ryan Calhoon']","After being accused of murdering her boyfriend, Vanessa must try to prove her innocence while a mysterious entity has other plans.",22,Drama,hidden above 2: the mystery unfolds,2023
nan,-,Connor Larkin,Connor Larkin,"After being confused for someone else, a young man gets forced into doing a job intended for a gangster.",17,Drama,bittersweet sundays,2023
nan,-,Kyle Davison,"['Marcus Catt', 'Kyle Davison']",A Son reflects on the life of his Father.,5,Drama,my father's son,2023
nan,-,Nathanael Matanick,Nathanael Matanick,-,20,Drama,the least [si ayu],2023
nan,-,Elijio Carlos Ramirez,Ramiro Quezada,A despondent writer struggles with the realities of his upbringing and the toxic masculine ethos that has plagued his life.,17,Drama,i can talk,2023
nan,-,Maryna Bogdan,Maryna Bogdan,An elderly woman unexpectedly reconnects with her old flame and now must decide between holding onto the past or pursuing a second chance at love.,-,Drama,nana,2023
nan,8.2,Brett C. Persson,"['Brandon C. Michaels', 'Brett C. Persson', 'Chance Spencer']","The man had been held captive for months. He was alone in a cold, dark room with no windows or indication of time passing by. He wasn't even sure if anyone knew where he was or what had happened to him. All he could do was wait, not knowing when or if his captors would come back ... Leer todo",8,Drama,the prisoner's journal,2023
nan,-,Gabriela Matarazzo,Gabriela Matarazzo,"Reconcile follows a day in the life of Blake, a recovering alcoholic father and his teenage son, Benji, as they struggle to come together on the one-year anniversary of Benji's mom's passing.",14,Drama,reconcile,2023
71,-,Shawn Divakar,Shawn Divakar,"Two brothers, Abdu and Ronny are on an ambiguous run from the police. While the younger one, Abdu is convinced their missing cult leader -- Shechem is dead, Ronny disregards it. They journey on an off-beat pursuit to find their lost leader, Shechem.",12,Drama,bandit,2023
nan,8.3,Ahmad Alyaseer,"['Ahmad Alyaseer', 'Rana Alyaseer']","A father and mother are faced with the painful task of washing and shrouding their deceased transgender daughter. When no one agrees to wash her, how far is the father willing to go to make sure his ""son"" is washed?",11,Drama,our males and females,2023
nan,-,Joshua Bernalte,Joshua Bernalte,-,-,Drama,talking rosie,2023
nan,-,Emorphia Margaritis,Emorphia Margaritis,"Frankie, a 20-year-old girl has been caring for her father Tony, who's in need of a kidney transplant. Tony, always having been the caretaker of the family is ashamed and guilt-ridden by his worsening kidney condition which has led him to heavily depend on his daughter as well as... Leer todo",9,Drama,edge of hope,2023
nan,-,Francesco Pio Grimaldi,Francesco Pio Grimaldi,"He is sitting on a park bench, reading a manga. She will ask to sit with him.",12,Drama,avere tempo,2023
nan,-,-,-,"Set in the early 60's and modern day, the story is of two women immigrants to London, one Irish, one Nigerian both looking for work and getting the same response, abuse and closed doors. A chance encounter in reincarnated lives brings the women together again in a modern day soci... Leer todo",-,Drama,"no irish, no blacks, no dogs",2023
93,-,Ethan Dela Cruz,"['Gwyneth Cruz', 'Ethan Dela Cruz', 'Tisha Sta. Maria']","An average family is planning to have their dream trip. As Gabo adventures the reality of life with his two siblings, Ben and Yna, their trip gets push back.",20,Drama,see you yesterday,2023
