,0,1,2,3,4,5,6
1305,6.8,['Mike Petty'],"['Kevin Guzowski', 'Mike Petty']","When an introverted comic book illustrator discovers that the costume of an obscure Eastern European superhero supplies him with the courage to sing Karaoke without fear, he uses his new found voice to woo the bar's cutest waitress, an aspiring singer-songwriter in need of a little magic herself. Will he realize in time, that he can only win her love by learning that ... Leer todo",84,karaoke man,2012
1306,5.8,['Henrik Ruben Genz'],"['Maja Jul Larsen', 'Henrik Ruben Genz', 'Erling Jepsen']","'Excuse Me' is a love fable of the young beautiful but confused, Helene, who according to her domineering mother has come into the world as a 'technical hitch'. Helene's search for her unknown father leads her to a small ailing Copenhagen theater. Helped by her mother's dog, Helene has always stood in the shadow of, she succeeds to get close to the theater director an... Leer todo",90,undskyld jeg forstyrrer,2012
1307,6.1,['Renji Philip'],"['Meghan Gambling', 'Renji Philip', 'Jamie Stein']",-,92,cheesecake casserole,2012
1308,5.6,['Rob Sitch'],"['Santo Cilauro', 'Tom Gleisner', 'Rob Sitch']","For Ben, life couldn't be better. A well paid job, friends, parties, girls and nothing to tie him down. But when he is invited back to his high school for a speaking engagement, he starts to reassess the direction his life is headed in.",114,any questions for ben?,2012
1309,6.2,['Yoshiko Hoshida'],-,-,-,utahime,2012
1310,-,"['Robert Maffia', 'Annabelle Larsen']","['Annabelle Larsen', 'Robert Maffia']","Let go, is what Lou has decided to do. He is depressed. The economy has ravaged his small locksmith business, his house is about to go into foreclosure, he has a debilitating disease, and his wife, who moved out months ago, wants a divorce. This drama takes place all in one day at Lou's Long Island home, where he runs his failing business. At the end of the day, he pl... Leer todo",-,foreclose,2012
1311,7.5,['Dori Berinstein'],"['Dori Berinstein', 'Adam Zucker']",A documentary on Broadway legend Carol Channing.,87,carol channing: larger than life,2012
1312,5.3,['Stephen Marro'],['Stephen Marro'],"Broadway's Finest is a diverting story about three struggling men who impersonate New York City under cover cops and chase down a notorious drug dealer in order to create their own cutting edge police drama. Desperate for success, they enter the dangerous world of undercover police work to get the authentic material they need to create their show. As the exploits of t... Leer todo",88,broadway's finest,2012
1313,5.1,['Yû Irie'],['Yû Irie'],"The upcoming Japanese director Yu Irie gained acclaim in Japanese cinema with his realistic portrayal of frustrated youths, which gained popularity among young audience. 'Roadside Fugitive,' the third installment of his popular series, '8,000 Miles,' is his most ambitious yet, experimenting with original techniques. 'Roadside Fugitive' follows Mighty's non-successful ... Leer todo",70,sr: saitama no rappâ - rôdosaido no toubousha,2012
1314,3.5,"['Duane Graves', 'Justin Meeks']","['Kim Henkel', 'Jonathan Swift']",A birthday celebration at a fancy restaurant leads to some friends' encounter with flesh-peddling cannibals.,86,butcher boys,2012
1315,3.0,['Russell Whaley'],['Charles Price'],"An unapologetic, collegiate underachiever and his 15-year-old, brainiac roommate overcome their differences and team up to exact revenge on a posse of goons, who think they rule the school.",81,disorientation,2012
1316,-,['Greg Sisco'],['Greg Sisco'],"A mockumentary chronicling the rise and fall (mostly fall) of Jesse Thunderwake, a man who had all the ambition in the world and not even a morsel of talent.",98,jesse thunderwake: american icon,2012
1317,4.8,['Jon Alloway'],-,"The story of the Cacophony Society. This documentary follows their evolution from the San Francisco Suicide Club of 1977, the exploits of SF Cacophony, their nexus creating the Burning Man Festival, to the irreverent Los Angeles Cacophony and beyond. This is the history of the most significant American underground cultural movement of our time. 'The Cacophony Society ... Leer todo",87,into the zone: the story of the cacophony society,2012
1318,8.6,['Joey Odendahl'],"['G.K. Chesterton', 'Joey Odendahl']","In a house of disenchanted, disconnected renters, a new tenant stirs life in all of them... but is he who he seems?",-,manalive,2012
1319,5.6,['Martin Valente'],"['Gianguido Spinelli', 'Martin Valente']","Chloe is going to marry the perfect guy, but lacks the perfect father. Despite having hired an actor to play the role of her father, everything changes with the arrival of Gustave and Bernard, her ""real"" parents.",99,un jour mon père viendra,2012
1320,8.4,['Elana A. Mugdan'],"['Chris Morcom', 'Elana A. Mugdan', 'Jan Tallent']","Cassie Thompson, a film-school dropout, decides to make a movie in order to turn her dead-end life around.",96,let's make a movie,2012
1321,7.0,['Konstantin Faigle'],"['Konstantin Faigle', 'Jochen Picht']","It is a fetish, a mantra, a secret religion to modern man: work. In times of the financial crisis and massive job reductions, this documentary movie questions work as our 'hallow' sense in life in a way that both humors and pains us.",94,frohes schaffen - ein film zur senkung der arbeitsmoral,2012
1322,7.6,['Patrick Barry'],"['Patrick Barry', 'Jesse Gay']","Jesse Sorensen ruled Florida as a pro skateboarder for over a decade. He had it all - a lucrative skateboarding contract, girls, fame and an extravagant lifestyle. Now six years later, past his prime and his usefulness in this youth-driven culture, Jesse is dropped by his skate team. Broke, he moves in with his elderly grandmother only to discover his 17-year old niec... Leer todo",87,veer!,2012
1323,7.8,['Wes Anderson'],"['Wes Anderson', 'Roman Coppola']",-,94,moonrise kingdom,2012
1324,5.3,"['Pascal Arnold', 'Jean-Marc Barr']","['Lucy Allwood', 'Pascal Arnold']",-,85,chroniques sexuelles d'une famille d'aujourd'hui,2012
1325,5.8,['Doug Karr'],"['Nuno Viera Faustino', 'Doug Karr']","On the verge of a coming of age showcase, a failing child prodigy painter desperately seeks inspiration; his world explodes through an incendiary meeting with a pyrotechnic artist, but in order to relinquish the chokehold of his domineering mother, he must resolve the clash between creative genius and clinical mania.",89,art machine,2012
1326,9.6,"['Corey Landis', 'Roger Lay Jr.']","['Corey Landis', 'Roger Lay Jr.']","When two friends attempt to discover who created their favorite childhood action figure, they end up uncovering a heated battle for credit that's lasted 30 years and is filled with more colorful characters than any toy store aisle. Filmmakers Roger Lay, Jr. and Corey Landis set out to document the origin of He-Man--the central character in a billion-dollar multi-media... Leer todo",97,toy masters,2012
1327,5.6,['Paul Bunnell'],"['Steve Bingen', 'Paul Bunnell', 'Mark D. Murphy']","THE GHASTLY LOVE OF JOHNNY X is a quirky adventure that defies categorization. It combines elements of science-fiction, film noir, teen angst and even musical comedy to create an entertainment unlike any other.",106,the ghastly love of johnny x,2012
1328,7.6,['Mark Maine'],"['Mark Maine', 'Mike Terrell']","A music program is broken and the students unruly, Jazz the teacher must fix both. To tame the savage beasts, he taps their mutual interests in music to pull the students together to salvage their senior class pride.",-,music high,2012
1329,7.0,['Salim Khassa'],"['Salim Khassa', 'Don L. Wilhelm']",Follows the exploits of an Indian immigrant trying to make it in New York City in 1973.,109,desperate endeavors,2012
1330,-,['Uros Tomic'],"['Mina Djukic', 'Uros Tomic']",-,100,poslednji kaskader,2012
1331,5.4,['Luca Miniero'],"['Fabio Bonifacci', 'Luca Miniero']","Now back in Milan, Alberto is managing an efficiency-improvement program at the Italian Post. He devotes all his time and energy to this noble task but neglects his wife Silvia, which manage a program for efficiency improvement in the Italian Post. In devoting all his time and energy to this noble task, he neglects his wife Silvia, who is annoyed and hurt. Things go n... Leer todo",110,benvenuti al nord,2012
1332,5.8,['Steve Taylor'],"['Donald Miller', 'Ben Pearson', 'Steve Taylor']",-,108,blue like jazz,2012
1333,6.2,['Judd Apatow'],['Judd Apatow'],-,134,this is 40,2012
1334,6.8,['Jonathan Kasdan'],['Jonathan Kasdan'],-,95,the first time,2012
1335,5.6,['Boyd Hicklin'],['Brendan Cowell'],"Edward 'Teddy' Brown lives for his suburban cricket club and his two best friends, Rick and Stavros. But when he realizes that his beloved teammates are moving on and growing up, he's forced to remind them of just how good cricket can be. Rallying a boyhood dream and his own teenage obsession, 35-year-old Teddy leads his very ordinary cricket team into the extraordina... Leer todo",92,save your legs!,2012
1336,5.3,['Mark Simon Hewis'],"['Nicholas Blincoe', 'Matt Thorne']","When Dan finds himself kicked out of the family home, he's faced with no option but to secretly move into the call center where he works.",86,8 minutes idle,2012
1337,5.9,['Enrique Gato'],"['Javier López Barreira', 'Gorka Magallón', 'Ignacio del Moral']",-,92,las aventuras de tadeo jones,2012
1338,3.9,['Carrie Preston'],['Kellie Overbey'],"Bebe and DeeDee, best friends with different relationship problems, embark on a New York City misadventure with their new acquaintance, Clementine.",84,that's what she said,2012
1339,3.9,['Kenny Young'],['Kenny Young'],"Chronicles the rise, fall and attempted rise again of a stand up comedian plagued by his own demons.",101,c'mon man,2012
1340,7.7,['Jay Taylor'],['Jay Taylor'],"Tracy thinks she is going to get her life back in order, until her day spirals out of control. Taken hostage by a couple two bit thieves who are on the run, she finds herself fighting for her life.",94,broken down,2012
1341,5.0,['Tom Vaughan'],"['Allan Loeb', 'Steven Pearl']",-,94,so undercover,2012
1342,6.2,['Ryan Sage'],['Dale Zawada'],-,92,a big love story,2012
1343,6.7,['Lee Kirk'],['Lee Kirk'],An offbeat romantic comedy about a silver-painted street performer and the soft spoken zoo worker who falls for him.,95,the giant mechanical man,2012
1344,7.4,"['Jaron Henrie-Mc', 'Crea']","['Jaron Henrie-Mc', 'Crea']","Lloyd Gills, a lonely Peeping Tom is propositioned to murder his landlord's wife. Spooked, he runs for the hills. But with a badass debt collector hot on his tail, Lloyd has no choice but to agree to the murderous offer. Armed with a hammer and a one-way ticket out of town, Lloyd sets about the grisly deed, only to discover that his mark is a Peeping Tom herself. Soon... Leer todo",88,pervertigo,2012
1345,4.8,['Sacha Bennett'],"['Mark Baxter', 'Sacha Bennett', 'Paolo Hewitt']",A group of friends buy a racehorse to safeguard them in the event that they lose their jobs amidst the turbulence in 1980s Britain.,101,outside bet,2012
1346,5.9,['Jordan Roberts'],['Jordan Roberts'],"Frank Bartlett has been tortured, embarrassed, and humiliated by his brother Bruce -- usually on film -- his entire life. Now that Bruce is finally off drugs and has turned his life around, things should be different. They are not.",89,frankie go boom,2012
1347,7.7,['Rich Moore'],"['Rich Moore', 'Phil Johnston', 'Jim Reardon']",-,101,wreck-it ralph,2012
1348,6.3,['Erik Peter Carlson'],['Erik Peter Carlson'],"Two unlikely friends, a teenage stripper from London and a traumatized clown, try to help each other in an uncertain world.",104,transatlantic coffee,2012
1349,5.7,['Bruno Marino'],['Bruno Marino'],"In an attempt to win his girlfriend's affections, Westley Little puts it all on the line believing that when it comes to love, anything goes.",-,anything goes,2012
1350,5.5,['Vignesh Shivan'],-,The film travels through 7 phases of a boy's and girl's life.,121,podaa podi,2012
1351,7.8,"['Jukka Kärkkäinen', 'J-P Passi']","['Jukka Kärkkäinen', 'J-P Passi', 'Sami Jahnukainen']",A Finnish punk-rock band formed by four mentally disabled guys.,85,kovasikajuttu,2012
1352,6.6,['Rafeeq Ellias'],"['Abhro Banerjee', 'Rafeeq Ellias', 'Yuki Ellias']","An outrageous comedy about love that doesn't exist, about therapy that doesn't work and murder that just might happen.",102,love you to death,2012
1353,5.4,['Ishai Setton'],"['Jace Mclean', 'Jared Parsons']","A hot, young starlet with a flair for bad behavior finds herself stuck in a small New England town with a rigid, yet endearingly traditional police officer. Sparks fly.",82,3 days of normal,2012
1354,8.3,['Joaquin F. Palma'],"['Joaquin F. Palma', 'Alexander Fitchett']",Down and Out David finds himself having to crash on his buddy Johnny's couch after his girl gives him the boot. But he has a plan. It's simple; let her cool off and miss him a bit and then go meet her for lunch the next day. They'll make amends and then the zappy love music cues in and fade to black. But life has other plans for David's day; filling it with odd charac... Leer todo,85,according to plan,2012
1355,6.2,['Nathan Adloff'],"['Justin D.M. Palmer', 'Nathan Adloff']","Nate is nineteen. Margaret is fifty-two. Their odd, quirky, totally working friendship gets rattled when Nate gets his first boyfriend, who drives him away from Margaret as she tries to pursue a life as a stand-up comedian.",80,nate and margaret,2012
1356,4.6,['John Murlowski'],"['John Mc', 'Kinney']","An ambitious filmmaker plots a re-imagining of Hamlet set during the American Civil War, but when he loses his large budget he has to accept much less money--which means making major script changes.",90,zombie hamlet,2012
1357,4.8,['Kevin Patrick Connors'],['Christopher Ciancimino'],"Wallowing in debt, Billy enrolls in a clinical drug trial to make a quick buck. Why not? Carted out of NYC on a bus full of oddballs, he and the rest of the ""Normals,"" are tagged, prodded and poked to hilarious results. A FilmBuff Presentation.",100,the normals,2012
1358,7.6,['Aleksey Igudesman'],"['Aleksey Igudesman', 'Sebastian Leitner']",A humorous ode to the world of classical music and some of its star musicians.,82,noseland,2012
1359,6.3,['Don Coscarelli'],"['Don Coscarelli', 'David Wong']",-,99,john dies at the end,2012
1360,2.3,"['Bill Mc', 'Adams Jr.']","['Bill Mc', 'Adams Jr.Jessica Sonneborn']","When given keys to a mansion for the weekend, two friends decide to make a film but end up throwing a huge party and trashing the house. Now they race to get the ""money shot"" and finish their film to pay for all the damages done.",90,money shot,2012
1361,5.5,['Mich Medvedoff'],"['Mich Medvedoff', 'Norith Soth']",-,79,the wife master,2012
1362,5.0,['Mari Rantasila'],"['Sinikka Nopola', 'Tiina Nopola', 'Mari Rantasila']",Ricky and Nelly travel to an island where aunt Elvi has a job at a resort.,72,risto räppääjä ja viileä venla,2012
1363,6.1,['Jay Roach'],"['Chris Henchy', 'Shawn Harwell', 'Adam Mc', 'Kay']",-,85,the campaign,2012
1364,7.5,['Skylar Gordon'],['Skylar Gordon'],A brief explanation of absolutely everything that is known about absolutely everything.,97,ontologica! or a brief explanation of absolutely everything that is known about absolutely everything,2012
1365,6.5,['Tony Britten'],['Tony Britten'],"In addition to being a mainstay of the local lifeboat crew Norman (Roger Lloyd Pack) has been the manager of the little pier theatre in his home seaside town for forty years, ever since he was a youngster. In those days, the venue played host to popular singers like the flamboyant Alma Cogan, meeting with whom Norman still fondly remembers. Now, however, the council, ... Leer todo",99,in love with alma cogan,2012
1366,6.2,['Brian Dannelly'],['Chris Colfer'],A high schooler recounts the way he blackmailed his fellow classmates into contributing to his literary magazine.,90,struck by lightning,2012
1367,5.7,['Robert Sarkies'],"['Duncan Sarkies', 'Robert Sarkies']","When Nige finds himself in a spot of bother after a series of unfortunate incidents, he is forced to ask Deano for help. The problem is Deano is not really the kind of guy you should turn to in a crisis.",108,two little boys,2012
1368,5.6,['Jay Gammill'],['Jim Beggarly'],-,80,free samples,2012
1369,5.3,['Thomas Gilou'],"['Gérard Bitton', 'Michel Munz']",-,112,la vérité si je mens! 3,2012
1370,4.5,['Bernard Rose'],"['Bernard Rose', 'Leo Tolstoy', 'Lev Tolstoy']","Jack Hussar is a legendary Hollywood director, whose persona commands respect and adoration from his fans. Can his son, Jack Jr. maintain his legacy?",90,2 jacks,2012
1371,7.0,['Nick Scown'],['Nick Scown'],"An actress with anger issues has to save not only her fledgling career, but her own life, when she gets abducted after an audition.",85,"love, gloria",2012
1372,6.1,['Nathaniel Atcheson'],"['Nathaniel Atcheson', 'M. Elizabeth Hughes', 'Darren Uhl']","Six friends are called together under the guise of an emergency, only to find themselves at the center of an elaborate scheme concocted by a mysterious mastermind who threatens to kill them if they do not obey his instructions.",86,dead herring,2012
1373,5.0,['Mogens Hagedorn'],['Mette Heeno'],"The alcoholic Elisabeth, is dying due to kidney failure. So she is in desperat need of a kidney transplant, and the hunt for a kidney donor begins ...",93,lærkevej - til døden os skiller,2012
1374,6.4,['Matti Kinnunen'],"['Matti Kinnunen', 'Kauko Röyhkä']",-,86,miss farkku-suomi,2012
1375,6.8,['Shinobu Yaguchi'],['Shinobu Yaguchi'],"When some technicians with no knowledge of robotics are ordered to quickly design an advanced robot, they concoct a madcap plan to save their jobs.",111,robo jî,2012
1376,-,['Brennan Howard'],['Brennan Howard'],A man who may or may not suffer from a multiple personality disorder inhabits nine characters in perhaps the most off-putting film ever made.,108,the tao of pinochet,2012
1377,5.2,['Garrett Brawith'],['Ross Patterson'],"An outrageous, over-the-top spoof, FDR: American Badass is the untold true story of our country's greatest monster-hunting president!",93,fdr: american badass!,2012
1378,5.4,"['David A.R. White', 'Jeffrey Peterson']",['Tommy Blaze'],Things don't go as expected when a disenchanted pastor wishes for a different life.,98,me again,2012
1379,6.6,"['Gregg Godfrey', 'Jeremy Rawle']","['Gregg Godfrey', 'Travis Pastrana', 'Jeremy Rawle']","Travis Pastrana and his tight-knit, highly-skilled, adrenaline-addicted friends bring their impossible, ridiculous, insane and hysterical adventures to the big screen for the first time.",92,nitro circus: the movie,2012
1380,5.0,['Delphine Kreuter'],['Delphine Kreuter'],-,84,dubaï flamingo,2012
1381,5.2,['Travis Long'],['Michael Swaim'],A group of small-town teens looking to drink a ton of beer in peace at a remote cabin in the woods find their party nearly ruined when they're stalked by the deranged Driller Killer in this horror/comedy featuring Michael Swaim.,85,kill me now,2012
1382,7.8,"['Stéphane Aubier', 'Vincent Patar', 'Benjamin Renner']","['Daniel Pennac', 'Gabrielle Vincent']",-,80,ernest et célestine,2012
1383,6.4,['Gert Embrechts'],['Gert Embrechts'],The eleven year old cycling talent Freddy is the son of a butcher in an idyllic village in no man's land. His isolated life is turned upside down completely in 1975 when the first supermarket in the village opens its doors. To mark the opening the supermarket organizes a cycling race and the winner of that match will meet Eddy Merckx. Freddy's father is a fervent oppo... Leer todo,100,"allez, eddy!",2012
1384,5.6,['Patricia Riggen'],['Hiram Martinez'],"As single mom Grace juggles work, bills, and her affair with a married doctor, her daughter, Ansiedad, plots a shortcut to adulthood after finding inspiration in the coming-of-age stories she's reading for school.",93,girl in progress,2012
1385,3.3,['D.W. Gordon'],['D.W. Gordon'],A young man's life is struck by tragedy. The only way out seems to be suicide but he decides to have a bit of fun first. It takes 200 meaningless women to meet the one woman that could give meaning to his life again.,-,i hate toronto: a love story,2012
1386,6.3,['Sylvie Testud'],"['Frederique Deghelt', 'Claire Lemaréchal', 'Sylvie Testud']","A young woman falls in love, then wakes up a decade later as the mother of a young boy who is also in the middle of a divorce.",97,la vie d'une autre,2012
1387,6.7,['Daniel Peterson'],['Daniel Peterson'],"A subversive romance, ""Angel Falls in Love"" follows an aimless young woman, forever scarred by childhood tragedy, currently existing in a drunken 420 haze with an abusive boyfriend until finding herself drawn to a young man who moves in next door with his girlfriend.",95,angel falls in love,2012
1388,5.7,['Yasuhiro Kawamura'],"['Fujio Akatsuka', 'Masatoshi Yamaguchi', 'Mika Ohmori']",Young Atsuko Kagami comes into possession of a magical mirror that lets her transform into anything she wishes. Atsuko Kagami then attempts to save a company which is about to be sold by using her transformation abilities. She also falls in love as a 22-year-old college student.,-,himitsu no akko-chan,2012
1389,6.1,['Coley Sohn'],['Coley Sohn'],"Desperate to get out from under her overprotective mother, a home-schooled teen runs off to live with her dad, and forms a bond with his much-younger boyfriend.",88,sassy pants,2012
1390,6.2,['Khavn'],"['Khavn', 'Norman Wilwayco']","Tony knows nothing but tough times, living in the bleak circus of the slums he calls home amongst denizens of the underworld: the crippled pimp, the lonely housewife, the neighborhood gay and his macho father, the prostitutes, the small-time politician, and the Yankee pedophile. This is his story and the story of the world he lives in: a hopeless, closed-in decrepit w... Leer todo",75,mondomanila: kung paano ko inayos ang buhok ko matapos ang mahaba-haba ring paglalakbay,2012
1391,-,['Flavio Parenti'],"['Matteo Alfonso', 'Flavio Parenti']","A journey, a visual stream of consciousness inside the memories of a character who tries to remember a distant summer's holiday.",71,sogno farfalle quantiche,2012
1392,5.4,['Luke Tierney'],"['Ed Kavalee', 'Josh Lawson', 'Luke Tierney']","After losing their badges and crashing their Police car into a McDonald's Restaurant, two constables are given the worst duty of all, they must man the Scumbus.",70,scumbus,2012
1393,6.7,['Noah Buschel'],['Noah Buschel'],A story centered on an actress who has become agoraphobic who reluctantly allows a plumber into her apartment after her toilet overflows.,81,sparrows dance,2012
1394,3.8,['Martin Gooch'],['Martin Gooch'],"Following the sudden death of their last surviving parent - their Dad, two brothers and two sisters return to the family home after many years to face each other, face facts and face the future. But what do they know of the past?",104,after death,2012
1395,7.8,"['Ahmed Khawaja', 'Andre Puca']","['Ahmed Khawaja', 'Andre Puca']","This film is part autobiography, part fiction, with a healthy dose of self-conscious realism and tongue-in-cheek humor. Nursing a broken heart from his first breakup, Ahmed decides he's going to be homeless-this is his naive, lovesick attempt to get over the girl whose name is the inspiration for the film's title. Being the hopeless romantic that he is, Ahmed wants to... Leer todo",93,kwak or kassandra with a k,2012
1396,6.3,['Roman Prygunov'],"['Sergey Minaev', 'Denis Rodimin']",A story about things that are really important in life.,100,dukhless,2012
1397,5.1,['Ash Christian'],"['Ash Christian', 'Theresa Bennett']",The story of a family whose growth is stunted... a family that learns how to love themselves while loving each other (a little too much).,112,petunia,2012
1398,6.3,['Mat Whitecross'],['Chris Coghill'],"Five teenage friends will stop at nothing to attend a concert by their favourite band, The Stone Roses.",105,spike island,2012
1399,7.6,['Joyce Bernal'],['Mel Mendoza-Del Rosario'],"Already falling for each other, Bern (Regine Velasquez) starts maneuvering things to help Umboy (Aga Muhlach), retake the bar exams as he battles his fears to reclaim his self-esteem.",105,of all the things,2012
1400,5.9,"['Mark Potts', 'Cole Selix']","['Mark Potts', 'Cole Selix']","Hilarity ensues as a trio of friends who ""work"" at the Stanton Family Cinema must finally face the music of real life: keep their sweet slacker theater jobs or grow up?",80,cinema six,2012
1401,5.5,"['Michael Coleman', 'Eric Johnson']","['Michael Coleman', 'Eric Johnson']","Recently diagnosed with cancer, free-spirited teen Aiden Kesler grabs his video camera, his two best friends and documents their best day ever. Unaware of Aiden's cancer, his friends quickly jump on board, skip school and enjoy their day off. After challenging the school bully to a fight, Aiden continues to push his own boundaries and those of his friends as the day b... Leer todo",78,best day ever: aiden kesler 1994-2011,2012
1402,6.5,['Lance Polland'],['Lance Polland'],"The story of a Crack addicted prostitute named Honey. A girl who goes to a party out in the desert where she falls victim to drugs and gang rape. Spoon feeding herself crack, Honey decides to settle the score.",69,crack whore,2012
1403,2.8,['Derek Lee Nixon'],['Andrew Pozza'],"The world's most beloved illusionist, armed with his team of oxymoron's, embark on the freakiest, most adventurous paranormal investigation of all time. Terrorized at every turn by an unexplainable irregular patterns of mysterious paradox's, this witch-hunting, ghost busting, creature questing supernatural spooftacular is the funniest footage ever found!",92,supernatural activity,2012
