,0,1,2,3,4,5,6
1826,5.1,"['Jessie Mc', 'Cormack']","['Jessie Mc', 'Cormack']","When Andie (Michelle Monaghan, SOURCE CODE) gets pregnant after a one night stand, she offers to give the baby to her best friend (Radha Mitchell, RED WIDOW), who has been unable to conceive. But can their friendship survive the pregnancy?",87,gus,2013
1827,7.7,['Michael Patrick Kelly'],"['Michael Patrick Kelly', 'Kathleen Kiley']","When Joan Weldon discovers she is dying of lung cancer, she sets out to reconcile her dysfunctional relationships with her three children, her husband, and along the way, her former best friend. The family's destructive ways are offset by messy and somewhat humorous attempts by Joan to set her children on the right course before she dies. In this big dysfunctional mix... Leer todo",104,isn't it delicious,2013
1828,3.1,['Myles Sorensen'],['Myles Sorensen'],"For Charles, video-games are a much needed escape from reality. But when virtual vixen Sophia leads him on a mysterious quest through the lovelorn lives of six New Yorkers, they will all learn that in the game of life...every heart is a moving target.",79,plato's reality machine,2013
1829,4.9,['Chris Kiros'],"['Elias Dancey', 'Chris Kiros']","Three friends struggle to maintain their hedonistic lifestyles as they approach 30. Delving into their story, we become subjected to their inane theories, absurd philosophies and warped sense of humor.",103,the maladjusted,2013
1830,7.4,"['Ethan Coen', 'Joel Coen']","['Joel Coen', 'Ethan Coen']",-,104,inside llewyn davis,2013
1831,6.8,['Alex Richanbach'],['Alex Richanbach'],A movie about guys who act like girls and girls who act like guys.,90,we are young,2013
1832,5.2,"['Drew Rosas', 'Nick Sommer']","['Drew Rosas', 'Nick Sommer']","4 friends who played Little League have reunited to pay tribute to their teammates who were murdered 15 years earlier, only to have a vengeful masked killer with a weaponized baseball bat targeting them.",94,billy club,2013
1833,5.8,['Craig Zisk'],"['Dan Chariton', 'Stacy Chariton']",-,93,the english teacher,2013
1834,4.2,['Fabien Onteniente'],"['Fabien Onteniente', 'Philippe Guillard', 'Alain Chabat']","C'est l'histoire de quatre potes, quatre petits Français : le Grec (l'ostéopathe), Fifi (qui vit chez sa mère, concierge), Fortuné (l'Antillais qui travaille à la Cogex), et Freddy (le flambeur). Ils fréquentent assidument un PMU parisien, Le Balto. Fatigués de perdre le peu qu'ils ont, ils veulent arrêter de jouer au Turf Oui mais, selon la devise bien connue des tur... Leer todo",98,turf,2013
1835,6.0,['Jay Sukow'],"['John Berka', 'Jay Sukow', 'Todd Wojcik']",-,93,trubadeaux: a restaurant movie,2013
1836,-,['Jordi Roigé'],['Jordi Roigé'],"A judge drowned by debts submits to the orders of a bank. It decides to sponsor the trial of a racist related case. It becomes a great media festival, causing its development to diverge from the usual norms of Western legal systems",-,amor col·lateral,2013
1837,5.8,['Tom Luong'],"['Tom Luong', 'Julian Phillips', 'Pryde Pierce']","A young-adult brother and sister duo get grounded at Christmas after they break curfew. For the next few days, they find ways to sneak out of the house to go on night adventures around town. They later run into bank robbers hiding out in the hills, who then kidnaps the older sister. In the end the younger brother and his friends, including a boy wearing a Halloween We... Leer todo",90,the grounded,2013
1838,5.2,['Alberto Aranda'],"['Alberto Aranda', 'Belén Carmona']",-,95,la estrella,2013
1839,6.0,['Léa Fazer'],"['Léa Fazer', 'Benoît Graffin', 'Ayelet Menahemi']","Adeline's Chinese housekeeper suddenly disappears, leaving behind a little boy who doesn't speak a word of French. Helped by her sister, she takes care of the child and proceeds to locate the mother.",98,cookie,2013
1840,-,"['James Benson', 'Bernardo Britto']","['James Benson', 'Bernardo Britto']","Danny gets kicked out of his college dormitory a month before graduating and moving to LA with his roommate Cameron, where they have secured jobs as writers on a reality TV show. He spends his last few weeks in New York couch surfing as he and Cameron prepare to leave behind girls and their two best friends, Doug and Doug.",109,wisdom teeth,2013
1841,4.7,['Kapil Sharma'],['Devika Bhagat'],"As Ishaan, a music producer who has commitment issues with the women in his life, feels a connection with Gauri, his next-door neighbor, he begins to learn the importance of relationships.",108,"i, me aur main",2013
1842,5.2,['Maria Matteoli'],['Maria Matteoli'],-,90,the wine of summer,2013
1843,3.0,['Balázs Hatvani'],['Balázs Hatvani'],"To impress the girl of his dreams, Sam (Ashley Lloyd) enters an old amusement park, where torturous monsters roam the grounds.",83,gingerclown,2013
1844,6.5,['Nathan Silver'],"['Kia Davis', 'Nathan Silver', 'Cody Stokes']","""Thrown out of her New York City apartment, Natalia, a 25-year-old hot mess, relies on the kindness of friends and strangers. Seemingly unaware of the havoc she wreaks, she skips from one place to another, including her best friend's, where she crashes a holiday meal and seduces the best friend's socially inept brother. Natalia ends up staying at a shelter run by genu... Leer todo",71,soft in the head,2013
1845,4.9,['Jarret Tarnol'],['Brent Tarnol'],"After years of yearning for the girl next door, Artie finally builds the courage to woo her only to find out the girl of his dreams and best friend, April, is moving away - sending Artie into a deep depression.",84,april apocalypse,2013
1846,-,"['Amber Mc', 'Kenzie']",-,"A father, pushing 60, and his 30 year old daughter, a clinically depressed aspiring filmmaker, travel Route 66 in the hopes of making a documentary about the famed road.",86,"father, daughter, mother road",2013
1847,-,['Duarte Cascais Lopes'],"['Luís Oliveira', 'Paulo Oliveira', 'Paulo Oliveira']",-,-,al fachada,2013
1848,4.4,['D.W. Young'],['D.W. Young'],"Their relationship on the rocks, a young Brooklyn couple heads to a remote B&B to work things out. But from the moment they arrive at The Happy House it's one disaster after another, and they soon begin to suspect they've wandered into a real life horror movie. Events escalate from weird to terrifying as they contend with the house's batty owner, her imposing son, a m... Leer todo",81,the happy house,2013
1849,5.7,['Michael Doneger'],['Michael Doneger'],A listless writer pursues a woman to help him get over his ex girlfriend.,80,this thing with sarah,2013
1850,4.6,['Gary Michael Schultz'],"['Mike Dozier', 'Gary Michael Schultz']","After Doreen has been possessed by the devil on her wedding night, her groom Hank, and her rebellious brother Travis, put aside their differences to travel across country from Chicago to Las Vegas, in the hopes of finding a mythical street preacher who is said to be the last exorcist in America.",95,devil in my ride,2013
1851,3.4,"['Lachlan Ryan', 'Jarrod Theodore']","['Lachlan Ryan', 'Jarrod Theodore', 'Dan Cannon']",A teenager pursues his childhood dream of becoming the best at reverse running.,86,reverse runner,2013
1852,6.5,"['Will Mc', 'Cord']","['Will Mc', 'Cord']",Five different stories of lonely people who meet through Internet sex personals.,80,casual encounters,2013
1853,6.7,['Charlie Cline'],['Charlie Cline'],"'I can shoot ink out of my fingers. That's about it really. Sometimes, in pressure situations, I can shoot it out of my toes.' When Squid Man gets downsized out of the Superhero Society, he's forced to crash on the couch of his former sidekick (and only friend) Warren. Now he spends his time boozing in a dead end bar, reminiscing about the days when the hero groupies ... Leer todo",89,squid man,2013
1854,5.6,['Peter Wellington'],['Jeremy Boxen'],-,91,cottage country,2013
1855,6.4,['Goran Markovic'],"['Goran Markovic', 'Tihomir Stanic']",Our story takes place at the end of the 1960s. This is the time of the collapse of the ideals of a more just and honorable life brought into prominence by students worldwide in the great rebellion in 1968 and of the beginning of the end of an equally grand illusion called Yugoslavia. Andjelko is the principal of a middle school in a small Bosnian place Dubica. He beli... Leer todo,90,falsifikator,2013
1856,8.1,['Owen Dara'],['Owen Dara'],"Choosing Signs is a charming romantic comedy about an American woman who follows the signs from the Universe all the way to Ireland, only to discover that when it comes to love the Universe may not always be on her side.",87,choosing signs,2013
1857,6.8,['David Nieto Wenzell'],['David Nieto Wenzell'],"Aurora, a divorced woman, receives a call from her 14 year old son's principal to let her know that he is being expelled on the last day of class. In an attempt to reach her son, she fights to fulfill her duties as a publicist, daughter, sister, and single mother. Meanwhile, her son deals with the insecurities of growing up. A chaotic city and an outdated education sy... Leer todo",76,la llamada,2013
1858,7.2,['Nadine Truong'],['West Liang'],"When three childhood friends reunite on one midsummer night, their delirious abandon and reminiscence explodes into a daring search for hope and deliverance from the burden of their dreams.",81,someone i used to know,2013
1859,4.1,['Michael Hanus'],"['Michael Hanus', 'Guy Christie', 'Duncan Mac', 'Lellan']",A shy struggling actor is dragged into the wild world of male stripping by his egotestical brother Jackhammer.,95,jackhammer,2013
1860,3.7,['Michael Urie'],"['Halley Feiffer', 'Ryan Spahn']","When an aspiring actress loses her support system in one fell swoop, she sets out with a stolen script, her brother, and his boyfriend to make a movie.",96,he's way more famous than you,2013
1861,6.7,"['Marguerite Abouet', 'Clément Oubrerie']","['Marguerite Abouet', 'Clément Oubrerie']","Love stories in Yopougon, a neighborhood of the Ivory Coast capital.",84,aya de yopougon,2013
1862,4.8,['Lee Brownstein'],"['Kevin Birnbaum', 'Lee Brownstein', 'Andersen Gabrych']",Celebutante Prissy Alcott leaves her luxe Reno life behind for her childhood home in Colorado when she learns that her family has gone broke and is selling their ranch. She tries to reboot the family enterprise as a dude ranch with the help of her three gay friends.,93,out west,2013
1863,5.3,['Mauro Baptista Vedia'],['Mauro Baptista Vedia'],"A decadent upper class family of mother and three children who live in one of the richest neighborhoods of the city of Saint Paulo, Brazil, is faced with the past as the long estranged father, who supposedly was the cause of the family's ruin, returns and accommodates himself in the house as if nothing had changed.",77,jardim europa,2013
1864,4.4,['Duane Journey'],['David Tillman'],A brother and sister battle a witch who lures teenagers into her suburban home with her special blend of marijuana where she then proceeds to kill and eat them to maintain her youth and beauty.,86,hansel & gretel get baked,2013
1865,8.0,['Metal Man'],"['Socrates Adams-Florou', 'Chris Killen', 'Joe Stretch']","Friendship, documentary-making and MMORPGs.",76,wizard's way,2013
1866,5.1,"['Adam Beamer', 'Evan Beamer']","['Adam Beamer', 'Evan Beamer', 'Craig Hildebrand']",The owners of a failing security company start robbing houses to boost business.,94,in security,2013
1867,4.1,['Richard Foster'],"['Deborah Foster', 'Richard Foster']",Ashley lives in the fast lane until a handyman invades her life and she's directing a Christmas play for underprivileged kids. She finds her soulmate and they might live happily ever after--unless her stepbrother gets her killed.,115,so this is christmas,2013
1868,6.8,['Bruno Irizarry'],['Bruno Irizarry'],"Raul, a Puerto Rican born in New York, meets Maria, a young Puerto Rican woman visiting NY, one night. Struck by love at first sight, he travels to Puerto Rico in search of this beautiful girl.",98,200 cartas,2013
1869,6.6,['Malcolm D. Lee'],['Malcolm D. Lee'],-,123,the best man holiday,2013
1870,1.7,"['Scarlet Fry', ""Jacob D. O'Neal"", 'David Sabal']","['Scarlet Fry', 'Laurence Holloway', ""Jacob D. O'Neal""]","A battered and mysterious VCR...A bevy of lethal video- tapes... These are the building blocks of horror in ""DEATH BY VHS"". A mind blowing descent into madness and death. Five shocking vignettes, designed to take your sanity and devour your soul! Mild curiosity leads to severe consequences when a couple rents a supposedly cursed video cassette recorder. An urban legen... Leer todo",72,death by vhs,2013
1871,5.5,['Aleksi Mäkelä'],"['Mika Karttunen', 'Elias Koskimies', 'Lauri Puintila']",Aarno Lamminparras hijacked an airplane with a gun in 1978. A true story.,93,kaappari,2013
1872,4.8,"['Timo Koivusalo', 'Riku Suokas']","['Riku Suokas', 'Heikki SyrjäHeikki Vihinen']","The movie is the story of Lokomo laborer, and group of friends that dreams come true and a thirst for fast-paced life that take decades.",100,vuonna 85,2013
1873,8.3,['Malani Coomes'],"['Malani Coomes', 'Rachel Coomes']","Dodging casting couches and Jager bombs, has-been actors and long-winded girlfriends, two girls must tackle love and career in the perilous city of Los Angeles.",90,black hearts,2013
1874,3.0,['Aidan Belizaire'],"['Rebecca-Clare Evans', 'Jennifer Jones', 'George Mc', 'Cluskey']","After heartbroken widower Samuel makes a deal with Kalfu, the god of Malevolence. This allows Samuel to live with his dead wife as a zombie, and leads to the destruction of the underworld.",85,the zombie king,2013
1875,7.3,['Damon Jamal'],"['Peter Bisson', 'Mike Korich', 'Jason Medbury']","Relationships, stereotypes, drug addictions and sexual identities never intended for the camera are revealed when a young filmmaker breaks into his high school to make a movie with an eclectic group of his classmates.",90,rolling,2013
1876,6.0,['Analeine Cal y Mayor'],"['Analeine Cal y Mayor', 'Javier Gullón']",Mica is born smelling of fish that soap and doctors can't remove. Problems increase starting school as no one'll be his friend. He sees a therapist. His life seems doomed until he meets Laura.,92,the boy who smells like fish,2013
1877,8.1,['Kirsten Russell'],['Kirsten Russell'],"Meet Ted and Kate, a miserable suburban couple who destroy the last of their marriage battling for the affections of a secondhand motorcycle in a bazaar love triangle. Then there's Mac and Lila who fall in love through Plexiglas as Mac counts his final days on death row. And last but not least, there's Nadine, who endures a torturous and ridiculous spiritual purificat... Leer todo",129,rabbit stories,2013
1878,7.0,"['La', 'Shirl Smith']","['Lillian Garcia-Johnson', 'Ken Sagoes', 'La', 'Shirl Smith']","Marketing executive Candy Boudreaux tackles her biggest campaign when she decides to pursue star football player Eric Whitaker for her own personal satisfaction. She quickly becomes sidelined when she becomes intertwined into the unknown sports world of parties, blackmail and sexual games, all just be be with Eric. Eric, very egotistical and arrogant has no plans of s... Leer todo",85,sideline confessions,2013
1879,8.1,['James Huang'],['James Huang'],A young couple are on the brink of divorce when they are audited by the IRS.,89,starting from scratch,2013
1880,-,['Tim French'],"['Michael French', 'Tim French']",Two men (an ex-college professor and his loose-cannon cousin) have three days to track down diamonds that were stolen from their crime boss' jewelry store.,-,setback,2013
1881,4.8,['Zack Bernbaum'],['Michael Hamilton-Wright'],An advertising CEO wakes up in the hospital speaking only in ad slogans.,87,and now a word from our sponsor,2013
1882,8.5,"['Sean Dunn', 'Luke Jarvis']","['Sean Dunn', 'Luke Jarvis']","THE CONFABULATORS is a feature film about WALTER, a young man struggling to balance his relationship with his long-term girlfriend MARNY and his attempts to climb the corporate ladder at Cobb Inc. Walter's life takes an unexpected turn when his second cousin, TED, moves into his apartment. Soon, Ted starts showing up at Walter's office and infiltrating his social life... Leer todo",90,the confabulators,2013
1883,6.7,['Gregg Golding'],['Gregg Golding'],"6 young people suffer traumatic experiences which cause a tumor in the collective unconscious. They then draw on this tumor's energy to become a helmeted, power rangers like action squad known as the Struggled Reagans. In search of their birth tumor, the hindu bird god, Garuda, sends monsters in their path. Join the Reagans In this vibrant and darkly humorous, pop sur... Leer todo",85,struggled reagans,2013
1884,2.6,['Jyotin Goel'],['Jyotin Goel'],"Hum Hai Raahi CAR Ke is the story of two friends who on one New Year's night decide to travel from Mumbai to Pune. But a trip that should only take a couple of hours ends up becoming an all-nighters, with wacky events keeping them on the road and preventing them from reaching their destination.",-,hum hai raahi car ke,2013
1885,6.6,['Therese Shechter'],"['Therese Shechter', 'Lisa Esselstein', 'Marin Sander-Holzman']","It has launched both purity balls and porn franchises, defines a young woman's morality-but has no medical definition. Enter the magical world of virginity, where a white wedding dress can restore a woman's innocence and replacement hymens can be purchased online. Filmmaker Therese Shechter uses her own path out of virginity to explore why our sex-crazed society cheri... Leer todo",67,how to lose your virginity,2013
1886,5.1,['Dennie Gordon'],"['Amy Snow', 'Chris Chow', 'Hai Huang']",A woman gets caught up in an international diamond heist which pushes her close to a spy who is trying to save the world.,114,fei chang xing yun,2013
1887,8.6,['Zack Ordynans'],['Zack Ordynans'],"When two 30-ish couples retreat from New York City to a crumbling resort in the Catskills, they find a new home filled with quirky residents. As the friends struggle to adapt to a low-pressure life of leisure, their relationships fray.",83,palace living,2013
1888,6.3,['G.J. Echternkamp'],['Matt Yamashita'],"Two self-aware characters in a ""Call of Duty"" style video game struggle with their screwy, frustrating existence.",82,virtually heroes,2013
1889,5.7,['Karen Oganesyan'],"['Sergey Kaluzhanov', 'Gennadiy Ostrovskiy', 'Irina Pivovarova']",The unfortunate trainer prepares an old woman for a race in Los Angeles. A tragicomedy about the Russian approach to the American dream.,101,marafon,2013
1890,5.6,['Vishal Bhardwaj'],"['Vishal Bhardwaj', 'Abhishek Chaubey']","Harry is an industrialist who loves his daughter Bijlee, and the bond they share with Harry's man friday, Matru. Bijlee's plan to wed the son of a politician, however, brings twists and turns in the lives of Matru, Bijlee and Mandola.",151,matru ki bijlee ka mandola,2013
1891,-,['Gianfranco Gaioni'],['Mehdi Francois-Ackerman'],"Jenny, a young actress, gets stuck in an elevator with Thomas, a cold and arrogant novelist. They first clash until Jenny realizes that Thomas's arrogance is nothing but a shell that protects a fractured soul.",77,weightless,2013
1892,5.6,['Joseph Laraja'],['Kevin Harrigan'],"Every year since 1969 the best three fried fish restaurants in the northeast have competed in the Golden Scallop Championship. The 43rd annual pits a food truck seeking redemption, an aging former champion and a well financed, novelty friendly fish house against each other in the truest test of short order cooking mettle. Follow the excitement, hilarity, and chaos as ... Leer todo",83,the golden scallop,2013
1893,4.5,['Ron Carlson'],"['Terri Kauffman', 'Ron Carlson']",A white-trash mom is visited by three ghosts intent on showing her a path to a brighter future.,88,all american christmas carol,2013
1894,6.5,['Georgiy Paradzhanov'],['Georgiy Paradzhanov'],"Childhood memories play on the mind of the central character, Garry. Many years on, he returns to his native town. Everything feels alien and strange. Our hero comes back to recover his memories, the good ones and the bad ones, the pleasant ones and the painful ones. Will the old fortune-teller Nina, a well-known dream gatherer in the city, be able to set an already g... Leer todo",115,vse ushli,2013
1895,8.3,['Lucas Pops'],['Lucas Pops'],"Tattoo artist Jones Henry has found out he has Acquired Immune Deficiency Syndrome. Through a series of vignettes, Jones tells us all about his past exploits and adds his own personal take on the situation. Through his recollections, he attempts to find his own redemption and discover what his new life will have in store for him, however long it may be.",-,wayward,2013
1896,6.1,['Rohit Shetty'],"['K. Subhash', 'Yunus Sajawal', 'Robin Bhatt']",A man travelling to Rameswaram via Chennai express for his late grandfather's ashes immersion finds himself in trouble after helping a don's daughter and her cousins board the train.,141,chennai express,2013
1897,6.3,['Oskar Roehler'],"['Oskar Roehler', 'Klaus Richter']","This is a family story that covers 30 years in the life of the Freytag family, narrated by grandson Robert. When his grandfather returns from Russia in 1949, he becomes part of the German ""economic miracle"" by producing garden gnomes. Robert's father Klaus wants to become a writer. He marries Gisela, who almost immediately gets pregnant with Robert, but the marriage d... Leer todo",174,quellen des lebens,2013
1898,6.4,['Matthew Watts'],"['Francisco Angones', 'Jessica Sue Burstein', 'Craig Di', 'Folco']","Surprise parties rarely go well. This one is no different, as a group of 30-somethings head through life, love and a day in New York City.",86,mutual friends,2013
1899,6.5,['Andrzej Wajda'],['Janusz Glowacki'],"The depiction of the life of Nobel Peace Prize winner and founder of Poland's Solidarity movement, Lech Walesa, as events in the 1970s lead to a peaceful revolution.",127,walesa. czlowiek z nadziei,2013
1900,7.0,['Felix Herngren'],"['Felix Herngren', 'Hans Ingemansson', 'Jonas Jonasson']",-,114,de 100-jarige man die uit het raam klom en verdween,2013
1901,3.1,"['M. Kelley', 'Shawn C. Phillips', 'Alex Powers']","['Shawn C. Phillips', 'Alex Powers', 'Doug Waugh']","Mona Screamalot, along with her crazy family, prepares you for six short horror films from deep within her trashy treasure chest. This anthology features party killers, giant killer babies, an angry murderous child, a bacterial infection like no other, a murderous cross dresser,a killer in the woods, and Satan. Oh yeah, don't forget the buckets of blood.",82,treasure chest of horrors ii,2013
1902,7.9,"['Charlie La', 'Voy']","['Owen Hornstein', 'Charlie La', 'Voy', 'Tyler Russell']",Four friends embark on a misadventure to a remote lake house where one of them announces that he plans to kill himself.,81,steve chong finds out that suicide is a bad idea,2013
1903,6.3,['Josiah Signor'],"['Andy Martino', 'Mike Rossetti', 'Josiah Signor']","Married couple Jesse and Jen split up the night before their old pals' annual Halloween party. They go, and it's a mess. Instead of celebrating life and career successes, the four early-30s friends are forced to confront darker realities: adultery, divorce, pregnancy-- the basic issues that make adulthood more complicated than anyone expects it to be.",80,bastards of young,2013
1904,8.0,['Chris Berkenkamp'],"['Chris Berkenkamp', 'Jack Dusi', 'Mike Dusi']","4 years, 3 continents, 2 friends, 1 dream, and no script.",90,mikeyboy,2013
1905,6.3,['Nicolas Bary'],"['Daniel Pennac', 'Jérôme Fansten', 'Serge Frydman']","There's something odd about the Malaussène tribe; something fishy, some might even say abnormal...",92,au bonheur des ogres,2013
1906,6.3,['Lance Daly'],['Lance Daly'],Tells the story of a family as they search for a lost fortune around the streets of Dublin.,83,life's a breeze,2013
1907,-,['Lee Michael Cohn'],['Lee Michael Cohn'],-,123,crime share,2013
1908,1.4,['Iain S. Paterson'],['Iain S. Paterson'],"Edmund, a young English telemarketer, is willing to risk his job for just one thing, or anything, actually. On a whim, he lands in Hong Kong, the exotic city of opportunity, hustlers, bizarre expats and Annie, the one true love of his life. She's seductive, intense and in love with Laurent, a French neo-Marxist. Caught up in a landscape of tropical islands, bustling m... Leer todo",90,drink tea ghost man,2013
1909,6.3,"['Jenée La', 'Marque']","['Jenée La', 'Marque']","A tragedy presents Laurel with the chance to reinvent herself as her idolized twin sister, Audrey. As she eases into the life she has always wanted, she must decide between continuing the lie or revealing herself as the perfect fraud.",90,the pretty one,2013
1910,6.8,['Andy Bowles'],['Andy Bowles'],A film festival experience as seen through the eyes of actor Andy Bowles and his team of red carpet anchors as they cover a 10-day celebrity-filled event.,96,how we covered it,2013
1911,7.5,['John Lee Hancock'],"['Kelly Marcel', 'Sue Smith']",-,125,saving mr. banks,2013
1912,4.7,['Christian James'],['Dan Palmer'],A janitor gets trapped in a women's restroom and encounters an all-out attack by a horde of zombies.,84,stalled,2013
1913,2.6,['Matt Hish'],"['Keith Brown', 'Scott Rosa']",Some people drink to forget. Rock stars drink to remember.,90,the blackout,2013
1914,4.1,['Cüneyt Yosulçay'],['Aydogan Temel'],-,95,komik bir ask hikayesi,2013
1915,4.6,['John V. Knowles'],['Lotti Pharriss Knowles'],"In the early 1600s, Countess Elizabeth Bathory slaughtered more than 600 young women, believing that if she bathed in the blood of virgins, she would stay young and beautiful forever. Still alive today, she's found a perfect hunting ground for her 'botox' as an abstinence educator in conservative America, and the young ladies of San Griento High are poised to be her n... Leer todo",93,chastity bites,2013
