,0,1,2,3,4,5,6
656,3.6,['Mohammad Dormanesh'],-,"Aziz and Blabs are two close friends who live together and work together in the dead of a rural house. One night, Blobs sees a large number of women's shoes and sandals in his dream, and as soon as he wakes up, he reads his interpretation in the book that shoes are a symbol of getting married. He is saddened by this dream; Because according to Blobs, he cannot marry. ... Leer todo",-,azhans ezdevaj,2011
657,5.4,['Rob Hedden'],['Rob Hedden'],"An unassuming pet photographer is thrown into serious action, adventure and romance when he's forced to marry a Croatian bride and spend his honeymoon at a remote tropical resort where she is kidnapped.",99,you may not kiss the bride,2011
658,8.2,['Anthony Pierce'],['Anthony Pierce'],-,-,american disciples,2011
659,4.8,['Minh Collins'],['Thompson Evans'],"While dating a woman (Shirly Brener) with anger-management issues, a hitman (Joey Lawrence) finds her journal and uses it as a guide to prove how much he loves her.",90,hit list,2011
660,3.8,['Jim Haggerty'],['Jim Haggerty'],"A high-energy throwback to the dirty joke movies of the 1970s, more than 70 classic dirty jokes have been brought to life in IS THIS A JOKE? These dirty jokes we all remember hearing and telling years ago have never been funnier as they come to life with a young and funny cast. There's something for everyone! Sit back, relax and prepare to smile!",75,is this a joke?,2011
661,6.4,['Marteinn Thorsson'],"['Hallgrímur Helgason', 'Marteinn Thorsson']","The tragicomic story of lone rebel Boddi Steingrimsson who lives in a small town in Northern Iceland. Boddi hates materialistic modern society in its entirety and on his blog-page he comically criticizes everything and everyone. Before long he has become an outlaw in his own hometown, just like his viking hero, Grettir. After a series of dramatic mishaps, he snaps and... Leer todo",111,rokland,2011
662,4.4,['Olallo Rubio'],['Olallo Rubio'],"Twisted, apocalyptic satire, THIS IS NOT A MOVIE envisions the end of the world through the bi-polar mind of a strung-out pop-culture addict. Starring Edward Furlong and Peter Coyote, with a jagged, atmospheric score from Slash.",99,this is not a movie,2011
663,7.0,['Cameron Crowe'],"['Aline Brosh Mc', 'Kenna', 'Cameron Crowe', 'Benjamin Mee']",-,124,we bought a zoo,2011
664,5.9,['Diego Corsini'],"['Sebastián Botticelli', 'Diego Corsini']","Santiago lives in the present. Florencia only thinks about the future. They have been together for a while and their relationship is going through a great moment. But one Sunday morning, a disagreement occurs: present against future.",101,solos en la ciudad,2011
665,3.8,['Shira Piven'],"['Paula Killen', 'Lisa Ann Orkin', 'Shira Piven']","On a rare evening out, two feisty single moms discover that it's not so easy to hook up with a total stranger (Dweezil Zappa) anymore. This ""van-centric"" dark comedy, set in LA--offers an opportunity to eavesdrop on how women genuinely feel about men, relationships and themselves.",77,fully loaded,2011
666,6.4,['Dennis Lee'],['Dennis Lee'],"At the age of ten, Henry James Herman, a boy who was conceived in a petri-dish and raised by his feminist mother, follows a string of Post-It notes in hopes of finding his biological father.",92,jesus henry christ,2011
667,6.0,['Mark Waters'],"['Sean Anders', 'John Morris', 'Jared Stern']",-,94,mr. popper's penguins,2011
668,-,['Amol Shetge'],"['Suresh Jayram', 'Parag Kulkarni', 'Amol Shetge']","'Don Ghadicha Daav' is the story of a young woman - Vaidehi Sarpotdar (Sai Tamhankar), whose invalid husband - Arjun Sarpotdar (Sayaji Shinde) is murdered. A stranger, whose car breaks down near Sarpotdar's bungalow walks in and identifies himself as Saumitra (Makarand Anaspure). He comes to the rescue of Vaidehi, who is confused in such a situation and then he draws ... Leer todo",-,don ghadicha daav,2011
669,6.0,['Marc Colucci'],['Jason W. Loomis'],What happens when a law student breaks the law to pay for law school?,84,slip & fall,2011
670,6.8,"['Andre Alves Pinto', 'César Rodrigues']","['Ziraldo', 'Maria Gessy']","After studying in the capital, the teacher Cate returns to her small town in Minas Gerais to teach at primary school in the early 40's. Her way of teaching students delights and irritates the other teachers. She just wants to give students something essential to education: enthusiasm.",90,uma professora muito maluquinha,2011
671,5.8,"['George Miller', 'Gary Eck', 'David Peers']","['George Miller', 'Gary Eck', 'Warren Coleman']",-,117,happy feet 2,2011
672,-,['Mark Taylor'],['Todd Edwards'],-,89,the matador ii,2011
673,8.7,['Asit Kaul'],"['Manpreet Brar', 'Asit Kaul']","What if everything we plan is challenged by the surprises of destiny. Do you like surprises? What if they turn out to be bad? Ricky is ready for his blind date. He reaches the destination and meets the woman of his dreams, Jasmine. Everything is perfect: flowers, wine, dance .. but .. some things cant be planned. The beautiful night turns into a melange of adventure ... Leer todo",90,a date with fear,2011
674,7.5,['Jim Doyle'],['Neil Fitzmaurice'],-,102,charlie noades r.i.p,2011
675,7.8,['Aaron James'],['Aaron James'],-,90,campus radio,2011
676,5.7,"['Shaun Paul Costello', 'Joe Gariffo', 'Charlie Anderson']","['Shaun Paul Costello', 'Joe Gariffo']","Two friends chase after the girls of their dreams. Through a series of events, each guy gets with the other's girl.",86,swooped: based on a real life occurrence,2011
677,6.2,['Ivan Reitman'],"['Elizabeth Meriwether', 'Michael Samonek']",-,108,no strings attached,2011
678,3.3,['Tom Brady'],"['Adam Sandler', 'Allen Covert', 'Nick Swardson']",-,97,bucky larson: born to be a star,2011
679,5.4,['Tim Hill'],"['Cinco Paul', 'Ken Daurio', 'Brian Lynch']",-,95,hop,2011
680,6.5,['Todd Phillips'],"['Craig Mazin', 'Scot Armstrong', 'Todd Phillips']",-,102,the hangover part ii,2011
681,7.2,['John Madden'],"['Ol Parker', 'Deborah Moggach']",-,124,the best exotic marigold hotel,2011
682,3.6,['Robin Blazak'],"['Robin Blazak', 'Eric Blazak']",Tells the tale of three buddies in their 20's whose love-lives are in shambles. They go to Aspen to pursue the booming trend of dating cougars: hot older women who prey on hot young guys.,102,cougar hunting,2011
683,5.4,['Santiago Segura'],['Santiago Segura'],-,93,torrente 4,2011
684,7.1,['Michael M. Bilandic'],['Michael M. Bilandic'],"New York Tunez, an all techno record store, is going under. The owner, Keith, a down and out trance DJ, struggles to cope with the changing cultural climate. In a final effort to save the store he organizes a rave. Unfortunately, 2009 is a far cry from the early '90's.",73,happy life,2011
685,6.2,['Alex Steyermark'],"['Roger Rawlings', 'Ed Bradin', 'Andrew Pope']","Chosen by the man himself, the Kevin Smith Movie Club presents Losers Take All. A band is given the chance of committing the ultimate sin: selling out. They must decide if they'll stick to their roots or give in to corporate rock.",96,losers take all,2011
686,6.3,['David Schalko'],"['Thomas Glavinic', 'Thomas Maurer', 'David Schalko']","The story of Charlie, a young guy who hasn't learned to live as an adult yet.",100,wie man leben soll,2011
687,-,['Alisher Uzakov'],-,-,77,mening akam boydoq,2011
688,5.2,"['Stokes Mc', 'Intyre']","['Jon K. Langston', 'Peter Tannenbaum', 'Mark Bremhorst']","A disenfranchised adult film star, is forced to live with his parents in an Arizona retirement community, where he discovers his place in life.",103,valley of the sun,2011
689,4.3,['Andrés G. Schaer'],"['Amèlia Mora', 'Albert Val', 'Sergio V. Santesteban']",-,86,floquet de neu,2011
690,4.9,['J.P. Riley'],"['Katie L. Hall', 'Annie Levine', 'J.P. Riley']",-,90,act naturally,2011
691,7.1,"['Sarah Smith', 'Barry Cook']","['Peter Baynham', 'Sarah Smith']",-,97,arthur christmas,2011
692,5.9,['Otto Alexander Jahrreiss'],['Otto Alexander Jahrreiss'],A screwball comedy about four couples living in a big city.,96,die relativitätstheorie der liebe,2011
693,6.1,['Jacob Estes'],['Jacob Estes'],"When a family of raccoons discover worms living underneath the sod in Jeff and Nealy's backyard, this pest problem begins a darkly comic and wild chain reaction of domestic tension, infidelity and murder.",101,the details,2011
694,6.7,['Tanya Wexler'],"['Stephen Dyer', 'Jonah Lisa Dyer', 'Howard Gensler']",-,100,hysteria,2011
695,-,['Kyle Brown'],['Kyle Brown'],-,-,unexpecting,2011
696,4.8,['Dermot Mulroney'],"['Anouska Chydzik', 'Caprice Crane']",A happy newlywed marriage counselor's views on wedded bliss get thrown for a loop when she finds out her parents are getting divorced.,90,"love, wedding, marriage",2011
697,6.9,['Carlos Saldanha'],"['Carlos Saldanha', 'Earl Richey Jones', 'Todd R. Jones']",-,96,rio,2011
698,6.4,['Craig Gillespie'],"['Marti Noxon', 'Tom Holland']",-,106,fright night,2011
699,6.2,['Nicole Kassell'],['Gren Wells'],-,107,a little bit of heaven,2011
700,6.7,['Paolo Sorrentino'],"['Paolo Sorrentino', 'Umberto Contarello']",-,118,this must be the place,2011
701,2.7,"['Muhammad El-Shura', 'Shura']",['Sayyed El-Subki'],"A dancer decides to switch from dancing in a folklore troupe to dancing in one of Haram Street's nightclubs. Three men fight over her. The first is an officer who customarily married her after she loved him and then divorced her. The second, so-called ""the minister of affection"", works in Haram Street. The third is a drummer who helps her to transform from folk art to... Leer todo",-,share el-haram,2011
702,6.8,['Lasse Hallström'],"['Simon Beaufoy', 'Paul Torday']",-,107,salmon fishing in the yemen,2011
703,3.1,['William Dear'],['Gary Goldstein'],A comedy romance inspired by the slew of publicly documented election love stories that sprung up during Obama's Presidential push. The plot follows the fortunes of a campaign team caught up in a whirlwind of euphoric romances.,93,politics of love,2011
704,7.1,['Joseph Cedar'],['Joseph Cedar'],"Eliezer and Uriel Shkolnik are father and son as well as rival professors in Talmudic Studies. When both men learn that Eliezer will be lauded for his work, their complicated relationship reaches a new peak.",107,footnote,2011
705,5.5,['John Stockwell'],"['Nick Ball', 'John Niven']",-,106,cat run,2011
706,6.9,['Maurice Linnane'],"['Barry Devlin', 'Maurice Linnane']","Nineteen year old Orla from Country Antrim wins 'Follow a Star' on the Irish national TV station. Her prize is a quest - to find C&W star Jed Wood, give him a kiss, and report on her adventure on the following week's show. Ray Timmons, a middle aged documentary cameraman, is the only person available to document her on her quest. Together they travel to New York, meet... Leer todo",86,a kiss for jed wood,2011
707,7.1,"['Stephen J. Anderson', 'Don Hall']","['Stephen J. Anderson', 'Clio Chiang', 'Don Dougherty']",-,63,winnie de poeh,2011
708,6.0,['Michael Cuesta'],"['Gerald Cuesta', 'Michael Cuesta']","After 20 years on the road with Blue Oyster Cult, Jimmy Testagros returns to his hometown to life with his ailing mother. Complications arise when he falls for an old friend, who is now married to his longtime nemesis.",95,roadie,2011
709,5.2,['Rikki Beadle Blair'],['Rikki Beadle Blair'],"In 5-man-a-side soccer, a newly formed gay team goes up against an established team with a deserved reputation for violence and a skittish first-time official, with more action off-field than on.",99,kickoff,2011
710,-,['Baundo Aragão'],-,-,130,a encomenda de maria formosa,2011
711,4.8,['Harald Sicheritz'],"['Bettine von Borries', 'Achim von Borries', 'Knister']","Lilli is traveling to India, to solve a mystery.",90,heksje lilly en de reis naar mandolan,2011
712,-,-,-,Ver la información de la producción en IMDbPro,133,oh my grease!,2011
713,6.7,['Nanni Moretti'],"['Nanni Moretti', 'Francesco Piccolo', 'Federica Pontremoli']",-,102,habemus papam,2011
714,6.8,['Michael Dowse'],"['Jay Baruchel', 'Evan Goldberg', 'Adam Frattasio']",-,92,goon,2011
715,5.5,['Josh Sugarman'],"['Josh Sugarman', 'Brandon Yankowitz']","To win the celebrity and self-made wealth he craves, an aimless, twenty-something Manhattan playboy devises a film based on his party-boy, club-going lifestyle, and hires a self-destructive aspiring playwright to ghost the feature script. As the mismatched pair struggles to complete the script and get a handle on their misdirected lives, they reveal the sometimes come... Leer todo",104,trophy kids,2011
716,6.4,['Andrew Disney'],['Andrew Disney'],Reunited friends find themselves the chief suspects of a murder mystery that seems eerily similar to a play they performed in high school.,94,searching for sonny,2011
717,4.4,['John Whitesell'],"['Matthew Fogel', 'Don Rhymer', 'Darryl Quarles']",-,107,"big mommas: like father, like son",2011
718,6.0,['Václav Havel'],['Václav Havel'],An absurdist look at the life of an ex-politician.,94,odcházení,2011
719,6.4,['Juan Pablo Bustamante'],['Juan Pablo Bustamante'],"A young boy falls in love with a stunning girl, who simply ignores him. But three men with different strategies in the art of love (romance, lies and money), come to the rescue to try to lead the young boy to his dream: a kiss on the lips.",100,lecciones para un beso,2011
720,3.3,"['Jaiveer', 'Anay Sharma']","['Jaiveer', 'Sarim Momin']",Three married men seek counseling from a fourth in order to meet and date other women.,134,happy husbands,2011
721,5.4,['Rosa Karo'],['Rosa Karo'],"A romantic fairy tale about a 19-year old orphan girl who, as her sole inheritance, gets an antique key that unlocks both an old Italian villa and the secrets of her family history.",92,the italian key,2011
722,7.2,['Thom Fitzgerald'],['Thom Fitzgerald'],"A lesbian couple escape from their nursing home and head up to Canada to get married. Along the way, they pick up a young, male hitchhiker.",93,cloudburst,2011
723,3.7,['Todd Tucker'],"['Timothy Dolan', 'Todd Tucker']","The Taylor's family dog, Max, is kidnapped by the evil Sirus Caldwell, (Zack Ward) CEO of mega corporation Envigormax, to be used as a test subject for a new super energy drink. When trials go terribly wrong, Max escapes only to be transformed from his lovable self into... ""Monster Mutt""!",89,monster mutt,2011
724,7.6,"['Randy Mack', 'Zack Ordynans']","['Randy Mack', 'Zack Ordynans']",Two old friends who haven't seen each other in years reunite after a tragedy in the life of a mutual college buddy. Hijinks ensue when they realize sharing an apartment for a week isn't going to be like when they were dormies. Primer meets The Darjeeling Limited.,71,one week to bill's thing,2011
725,-,['Stuart Orme'],"['Indy Feige', 'Tasha Hardy']","""London Fog"" is a surreal dramedy/love story about a Midwest boy, Bob Sparkle, his love for monsters and Brazil, the girl who inspires him to ignore convention and be himself. Bob and Brazil grow up apart and abandon both the art they love and each other as they are pulled into their mundane lives. When chance takes him to London, Bob rediscovers his love for Brazil a... Leer todo",-,london fog,2011
726,4.4,['Nathanael Coffman'],['Nathanael Coffman'],"A high school love comedy, which authentically depicts the lives of today's ever-evolving and parentally subversive youth culture.",91,getting that girl,2011
727,5.1,"['Mike Bradecich', 'John La', 'Flamboy']","['Mike Bradecich', 'John La', 'Flamboy']",The Mugg Brothers inherit an apartment building with a monster living in the basement that's eating everything in sight.,90,the moleman of belmont avenue,2011
728,5.3,['Gil Cates Jr.'],"['Kent Sublette', 'Gil Cates Jr.']",A wannabe serial killer wins the lottery and pursues his lifelong crush.,103,lucky,2011
729,2.8,['Paul Della Pelle'],"['Bruce Brown', 'Paul Della Pelle']","An entertaining sci-fi thriller with plenty of action, drama, humor, and bits of gor, Lizard Boy raises questions about modern genetics while harkening back to the monster movies of old.",98,lizard boy,2011
730,7.1,['Sean Grady'],"['Sean Grady', 'Matt Chisholm', 'Adam Rousselle']","A documentary film crew follows the day to day lives of two aspiring bounty hunters, in hot pursuit of a former teen actor turned fugitive, as well as their many misadventures along the way.",-,operation mongoose.,2011
731,7.7,['Kris Smith'],"['Tom Ensor', 'Shawn Uridge', 'Kris Smith']",What happens when the coolest sales rep of 1988s' geeky best friend gets turned into a vampire?,91,bite me: the movie,2011
732,5.2,['Thomas Johnston'],"['Drew Pillsbury', 'Martin Grey', 'Thomas Johnston']","During a holiday get-a-way to Palm Springs, two fifty year-old men find unexpected results while trying to re-live their younger days in this comic coming of age story about the coming of age.",119,about fifty,2011
733,6.3,['Miguel Arteta'],['Phil Johnston'],-,87,cedar rapids,2011
734,6.8,['Paul Feig'],"['Kristen Wiig', 'Annie Mumolo']",-,125,bridesmaids,2011
735,6.1,['Eric Ledgin'],"['Eric Ledgin', 'Stephen Schneider']","A mockumentary about Steve Deeds, an amateur comedian who leaves Agawam, MA for Hollywood, convinced he has what it takes to become a huge star.",75,the funniest movie ever... just kidding,2011
736,6.7,['Joe Cornish'],['Joe Cornish'],-,88,attack the block,2011
737,5.6,['Olaf de Fleur Johannesson'],"['Olaf de Fleur Johannesson', 'Hrafnkell Stefansson']","A desperate city-slicker engineer cheats his way into a small farming community, pretending to know how to save them by refinancing their slaughterhouse not knowing that he's walking into a local war of small-town politics and general misbehaving.",-,kurteist fólk,2011
738,6.7,['Francis Abbey'],"['Francis Abbey', 'Jenna St. John']","Dr. Henry Caldwell, the world's foremost mediator, faces the biggest challenge of his career when he takes on six roommates whose only thing in common is that none of them smoke.",97,6 nonsmokers,2011
739,5.3,['Michael Knowles'],"['Michael Knowles', 'Douglas Light']",A guy in his mid-thirties watches as his life comically unravels after he enters into a relationship with the daughter of a former high school classmate.,97,the trouble with bliss,2011
740,-,['Ajay Monga'],['Ajay Monga'],"Debashish a.k,a Dabboo / Debu is quite harrowed and perplexed with the constant teasing and leg pulling that goes on in his school and colony alike. They call him names because he breaks wind at the drop of a hat. This is his story.",-,padduram,2011
741,-,-,-,Reparto principal,-,rifftrax: highlander,2011
742,-,['Javlon Shodmonov'],['Otabek Mirzaholov'],-,92,zamonaviy sovchilar,2011
743,5.7,['Malcolm Mowbray'],"['Andrew Kole', 'Andrew Delaplaine', 'Scott Kasdin']","During one fateful night at Frankie & Johnnie's steakhouse in Manhattan, famed (but fading) director Harris Chappell (Tambor) plans to re-launch his Broadway career after suffering a humiliating series of flops in Hollywood.",88,meeting spencer,2011
744,6.3,['Phil Traill'],['Tom Williams'],-,97,chalet girl,2011
745,5.4,['Christopher Farah'],['Christopher Farah'],"Comedy set in the world of competitive bar trivia, centering around a group of frustrated academics who finally get a shot at beer, women and nerdy redemption when they enter a citywide trivia tournament.",105,answer this!,2011
746,6.3,['David Dobkin'],"['Jon Lucas', 'Scott Moore']",-,112,the change-up,2011
747,4.0,['Roberto Santiago'],"['Javier Daulte', 'Pablo Fernández Vázquez', 'Roberto Santiago']",-,73,¿estás ahí?,2011
748,7.3,['Vladimir Blazevski'],"['Vladimir Blazevski', 'Darijan Pejovski']","A group of crotchety codgers attempt to revive the punk-rock band they all played in 17 years earlier in ""Punk Is Not Dead,"" from Macedonian scribe-helmer",104,pankot ne e mrtov,2011
749,2.4,"['Raine Brown', 'Arthur Cullipher', 'Patrick Desmond']","['Marv Blauvelt', 'Anthony G. Sumner', 'Trevor Wright']",Four Twisted Tales that lead to a Dead End.,98,psycho street,2011
750,-,['Tim Hawkins'],"['John Branyan', 'Tim Hawkins', 'Bob Smiley']",Rockshow Comedy Tour - 2 DVD Set contains over 2.5 hours of stand up and music.,150,tim hawkins: rockshow comedy tour,2011
751,-,['Parviz Sabri'],-,"The story of a trip of a number of children and their educators to the north of the country, where the children ask the educator to tell them a story along the way, and the educator tells the story of the grandmother and the squash.",-,naneh noghli,2011
752,7.7,['Vanessa Rousselot'],-,A young filmmaker decides to embark on an unusual quest: to find humor in the West Bank. Little does she realize that her offbeat road trip will lead her to discover a reality known to few beyond the walls surrounding Palestine.,55,(no) laughing matter,2011
753,5.7,['Alex Pires'],"[""Art D'Alessandro"", 'Alex Pires']","A hard-working cupcake maker is inadvertently elected mayor of a small town burdened with debt. Uneducated, she relies on her street smarts to clean up the town.",86,mayor cupcake,2011
754,6.9,['Seth Gordon'],"['Michael Markowitz', 'John Francis Daley', 'Jonathan Goldstein']",-,98,horrible bosses,2011
755,4.6,['Jonathan Newman'],['Jonathan Newman'],"A suburban couple decide to shake up their marriage by ""swinging"" with another couple.",85,swinging with the finkels,2011
756,4.5,['Swapna Joshi'],"['Himesh Reshammiya', 'Subrat Sinha']","On a break from his pushy girlfriend, a male falls for the sister of his employer.",122,damadamm!,2011
757,6.2,['Shaun Paul Costello'],['Derek Lindeman'],"Booted is a comedy with heart about Will Kelinsky, a charming deadbeat who meets his inevitable fate when his car gets booted in downtown Philadelphia due to a vast sum of unpaid parking tickets. Now he's stranded with a backseat of spoiling groceries, a massive parking ticket, and a fed up girlfriend back at home. Doing what any reasonable man would do, Will converts... Leer todo",-,booted,2011
758,5.8,['Henning Carlsen'],"['Jean-Claude Carrière', 'Gabriel García Márquez', 'Henning Carlsen']",-,90,memoria de mis putas tristes,2011
759,5.3,['Carter Ferguson'],"['Debbie May', 'James Mc', 'Creadie']","Set in the cosmopolitan city of Glasgow, with a vibrant soundtrack of local music, Fast Romance follows the interweaving stories of seven very different people who go looking for love and end up getting more than they bargained for.",97,fast romance,2011
760,8.6,"['The', 'World', 'Famous Ike']","['The', 'World', 'Famous Ike']",-,102,soap on a rope,2011
761,7.2,['Aki Kaurismäki'],['Aki Kaurismäki'],-,93,le havre,2011
762,-,['Susan Romero'],"['Joe Berry', 'Yordi Echeverria', 'Susan Romero']","Most 14-year-old boys are either sporting it up outside or mastering video games. Chuy, however, is a sheltered, well-behaved Mexican-American boy embarking on his solo collegiate experience. A typically boring afternoon at CCU becomes anything but, when Chuy succumbs to pressure. He joins Team MGM (Mentally Gifted Minors) in the ever intense, prestigious campus-wide ... Leer todo",97,spot check,2011
763,6.6,['Brian Crano'],"['Brian Crano', 'Jake Sandvig']","Ben and Alan, two misfit best friends incapable of growing up, find direction for their lives by taking in an abandoned child and creating the family they've always needed.",85,a bag of hammers,2011
764,7.0,['William J. Saunders'],"['William J. Saunders', 'James Windeler']","Bess, a lonely, trailer park teen, steals a car and makes a desperate journey from Kansas to Vegas in search of a father she never knew. Her trip takes her deep into the seedy underbelly of America where she encounters an array of lost-souls, deadbeats and con men, and learns that family can be found in the oddest of places.",81,sweet little lies,2011
765,4.2,['Valerie Weiss'],['Valerie Weiss'],"Unable to give her boyfriend Ben (Reid Scott) a firm yes when he asks her to marry him, Sam (Miranda Kent) sets off on a series of dating adventures to find empirical proof that Ben is ""the one"".",91,losing control,2011
766,6.2,['Jill Sprecher'],"['Jill Sprecher', 'Karen Sprecher']",-,93,the convincer,2011
767,5.3,['Raaghav Dar'],"['Raaghav Dar', 'Arun Sukumar']","Twenty-something Michael Pinto has grown up in a small Goan village, believing everyone in the world to be simple, kind and honest, just like him. His world revolves around a doting mother, a passion for music and the memories of a childhood friend, Sameer, who left Goa for Mumbai many years ago and hasn't replied to his frequent letters ever since. Pinto's talent for... Leer todo",100,my friend pinto,2011
768,-,['Rumbi Katedza'],['Rumbi Katedza'],"When Nyarai finds out that her cousin Nonto is getting married, she and her friend Maxi, are set into a frenzy at the thought that their time to find 'Mr. Right' may be running out. Nyarai endeavors to find out whether or not it is possible to find a man as strong and dependable as the mythical traditional warrior. Although she is a top executive with a leading advert... Leer todo",78,playing warriors,2011
769,4.6,['Devi Snively'],['Devi Snively'],"Three couples go to a remote cabin in the woods and, lo and behold, bad things happen.",88,trippin',2011
770,5.6,['Tommy Stovall'],['Tommy Stovall'],Visitors to the mystical town of Sedona encounter eccentric characters and a series of calamities that lead them to unexpected miracles.,90,sedona,2011
771,3.5,['Robert Rodriguez'],['Robert Rodriguez'],-,89,spy kids 4: all the time in the world,2011
772,5.3,['James Hacking'],['James Hacking'],"Rob Haley (Dougray Scott), an up-and-coming chef and restaurateur in London, is grief-stricken when he loses his wife. With encouragement from his infamous friend and real life TV Chef Gordon Ramsay, Rob decides to spice up his life by turning a run-down country pub into a gourmet restaurant. His food catches the eye - and taste buds - of beautiful American food criti... Leer todo",93,love's kitchen,2011
