,0,1,2,3,4,5,6
0,7.7,['Frankie J. Mosca'],"['Frankie J. Mosca', 'Sal De', 'Lucia', 'Ande Cira']","Awakening from a near fatal overdose, Chris embraces a second chance at life. Required to enroll into a 12-Step Program, and mandated to state psychiatrist appointments, Chris is forced to revisit his chaotic past; a history that revolves around his friend Ande and her autistic brother Frankie. Follow Chris as his past and present converge revealing a deranged cocktai... Leer todo",99,this wretched life,2010
1,7.2,['Douglas A. Raine'],"['Jimmy Lifton', 'Paulette Victor Lifton', 'Virginia Perfili']",-,-,blind sided,2010
2,5.8,['Jerome Elston Scott'],['Jerome Elston Scott'],"Nick Anderson, Kevin Daniels, and Tracey Green do everything together. They are the best of friends, and yet they couldn't be more different. Neighbors from adolescence, they finish each other's thoughts and sentences, joys and pains, happiness and tears. Using Nick's house as their own members only clubhouse, they escape into their own world of contentment. Yet the i... Leer todo",98,anderson's cross,2010
3,7.7,"['Nathan Greno', 'Byron Howard']","['Dan Fogelman', 'Jacob Grimm', 'Wilhelm Grimm']",-,100,rapunzel,2010
4,4.0,['Demian Lichtenstein'],['Eddie Guerra'],"When three Vegas buddies attempt the score of a lifetime, they have to walk a fine line between their girlfriends who want their heads, and the mobsters who want them dead.",95,venus & vegas,2010
5,5.9,['Jay Roach'],"['David Guion', 'Michael Handelman', 'Francis Veber']",-,114,dinner for schmucks,2010
6,8.3,['Lee Unkrich'],"['John Lasseter', 'Andrew Stanton', 'Lee Unkrich']",-,103,toy story 3,2010
7,4.0,['Michael Booth'],['Jonathan Williams'],"Frustrated filmmaker, Barry Lick, and a crew of film school wannabees, attempt to make a documentary about a local businessman who he believes is involved in property rackets, prostitution, pornography and drugs.",92,diary of a bad lad,2010
8,7.6,['Edgar Wright'],"['Michael Bacall', 'Edgar Wright', ""Bryan Lee O'Malley""]",-,112,scott pilgrim vs. the world,2010
9,6.5,['Laura Casabe'],"['Laura Casabe', 'Tomas Wortley']","In a popular auction that matches the sinister and colorful of a circus of phenomena, a couple adopts children in exchange for their belongings. The children there acquired, usually mutilated, are in their new home in order to prepare for access to the Peronist education program taught in only 10 state institutes.",85,el hada buena - una fábula peronista,2010
10,8.0,['John Anton'],"['John Anton', 'Jason Waugh']","As this caper unfolds you will experience cool riffs, tattoos, excessive drug use, brief nudity, extremely strong language, mayhem, murder and a hail of gunfire.",123,"guns, drugs and dirty money",2010
11,5.5,['Alexandre Aja'],"['Pete Goldfinger', 'Josh Stolberg']",-,88,piranha 3d,2010
12,3.8,['Nestor Miranda'],['Nestor Miranda'],Friends from Queens decide to move into a run down Harlem brownstone ultimately converting it into an illegal youth hostel in order to make ends meet.,81,harlem hostel,2010
13,5.4,['Frank Ciota'],['Joseph A. Ciota'],-,104,stiffs,2010
14,5.8,"[""Chris D'Arienzo""]","[""Chris D'Arienzo"", 'Frank Turner Hollon']","Barry Munday wakes up after being attacked to realize that he's missing his family jewels. To make matters worse, he learns he's facing a paternity lawsuit filed by a woman he can't remember having sex with.",95,barry munday,2010
15,-,['Arthur J. Mangano'],['Arthur J. Mangano'],A female doctor falls for a married city mayor.,102,a woman is a woman,2010
16,7.0,['Rudy Luna'],['Rudy Luna'],"Primemates is a disturbing and honest conversation among four men in an exclusive cigar shop. They talk about love, relationships, and sex. While exploring men's fascination with younger women, Primemates delves into many political taboos usually associated with the intellectual.",82,primemates,2010
17,6.5,['Elizabeth Allen Rosenbaum'],"['Laurie Craig', 'Nick Pustay', 'Beverly Cleary']",-,104,ramona and beezus,2010
18,3.9,['Roger Kumble'],"['Michael Carnes', 'Josh Gilbert']",-,92,furry vengeance,2010
19,6.7,['Edward Zwick'],"['Charles Randolph', 'Edward Zwick', 'Marshall Herskovitz']",-,112,love & other drugs,2010
20,5.6,['Thomas D. Thompson'],"['Brandon Williford', 'Sabine Buchanan', 'Scott Reus']","An obsolete cargo ship, its alcoholic captain, and his crew of odd balls and malcontents serve as the United Earth Star Fleet Command's only hope of averting a major intergalactic incident.",78,waste of space,2010
21,7.4,['Chris Hummel'],"['Holly Payberg-Torroija', 'Steve Ruff', 'Vicki Ruff']",The con man gets conned in this family friendly action-comedy about finding your inner superhero.,88,the guardians,2010
22,7.1,"['Anna Boden', 'Ryan Fleck']","['Anna Boden', 'Ryan Fleck', 'Ned Vizzini']",-,101,it's kind of a funny story,2010
23,5.0,['Michael Lembeck'],"['Lowell Ganz', 'Babaloo Mandel', 'Joshua Sternin']",-,101,tooth fairy,2010
24,3.4,"['Daniel De Felippo', 'Gustavo Alex Giannini']","['Daniel De Felippo', 'Peto Menahem', 'Diego Reinhold']",When Jack and Aurora met they'll rely on their friends as a case mistaken identity leads them on an adventure teaching them that it's who you are on the inside that matters most.,80,plumíferos - aventuras voladoras,2010
25,6.4,['Jim Field Smith'],"['Sean Anders', 'John Morris']",-,104,she's out of my league,2010
26,5.7,['Garry Marshall'],"['Katherine Fugate', 'Abby Kohn', 'Marc Silverstein']",-,125,valentine's day,2010
27,7.7,['Rob Reiner'],"['Rob Reiner', 'Andrew Scheinman', 'Wendelin Van Draanen']",-,90,flipped,2010
28,6.2,['Leon Cowan'],"['Ben April', 'Michael Brabec', 'Leon Cowan']",The disastrous sequel to The Beast of Yucca Flats. Why? Why not?,79,return to yucca flats: desert man-beast,2010
29,7.0,['Lisa Cholodenko'],"['Lisa Cholodenko', 'Stuart Blumberg']",-,106,the kids are all right,2010
30,4.3,['Dean Bajramovic'],['Dean Bajramovic'],A Tokyo cyber-punk Yakuza and a Bosnian mob enforcer team up to smuggle a toilet made of pure heroin to New York City. It's worth millions - if they can find somebody who can decipher the Japanese chemistry formula.,95,gangster exchange,2010
31,5.6,['Murali Nagavally'],['Farhad Bhiwandiwala'],What happens when the first woman to join the infantry in India happens to be the incredibly gorgeous Mallika Sherawat?,-,fauj mein mauj,2010
32,3.1,['Tim Sullivan'],"['Chris Kobin', 'Tim Sullivan', 'Christopher Tuffin']","When this year's round of unsuspecting Northerners fail to show up for their annual Guts N' Glory Jamboree, the residents of Pleasant Valley take their cannibalistic carnival on the road, and head to Iowa, where they encounter spoiled heiresses Rome and Tina Sheraton, and the cast and crew of their ""Road Rascals"" reality show. Performing ""The Bloodiest Show on Earth"",... Leer todo",84,2001 maniacs: field of screams,2010
33,5.8,['Robert Young'],['Hugh Janes'],"A black comedy about an old rogue named Wally, who breaks all the rules to fulfill an old friends dying wish to be buried at sea.",88,wide blue yonder,2010
34,4.0,['Luis Barone'],"['Luis Barone', 'Juan Sasturain', 'Jesús de la Vega']","Set in a decaying Buenos Aires, a poor Argentine (Minujin) wrestles with his newly discovered superpowers.",103,zenitram,2010
35,8.6,['Alpesh Patel'],['Alpesh Patel'],"TOUCH WOOD is an outrageous mockumentary about an Indian movie producer Mr. Moto, who was once a hotshot movie producer in Bollywood (India). But his ultimate dream was to become a big time movie producer in Hollywood. Figuring that his fame would effortlessly carry over into Tinseltown, he set off to America some twenty odd years ago. Much to his dismay, he was unsuc... Leer todo",-,touch wood,2010
36,6.6,['Nicole Holofcener'],['Nicole Holofcener'],-,87,please give,2010
37,7.5,['Jeremy Osbern'],"['Chris Blunk', 'Jeremy Osbern']","Three musical stories of people who feel out of place in the world, and of their longing to find a connection with someone else. A middle-aged African American sings to a new love in a country/western bar, a young goth girl sings a '50s-style ballad as she wanders the streets with a broken heart, and a punk croons a modern doo-wop at a punk-rock show.",100,air: the musical,2010
38,3.7,['Benjamin Gourley'],['Benjamin Gourley'],"Leon and TJ are best friends and repo men. After ten years, with a high school reunion looming, Leon wants out of the repo business. TJ has concocted a hair-brained scheme to steal all the cars they've repoed. When the plan fails, it falls to Leon to save TJ from his own plan.",97,repo,2010
39,6.1,"['Josh Gordon', 'Will Speck']","['Jeffrey Eugenides', 'Allan Loeb']",-,101,the switch,2010
40,6.5,['Gary Winick'],"['Jose Rivera', 'Tim Sullivan']",-,105,letters to juliet,2010
41,6.3,['Mike Mitchell'],"['Josh Klausner', 'Darren Lemke', 'William Steig']",-,93,shrek forever after,2010
42,8.1,"['Dean De', 'Blois', 'Chris Sanders']","['William Davies', 'Dean De', 'Blois', 'Chris Sanders']",-,98,how to train your dragon,2010
43,6.9,['Griff Furst'],['Alex Yves'],A comedy about a young man from Switzerland who travels to Los Angeles to escape his dead-end life and to reconnect with a female pen pal with whom he has lost touch. Everything falls apart when the pen pal turns out to be a complete fraud and he is reunited with an old friend (a real trouble magnet) who keeps pulling him into the most awkward situations. The story ta... Leer todo,95,movin' in,2010
44,5.3,"['Edward Mc', 'Henry', 'Rory Mc', 'Henry']","['Edward Mc', 'Henry', 'Rory Mc', 'Henry']",A satirical alternative history of World War II where the Nazis seize London and England must band together to prevent a full-on invasion.,91,jackboots on whitehall,2010
45,6.7,['Antoinette Beumer'],"['Marnie Blok', 'Karin van Holst Pellekaan', 'Heleen van Royen']","After giving birth to her first child, a happily-married woman sees her picture-perfect life spiral out of control.",100,de gelukkige huisvrouw,2010
46,6.7,['Robert Rothbard'],"['Tony Devon', 'Robert Rothbard']",A sickly Mob Don's obsession that a pizza parlor owner is his missing long lost son.,99,pizza with bullets,2010
47,3.5,['Chris Levitus'],"['Kyle Kramer', 'David Martin', 'Chris Levitus']",-,89,the penthouse,2010
48,6.8,['Scott Buchanan'],"['Dale Buchanan', 'Scott Buchanan']","As Los Angeles grew to a population of over 5 million, crime was getting out of control. Budget cuts, low recruitment, and a rash of abuse lawsuits, left the LAPD unable to cope with the rising crime rate. In 2006 the city council passed proposition PSO357 authorizing PSO's (Private Security Officers) to handle all misdemeanor, infraction, and truancy cases. These are... Leer todo",84,private security officer: los angeles,2010
49,4.9,['Guy J. Louthan'],"['Guy J. Louthan', 'Neil Monaghan']","Made In Romania"" is the comedic story of a young producer who risks everything to try and break into more artistic productions. A financier agrees to finance the project but only if the production is filmed entirely in Romania.",95,made in romania,2010
50,8.0,['Patrick Franklin'],"['Patrick Franklin', 'Robert J. Wagstaff']","A fledgling filmmaker returns to his hometown to make a documentary about flowers and their significance at the major stages of human life. Obsessed with capturing reality, he is none too pleased when a sudden zombie uprising threatens his artistic vision. Unwilling to compromise, he resolves to shoot around the walking dead as if nothing unusual is actually happening... Leer todo",87,pushin' up daisies,2010
51,4.8,['Alfonso Arau'],"['Giovanna Cucinotta', 'Francesco Costa', 'Maria Grazia Cucinotta']","1905, the cinematograph has reached Southern Italy, and casts fear among the people to whom it seems a devilish trick. They call it ""o 'imbroglie din t'o lenzuolo"" - ""The Trick in the Sheet"", as white sheets were used for screening.",105,l'imbroglio nel lenzuolo,2010
52,4.5,['Rob Schneider'],"['Boon Collins', 'Rob Schneider']",A man finally finds faith in himself after the rest of world puts its faith in him; the sole being on earth who can save mankind from its own destruction - The Chosen One.,101,the chosen one,2010
53,5.5,['Paul Weitz'],"['Greg Glienna', 'Mary Ruth Clarke', 'John Hamburg']",-,98,little fockers,2010
54,5.1,['Erik White'],"['Abdul Williams', 'Erik White']",Kevin Carson is a young man living in the projects who has to survive a three-day weekend after his opportunistic neighbors find out he's holding a winning lottery ticket worth $370 million.,99,lottery ticket,2010
55,4.7,['Brooks Branch'],"['Brooks Branch', 'Linda Morris']","NYC, 1979: Gabriel and Annie's marriage is falling apart with only their daughter holding it together. Gabriel quits his architect job to become a playwright, writing about his life. Annie and Liz leave.",97,multiple sarcasms,2010
56,5.5,['Jim Fitzpatrick'],['Jim Fitzpatrick'],A group of kids take down a motorcycle gang.,83,adventure scouts,2010
57,7.3,"['Tom Mc', 'Grath']","['Alan Schoolcraft', 'Brent Simons']",-,95,megamind,2010
58,7.4,['Donald Flaherty Fajardo'],['Donald Flaherty Fajardo'],Four men discover the importance of friendship when one is faced with a life-altering decision.,91,the steamroom,2010
59,6.3,['James Mangold'],"[""Patrick O'Neill""]",-,109,knight and day,2010
60,5.1,['Kevin Munroe'],"['Thomas Dean Donnelly', 'Joshua Oppenheimer', 'Tiziano Sclavi']",-,108,dylan dog: dead of night,2010
61,5.2,['Kelly L. King'],"['Nicole Abisinio', 'Brandon Cotter']","A 20-something slacker girl meets a handsome rebel at her best friend's funeral. She partners up with him and through a series of cons, finds her path to independence and love.",93,prime of your life,2010
62,8.3,['Todd Edwards'],"['Todd Edwards', 'Peter Bedgood']","It's been a rough couple of years for Alan Mangold, a tightly-wound professor in his 30's who dreams of a better life beyond his shoebox apartment... if only he could complete his opus, ""Orphan Bastard."" When his Nana dies, Alan and his better-half Amanda must post an internet ad at the university to find a student who will share the costs of the emergency cross-count... Leer todo",110,jeffie was here,2010
63,-,['Juanjo Martínez'],['Juanjo Martínez'],"In Buenos Aires, a beauty product turns people into zombies.",45,piel de lija,2010
64,4.7,['Kenny Ortega'],"['Conor Lastowka', 'Michael J. Nelson', 'Sean Thomason']","When Zac Efron starts singing and high schools start dancing, there's only one sane way watch: with a hilarious audio commentary from the guys at RiffTrax.",-,rifftrax: high school musical,2010
65,5.5,['Andy Tennant'],['Sarah Thorp'],-,110,the bounty hunter,2010
66,5.0,['Amit Gupta'],['Amit Gupta'],"Tripp is an average frustrated chump, who comes up with a golden idea. He partners with Gary, a Wall Street wheeler and dealer, and brings his cousin, Rowan, on-board to help with his business. As Tripp and Rowan journey together for business, Tripp learns about Rowan's extraordinary skills- skills in attracting women. The duo realizes that business and relationships ... Leer todo",110,let the game begin,2010
67,4.7,['John Wesley Norton'],['John Wesley Norton'],"An adept spoof of cinema's behind-the-scenes experiences, Not Another B Movie combines frightening and disgusting zombies with frightening and disgusting hack directions to tell a hilarious story! With a cast that includes Ed Asner, Joe Estevez and David Faustino, it's an insightful romp through the horror film industry and the horrors of the film industry.",87,not another b movie,2010
68,7.1,['Tarun Verma'],['Tarun Verma'],Life is about figuring out who you are and making sense of the world around you. Life is about your friends helping you through the toughest obstacle of life love. Life is about realizing the beautiful world around you and having fun. and most of all...Its about acting way too sexy and way too weird because you can be!! Why? Because that's how it is nowadays... Aaj Ka... Leer todo,90,aaj kal,2010
69,4.6,['Sam Harper'],"['Sam Harper', 'Meredith Preston']","In order to enjoy his retirement, a father takes drastic measures to get his twentysomething, slacker sons to move out and fend for themselves.",84,house broken,2010
70,7.2,['Laís Bodanzky'],"['Luiz Bolognesi', 'Gilberto Dimenstein', 'Heloisa Prieto']","Mano has to deal with adolescence dilemmas and his family destruction, after his father leaves their house.",100,as melhores coisas do mundo,2010
71,6.5,['Greg Berlanti'],"['Ian Deitchman', 'Kristin Rusk Robinson']",-,115,life as we know it,2010
72,6.6,['Donovan Marsh'],"['Donovan Marsh', 'John Van De Ruit']","It's South Africa 1990. Two major events are about to happen: The release of Nelson Mandela and, more importantly, it's Spud Milton's first year at an elite boys only private boarding school.",103,spud,2010
73,5.6,['Jackson Douglas'],['Jeff Lewis'],"When a priest learns his brother is dying of cancer, he dips into the church funds to help pay for the expensive treatments. Turns out his brother is in perfect health, and has used the money to fund production of a porno film.",90,for christ's sake,2010
74,5.9,['John Birmingham'],['John Birmingham'],"Paul Lewis is a high school senior in Zanzibar, VA with not a care in the world... or so it seems... until he finds out he is a half breed vampire. Together with his father and new girlfriend Laney, they must fight off evil vampires to save humankind in one intense night.",106,the vampires of zanzibar,2010
75,6.2,['Sergio Machado'],"['Jorge Amado', 'Sergio Machado']",Friends of the recently deceased Quincas take their pal's body on one last tour of his favorite spots in Brazil's Bahia.,104,quincas berro d'água,2010
76,5.9,['Fina Torres'],"['Jorge Camacho', 'Julio Carrillo', 'Arturo Infante']","A young seamstress in Havana with a dream of becoming a fashion designer, has to choose between the two men she loves - a suave foreign photographer, on a mysterious errand, and her loyal but laid back Cuban boyfriend who will, some day, build her a home.",106,habana eva,2010
77,5.3,['Jim Issa'],"['Anthony Stephenson', 'Michael Lucker']","Etta's hopeless husband Chester, wannabe entrepreneur and liquor store owner, blows every nickel he makes on hare-brained get-rich inventions. She must take matters into her own hands to fulfill her dream of sending their kids to college.",84,good intentions,2010
78,6.4,['Marcelo Laffitte'],"['José Carvalho', 'Marcelo Laffitte']","In Copacabana, lesbian photographer Elvis is hired to deliver pizzas in the night shift on her motorcycle. Her first assignment is a delivery to the transvestite hairdresser Lady Madonna.",105,elvis & madona,2010
79,5.0,['Waleed Moursi'],['Sarah Louise Wilson'],"Are you one of the millions still wondering why you life didn't turn out like a ""John Hughes"" Movie? ...Jelly is!",104,jelly,2010
80,4.6,['Tamara Tunie'],"['Joe Cilibrasi', 'Jennifer Maloney', 'Victoria Rinaldi']",Lindsay is abandoned by her therapist all August. All NYC therapists are on vacation. She complains on Craigslist - hundreds respond. Ten start a group (therapy session).,91,see you in september,2010
81,5.6,['Jeff Dylan Graham'],"['Jeff Dylan Graham', 'Dan Casserole', 'J.T. Seaton']","A severely traumatized man, suffering from a condition which causes him partial blindness and amnesia, seeks answers to the mystery of what really happened to him.",-,psychosomatika,2010
82,5.9,['Aaron Michael Metchik'],['Aaron Michael Metchik'],"10 Years Later is a dark comedy about six childhood best friends returning home for their ten year high school reunion. When one of them kidnaps an enemy from their past and inadvertently gets the others involved, each must decide whether to turn in a best friend or become accomplices in a dark plot that none of them are sure they can pull off.",98,10 years later,2010
83,5.2,"['Cyrill Boss', 'Philipp Stennert']","['Cyrill Boss', 'Philipp Stennert', 'Andreas Gaw']",Jerry Cotton is the best agent of the FBI and suspected of murder. So he has to find the real killers of gangster boss Serrano.,90,jerry cotton,2010
84,-,['Zhengyu Lu'],"['Xiaodan Guo', 'Zhengyu Lu', 'Pipi Wu']",-,96,the university days of a dog,2010
85,3.8,['Major Ravi'],['Major Ravi'],Four kids spending their vacation in a small village find a wounded dog and decide to keep it. But the village has this strange superstition that dogs bring bad luck. What can they do?,85,oru avadhikaalam,2010
86,6.1,['Lucas Blanco'],"['Lucas Blanco', 'Roberto Montini']","The lives of four people weave together in unexpected ways without each of them realizing the effect their actions are having on the lives of the others. Each is searching for love while love may be staring them straight in the eye right, in this modern tale of love's mysterious nature.",95,amor en tránsito,2010
87,-,"['François Lamoureux', 'Pierre Lamoureux']",-,-,-,trevor boris: over easy,2010
88,3.6,['Patrick Levy'],['Patrick Levy'],"A young man decided after paying his duty to the society decide to change his life and to become a filmmaker. Only one problem : he's nobody, works for a gangster and doesn't know the cinema industry. His solution blackmailing and better be the right guy.",81,les princes de la nuit,2010
89,5.5,['Barry W. Blaustein'],['Peter Himmelstein'],Four siblings implode after the release of a book written about them.,79,peep world,2010
90,5.4,['Robert Luketic'],"['Bob De', 'Rosa', 'Ted Griffin']",-,100,killers,2010
91,7.8,"['Tim Clarke', 'Timothy Clarke']",['Tim Clarke'],"'Cornhole: The Movie' is a mockumentary feature film that examines the lives of four groups of quirky characters who have sacrificed, exploited, and shamed those in their lives to gain a certain level of minimal fame in the Cincinnati-based sport of Cornhole.",90,cornhole: the movie,2010
92,3.7,['Russ Parr'],['Russ Parr'],An aspiring pimp struggles to make a mint after inheriting his late uncles escort service and discovering that competition on the streets is fierce.,80,something like a business,2010
93,6.4,['Abe Sylvia'],['Abe Sylvia'],"It's 1987 and Danielle, the high-school 'Dirty Girl', is running away. With her is chubby, gay Clarke, a bag of flour called Joa and a Walkman full of glorious '80s tunes.",90,dirty girl,2010
94,5.9,['Geoff Marslett'],['Geoff Marslett'],"The discovery of life on Mars places a robotic expedition and a manned mission in a race to the Red Planet. On the way we discover that love - biological, spiritual, and even mechanical - can flourish in all kinds of ways.",90,mars,2010
95,-,['Uros Raztresen'],"['Miomir Cikic', 'Uros Raztresen']",Farmer Pajo spends his days in the countryside visiting more or less interesting fellow citizens.,90,prigode kmeta pajota,2010
96,7.0,['Jeff Tremaine'],"['Jeff Tremaine', 'Johnny Knoxville', 'Bam Margera']",-,94,jackass 3d,2010
97,5.9,['Jim Kouf'],"['Jim Kouf', 'Alan Di', 'Fiore']","A prisoner escapes and hides in a barn. He sees a woman dragging a body out the house and into a car trunk. He helps with the body, that turns out to be alive.",105,a fork in the road,2010
98,5.6,['Taylor Hackford'],['Mark Jacobson'],-,117,love ranch,2010
99,6.5,['Roger Michell'],"['Aline Brosh Mc', 'Kenna']",-,107,morning glory,2010
100,7.1,['Dimitar Mitovski'],"['Delyana Maneva', 'Dimitar Mitovski', 'Alek Popov']","A concert to celebrate Bulgaria joining the EU is being planned at the Embassy in London and it is the job of VARADIN, the new ambassador, to ensure the Queen attends. But with corrupt staff, criminal gangs operating out of the kitchen, falling in love with a stripper and a little misunderstanding with a PR firm that provides look-alike royalties - his simple task tur... Leer todo",107,mission london,2010
101,5.5,['Abram Cox'],['Doug Steinberg'],A mild-mannered secretary discovers that she has a talent for murder as she ascends the corporate ladder.,92,miss nobody,2010
102,6.2,['Yule Caise'],['Yule Caise'],"SWISHBUCKLERS is an offbeat comedy about three macho martial artists who join an all-gay production of The Three Musketeers in order to save their dojo. The trials and tribulations of our heroes give new meaning to the phrase, ""All for one, and one for all!"" Swordplay and jokes ensue amidst a touching story of friendship and tolerance.",87,swishbucklers,2010
103,7.8,"['María Costa', 'Michael Mc', 'Carthy', 'Roman Wyden']","['María Costa', 'Rick Najera', 'Mike Batayeh']","Maria Costa, Called ""The Latina Lucille Ball"" honors traditional values in a modern world. Onstage, Costa portrays an array of outrageous and hilarious characters from her ultra-macho father to her overly critical mother-in-law. Maria brilliantly captures the diverse rhythms of Latin life with irresistible style to her journey of self-discovery.",69,maria costa's macho men and the women who love them,2010
104,6.3,"['Morag Mc', 'Kinnon']","['Colin Mc', 'Laren', 'Lone Scherfig']","Alfred is 64. He's lost touch with his family and a threat to his health makes him realise he wants to make amends. The more he tries to do right, the more he does wrong, and as his past comes back to haunt him, he is forced to face up to what his life means to him. Rounding Up Donkeys is the second film in Sigma and Zentropa's three feature film concept 'Advance Part... Leer todo",78,donkeys,2010
105,9.1,['V. Nagaraj'],-,-,-,undercover rascals,2010
106,3.1,['James Abadi'],"['Adam Abadi', 'James Abadi']",A frustrated music business executive accidentally creates a band called F**K and has to find a group of talentless no-hopers to take on the music industry and become rock stars.,-,the story of f***,2010
107,4.1,['David A.R. White'],"['Jill Gatsby', 'Sean Paul Murphy', 'Timothy Ratajczak']","An Amish man comes to Hollywood to be a missionary, and gets cast as Satan on a nighttime soap opera.",90,holyman undercover,2010
108,6.8,['Janis Streics'],"['Rudolfs Blaumanis', 'Janis Streics']",The old soldier of the emperor Rudolfs Rudups becomes very unmanageable when he is hit by Amor's arrow.,114,rudolfa mantojums,2010
