,puntuacion_imdb,direccion,guion,argumento,duracion,titulo,anio;
0,-,Stanislav Shelestov,Stanislav Shelestov,Two guys decide to become bloggers. In order to get views and likes they take some experimental military pills which deprive them of any sense of pain. But it goes too far.,8,like.share.repost.,2020;
"1,9.2,Stefan Chapovskiy,Stefan Chapovskiy,""1984, a team of rangers on a punitive expedition in Colombia jungle gets abducted by aliens. During the experiment, conducted on the space station, humans are forced to pass deadly tests, competing with warriors from other worlds."",-,war gene,2020";
"2,-,Donny Callahan,""['Donny Callahan', 'James R Compton Jr.Kevin Eaton']"",-,-,evade short film,2020";
3,-,André Mileti,André Mileti,The hero of a terrible action film realizes he's fictional and tries to escape with the help of a mysterious filmmaker.,12,vanity project,2020;
"4,-,Danny Zanelotti,Danny Zanelotti,""He's a guy in a bad situation, and he's just trying to get out alive."",17,gambler,2020";
"5,6.4,Chela Drake,Chela Drake,""When a dangerous assassin decides he wants out of his guild after discovering the identity of a former target, things get ugly and his only purpose becomes living long enough to bring one last piece of the life he stole home."",-,repentance,2020";
"6,-,Daniel Norris Webb,""['Kevin Fernandez', 'Daniel Norris Webb']"",""When James brings his fathers pistol to the gang's after school hideout, a typical day turns into something much darker."",7,ready.fire.aim,2020";
"7,-,Aileen Sheedy,""['Maren Curtis', 'Kevin Swanson']"",""After a failed attempt to reconnect, a gamer's frustrated wife decides to build him a game of her own with real-life stakes."",-,the legend of stella,2020";
"8,-,Ryan Rosenblum,Ryan Rosenblum,""Pursued by the FBI, a team of the world's most dangerous women model their vigilante crimes on the seven deadly sins."",-,satan's seven,2020";
9,-,Tony Cruz Serrano,Tony Cruz Serrano,-,6,ricky rodrigo,2020;
10,-,Kris Atkins,Kris Atkins,A young couple search for a reasonably sized flat at an affordable price. within a difficult Auckland renting market.,-,renters,2020;
11,7.8,Michael Risley,Michael Risley,An Albanian boy accidentally releases a turkey and must get it back in time for New Year's Eve dinner.,10,the last supper,2020;
"12,-,""['Kaylyn Love Wilson', 'Zachary Wilkerson']"",Kaylyn Love Wilson,""Four starry eyed high school seniors make a fatal decision when they choose to drink at a roaring house party. Little do they know, the implications of that night would mean the sacrifice of college dreams and tragedy for an innocent mother and her son."",-,memorial shattered dreams,2020";
13,-,Ian Altenbaugh,Ian Altenbaugh,-,-,pit viper,2020;
14,-,Albert Poquet,Isaac Israel,-,-,no hay precio,2020;
"15,-,Rodrigo Dimaté,Rodrigo Dimaté,""AKA 'Loogie', a former paramilitary combatant in the Colombian armed conflict, reinserted into society, arrives in Bogota to start a new life, but he falls into the streets and smoking cocaine paste. While running away from Nando, another former paramilitary who wants him to join... Leer todo"",26,a king's life,2020";
"16,6.6,Johannes Stenberg,-,""A man, driving his kids in his car falls asleep during a red light stop and real bad things start to happen."",13,the rage,2020";
"17,-,Matthew Lee Blackburn,Matthew Lee Blackburn,""When an aerial patrol machine begins making drops near an important base, it is up to a unit of hardened soldiers to clear the area of deadly machines before they can infiltrate Crystal Peak and bring down the human resistance."",-,crystal peak,2020";
"18,7.8,Karsten de Vreugd,Karsten de Vreugd,""When Mara hastily enters her yoga class she desperately tries to find her zen, only to find out her zen is at the end of letting out all her frustrations first."",12,downward facing dogs,2020";
19,-,Peter Jang,Peter Jang,Two crime syndicate leaders manipulate their best men to fight to the death as a means to avoid all out war.,10,pawns,2020;
"20,-,Travis Mills,""['R.K. Anderson', 'Travis Mills']"",""In the next installment of our wasteland series which began with The Mad Man of Miami and continued with The Seven Blood, the Guardian is captured by a tribe who plays deathly games in the wasteland and is forced to compete by the sadistic Game King leader."",-,the death rally,2020";
21,-,Paul Daisuke Goodman,Paul Daisuke Goodman,A retired pilot tries to ignore the monstrous space station that has fixed itself in orbit 300 miles above his homestead only to be stirred to action when a piece of it leaves a crater in his yard.,12,leafer,2020;
"22,-,Das Fuerst,Das Fuerst,""Renowned scientist Dr Eric Reinfeld goes public with our planet's imminent extinction. After sending a distress call into space, he hides in an undisclosed location from the US Gov't trying to save the world. Is something out there?"",-,when fire flies,2020";
"23,-,Jeremy Lusambya,Patrick Lualua Jr.,""He changed his name and life, but can't escape the past that's turned him into a killer"",-,last 24 hours,2020";
"24,-,Marino Darés,Marino Darés,""18 years after the great Jedi purge, a lost padawan acting as a rebel spy and a rookie soldier face the hardest and most important trial of their lives whilst surrounded by a storm of smoke, fire and thousands of blaster bolts."",12,last trial: a star wars collateral story,2020";
"25,-,Yani Gellman,Yani Gellman,""A young mother is stolen away to the furthest corners of the galaxy and must escape an alien prison to return home and free her own child. """"Greetings, From the Planet Krog!"""" is a visual poem that suggests our greatest exploration of the universe takes place within the human heart... Leer todo"",6,""greetings, from the planet krog!"",2020";
"26,8.5,""['Angus Kittler Reid', 'Austin Rice']"",""['Austin Rice', 'Alex Passino']"",Lil' Balzac unwittingly agrees to be the getaway driver for a rugged bank heist crew.,42,lil' balzac 2,2020";
27,-,Dani Medina,-,-,-,el borracho: el vino viejo es el más peleón,2020;
28,5.1,George Tounas,George Tounas,Special agents undercover Ace and Sandy face an unexpected situation in Maximum City as they try to get a job done against a crime organization.,10,city rush,2020;
"29,-,Josh Gardiner,Conrad Welch,""After the extinction of superhumans, the peacekeeping group Virtue wants to reform society without them, while Vice desire to revive and control superpowers."",19,virtue,2020";
"30,-,Madison Strain,""['Raymond Roberson', 'Mike Strain Jr.Madison Strain']"",""Detectives, John Barrow and Jackson Slate, are two new partners working a case. While on a stakeout, their case takes a turn that sends them spiraling through a series of events straight out of their favorite action movies."",-,buddy cops"; the stakeout,2020
"31,5.6,Muhammet Ali Tutka,""['Ahmet Mete Celik', 'Furkan Govyaprak', 'Taner Kaplan']"",""Everything was normal until The Dragon comes to the city . 4 guys who saw that attack scared like everyone , but they did not know there was an elder strenght at their place . Somehow they'll find this Elder Strenght and They have to fight with The Mysterious Enemy ."",-,the elder guardians,2020";
"32,-,Stefan Varvaressos-Abdi,Stefan Varvaressos-Abdi,""A party of Dungeons & Dragons players encounter needlessly dangerous situations in their fantasy world due to one of their overly reckless members, Boulder."",10,roll initiative,2020";
"33,-,Christian Madsen,Christian Madsen,""When a hitman's last day on the job conflicts alongside his annual dinner date with his grandmother, predicaments emerge and the unexpected truth is finally revealed."",26,dinner with grandma,2020";
34,-,Michael Antonio,Michael Antonio,A West Side Story brawl takes a dark twist in this over the top fight for honor - or something like that.,-,night of the living dead girl,2020;
"35,-,Rexilious,""['Ben', 'Tin', 'Ez', 'Rexilious']"",-,-,green lantern's light,2020";
36,-,Jace Elton,Jace Elton,Batman and Captain America must duke it out to see who the strongest hero is.,4,batman vs captain america,2020;
"37,-,""['James Mentzinger', 'Andrew Nimetz']"",""['James Mentzinger', 'Andrew Nimetz']"",""Reid Upchurch (Dan Fogarty) holds the unusual occupation of a debt collector for an underground loan-shark. While out interrogating an investor, Reid has to make the quick decision whether or not the time for collection has arrived."",-,here to collect,2020";
"38,6.8,Ahmet Atalay,""['Ahmet Atalay', 'Leon Tomlinson', 'Christopher Ulaski']"",""In the near future, a mysterious virus has taken over a large portion of the world's population.Upon contamination, it kills the host within a day. There is no permanent cure, only a temporary serum that resets every 24 hours.Special forces mercenary Noah's young daughter is one ... Leer todo"",37,the cure,2020";
"39,-,John Redlinger,John Redlinger,""Washed-up writer Roy Frankel sees his dreams dashed when three boneheaded Hollywood execs hijack his biblical adaptation, """"The Gospel of Matthew,"""" and turn it into an 'edgier' holy reboot: """"Taipei Jesus."""""",-,taipei jesus,2020";
40,-,James William,James William,A captain and her A.I. make a desperate attempt to use the last of the medical rescue spaceship's resources to find another life saving energy source.,10,welkin,2020;
41,-,Aiman Samat,Aiman Samat,-,-,eighth wonder,2020;
42,-,Seth Scruggs,Zachary Vaughn,A scared young woman robs a diner to save her sister who is held hostage by their father.,8,five minutes,2020;
"43,-,Tim Earnheart,Tim Earnheart,""A young woman, on her path to success, betrays her best friend and winds up in a deadly game."",17,nemesis,2020";
"44,-,""['Takaya Lloyd', 'Adam Moses']"",""['Jacob Dalton', 'Alexandre Dumas', 'Takaya Lloyd']"",-,-,don't f**k with the musketeers,2020";
"45,-,Mark Cheng,Nathan Faudree,""Danny has discovered he's got a brain tumor and it's starting to cause strange hallucinations. It's almost as if he's seeing things normally found in Japanese anime, including some new found abilities. But are they real? No time to figure it now because Danny and his partner Jack... Leer todo"",-,danime,2020";
"46,-,Gabriel Cash,""['Gabriel Cash', 'Nico Toffoli']"",""The world is under a pandemic attack. A virus is quickly spreading all over the world damaging the central neurons of the human brain. In response, Nations and Corporations have created the Mnemonix"",20,mnemonix: the hive,2020";
"47,-,Junga Song,Junga Song,-,-,""nuri, the beginning"",2020";
"48,-,-,""['Mark A. Baker', 'Dashiell Combs', 'Bryan Schnitzer']"",""In a dystopian future, a pair of rogue strangers cross paths after a casino robbery. Through a scuffle, their location is revealed and they must work together to survive the Swarm, a massive fleet of zone protection drones authorized to kill."",-,swarm,2020";
"49,-,Gk Shathisnair,Gk Shathisnair,""An indescribable connection between a gorgeous teen """"Cinderella Joseph"""" and the dumbo ear stunning Siamese fighting fish """"Charlie"""" together fight against the fish gamblers along with an assist by Fishery Science student """"Charan""""."",43,aquarist cinderella,2020";
50,-,Justin Kuhn,Justin Kuhn,A families past trauma is tested in the face of a world that has changed. Can they juggle their want for vengeance with the need to protect their new family.,-,small gains,2020;
"51,-,Liam Atkinson,""['Ramon', 'Liam Atkinson']"",-,-,liam: the new manager,2020";
52,8.4,James Campbell,James Campbell,A proof of concept for an upcoming feature film where we'll see the King of Rock 'n' Roll take it upon himself to avenge the death of Martial Arts legend Bruce Lee.,-,tiger man,2020;
"53,6.4,Jeffrey M. Williams,""['Brandon Carter', 'Jeffrey M. Williams']"",A first-time bank robber must escape a heist alongside an unpredictable partner in order to survive.,9,bring the gun,2020";
54,-,Justin Connors,Van Manson,-,39,bloodhunt,2020;
"55,7.1,Henrik Kruse,Henrik Kruse,""Returning home one night, a couple discovers their front door is open. In their kitchen, the couple finds a man with whom they share a broken past."",6,en ubuden gæst,2020";
"56,-,David Cheung,David Cheung,""A story of 2 men get into a war with each other, both have their reasons and do what they have to do and will stop at nothing, both show their skills and engage into a hand to hand combat. A fight that leaves them battered and bruised a fight til death, why are they fighting? wat... Leer todo"",-,undercover,2020";
57,-,Roman Stselkunov,Roman Stselkunov,Molly arrives at the place where she is trying to find her father and the only thing she finds is his watch.,-,detective okert: prehistory,2020;
58,-,Mrigank Pandey,Mrigank Pandey,-,-,the n.a.r.k,2020;
59,5.9,Will Niava,Will Niava,A misunderstanding between three lawless boys and a troubled off-duty police officer escalates beyond control when a sudden reversal of power dynamics forces the pack to a point of no return.,12,zoo,2020;
"60,-,Corey Harrell,Corey Harrell,""After dying on the cross, Jesus Christ enters hell to fight Satan and his demons."",11,crown of blood,2020";
"61,-,Andreas Jacobsson,Andreas Jacobsson,""An unlicensed doctor is offering his medical services to any criminal in need, while pursuing his own agenda."",44,primal wounds,2020";
"62,-,Ryan David Rogers,""['Ryan David Rogers', 'Sonia Rogers']"",""On their way home from a play, Stan and Jen come across a force neither of them ever expected. That being, The Robotic Horseman."",7,the robotic horseman,2020";
63,-,Vincent Lecrocq,Vincent Lecrocq,A man must face a killer who keeps coming back to life.,-,chorus,2020;
"64,-,Nicole M. Brevard,Nicole M. Brevard,-,43,""good cop, bad cop (city of angels)"",2020";
65,-,-,James Larck,-,15,a rough day,2020;
"66,-,Bálint Vigh,Bálint Vigh,""A girl goes into a forest, where she will find the biggest mystery of her life."",9,álmokfutás,2020";
67,-,Jesse Bentley,-,-,-,neon scorpio,2020;
"68,9.6,Mickey Finnegan,Mickey Finnegan,""Two mom's seek the perfect Christmas toy for their kids at the local toy store, the only problem is there's only one left."",13,mom fight,2020";
"69,-,Amit Dhuga,Amit Dhuga,""When his former boss and cousin brother, Mavi, vengefully returns into his life, Akshay, a former gangster, has no choice but to return to the gang life to seek justice and face his past."",30,prisoner,2020";
70,-,-,-,Reparto principal,-,legend of the silver dragon,2020;
"71,-,-,-,""Two high school students, working for government agency AG38 band together to stop an act of extreme ecoterrorism."",-,the fossil fools,2020";
"72,-,""['Steven La', 'Morte']"",-,""When a Bounty Hunter and a Jedi Knight find themselves stranded on an uninhabited planet, they find themselves pitted against each other while trying to retrieve a mysterious Imperial cargo."",-,balance of the force,2020";
"73,-,""['Joey Bader', 'Scott Tinkham']"",Joey Bader,-,-,amethyst,2020";
"74,-,Selvir Katich,""['Dave Belvederi', 'Selvir Katich']"",-,-,borders,2020";
"75,-,""['Daves Jeudy', 'Julio Vasquez']"",Daves Jeudy,An elite husband and wife spy team planning to leave the life of espionage behind are suddenly awakened by a ghost from their past bent on revenge.,-,sleepers,2020";
"76,-,Raven Armando Astone,""['Raven Armando Astone', 'David Charles Dukellis']"",""Frank Culotta runs this town. His under bosses and footmen run through the streets every year to cause chaos and disorder in a ritual called """"Devil's Night"""" This year, however, someone's been making things difficult. Someone with a vendetta. One year ago, Musician Eric Draven and... Leer todo"",-,the devils night (the crow fan film),2020";
77,-,Loïc Jaquet,Loïc Jaquet,-,-,états d'arme,2020;
78,-,Asad Panjwani,Asad Panjwani,-,-,cheater,2020;
"79,-,Mac Ali,""['Mac Ali', 'Ayuj Consul', 'Jordan Krekorian']"",""After two years of dating, Hamza's girlfriend, Amy, catches him on a date with another woman, unaware it was a arranged-marriage date set up by his mother. In order to win her back, Hamza must fight off his arranged lover and reveal secrets he never had the heart to share with Am... Leer todo"",-,virgin hamza's revenge,2020";
80,-,John T. Cansler Jr.,John T. Cansler Jr.,-,28,black steel,2020;
81,9.2,Eddie Eniel,Eddie Eniel,A down and out guy has a rare change of fate when a meteorite hits a magnetite rock giving him magnetic powers.,-,attraction man,2020;
"82,-,""['Josh Relic', 'Travis Thoms']"",""['Casey Powers', 'Josh Relic']"",""After finding a map, two adventuring sisters, Hera and Athena, search for the lost gold of a notorious western outlaw. As part of their quest for the gold, they must overcome numerous obstacles to find the hidden treasure of Red Hand Hannity."",18,sierra sisters: the hunt for red hand's treasure,2020";
"83,8.3,Akash Sunethkumara,Akash Sunethkumara,""When a beautiful stranger enters the cafe, two men decide to battle it out on a chessboard in order to decide who gets to approach her."",9,the knight out,2020";
"84,8.8,Allan Riggs,Allan Riggs,""A Black Ops mission to kill a terrorist leader in Serbia, starts to have bad outcomes."",17,operation shell shock,2020";
"85,9.7,Aaron Dominguez,Aaron Dominguez,""A mob debt collector is stuck in between his profession and his new found passion for stand-up comedy. While trying to manage both, he discovers a new way of operating in the mob world which is unconventional."",-,with interest,2020";
"86,-,Abe Wise,""['Ranks', 'Abe Wise']"",""With Chatelodeon now in a schism, along with other groups on the run, they must unite to defeat Hyrule and her group for the last time"",-,the beebproductions movie vi: the final beeb,2020";
"87,-,""['Roxy', 'YTP']"",""['Roxy', 'YTP']"",Charmx and his childhood friend Cap got invited to the beanie realm and was told to stop the almighty gnome.,-,charmx movie,2020";
"88,-,Alexander Johnson,Alexander Johnson,""A undefeated fighter goes for his 50th win but, runs into some unexpected physical and emotional challenges."",-,finding chi,2020";
89,-,Vincent Eclavea Jr.,Jack Ritter,-,13,kato: a new page,2020;
"90,-,Gavin Rapp,Gavin Rapp,""A Catholic Priest in a blue collar town fights against a local mob boss and diocesan insiders to rid his small town of crime, corruption and abuse."",-,father frank,2020";
"91,-,Behrouz Bagheri,Behrouz Bagheri,""In today's world, people are being transformed into new slaves by social media and mobile phone addiction and greed for money and fame. What is the way of salvation when we are caught?"",20,this one minute,2020";
"92,-,David Brubaker,David Brubaker,""What seems to begin as a simple walk through the woods, turns into something much different for Adam and Rick. Are they being followed? Is someone chasing them? They begin to understand that their lives may be in danger";" that the person following them means them great harm. They ... Leer todo"",-,hunted,2020"
"93,-,Brandon J. Rivers,Brandon J. Rivers,""James Spencer, a famous detective known for his special ability is presented with his biggest case yet to save the mayor's from 2 of the cities biggest terrorist. He realizes time is not on his side to find the mayor's where about. Him and his partner David Beucannon will be push... Leer todo"",-,the visionary,2020";
"94,-,Brooks Leibee,Brooks Leibee,""A widower, on the run with this eight year old son, narrowly escapes local law enforcement with their lives, an age old secret, and a ruthless pursuer on their trail."",-,legacy,2020";
"95,-,Arthur Mah,""['Raoul Bhatt', 'Arthur Mah']"",""When the payment for the bill goes too far. A universal issue at the end of a meal with family or friends, the uneasy feeling, who pays, a fight engages over who pays the bills for the people we love the most. Follow along Megan as she's taken on a back story of why she shouldn't... Leer todo"",15,battle for the bill,2020";
"96,8.5,Joshua Mabie,""['Joshua Mabie', 'Nik Shaw']"",A fanmade remake of the final Agni Kai from Avatar: The Last Airbender.,-,avatar: agni kai,2020";
"97,5.5,Alex Hardy,""['Alex Hardy', 'Elizabeth Mason']"",-,-,swing for the fences,2020";
"98,-,""['Jackie Cheng', 'Kevin Ku', 'Nani Ratwatte']"",Jackie Cheng,""Jin Kang's partner has been kidnapped by a DrugLord Named Ace. Ace has put her up for ransom and if he does not pay the money, Ace will kill her and come after Jin. So it is up to Detective Jin Kang to get her back from his ex-partner Ace and get past his thugs."",6,last man standing,2020";
99,-,Ralph Giordano,Lee Graham,A young Boxer pursues his dream of being a contender.,-,knockout,2020;
100,-,Daniel L. Rivera,Daniel L. Rivera,-,-,tnt,2020;
"101,-,""['Alex Denysov', 'Pedro Lopez']"",-,-,-,el panameño,2020";
102,-,Asaad Salleh,-,-,-,coriolis,2020;
103,-,Chris Cupp,Chris Cupp,-,-,skiptracer,2020;
"104,7.3,Kyohei Yamaguchi,""['Naruhisa Arakawa', 'Ayumi Shimo']"",""Fleeing from the invasion of her home world, Princess Mabushina recruits four warriors to become the Mashin Sentai Kiramager."",29,mashin sentai kirameijâ: episôdo zero,2020";
105,-,Micha Strecker,Micha Strecker,-,5,strangers,2020;
106,-,Jacob Hart,Jacob Hart,-,5,nerf this!,2020;
107,-,-,-,Reparto principal,-,shoot first 5,2020;
"108,-,Ben Bartlett,Ben Bartlett,""AMARA is an engineer working to terraform a hostile planet with her AI companion, TOKO. When an alien threatens their safety, Amara is confined into a suit by the AI that will keep her awake as long as the threat exists. Will they be able to put their differences aside and learn ... Leer todo"",11,awake,2020";
"109,-,Amrik Pabla,""['Amrik Pabla', 'Javier Schialer']"",-,9,assassinators: retribution,2020";
"110,7.1,Alejo Vega,""['Nathaniel Philon', 'Alejo Vega']"",-,30,hand of the pharaohs,2020";
111,-,Moritz Sacher,Moritz Sacher,-,-,bombshell,2020;
112,-,Mark Heath Howard,Mark Heath Howard,Winter Smoke is an espionage action thriller set in the dead of winter and It's about a black OPS agent called Winter Smoke who surprises her unassuming partner Rick during an International deal for Cyber Intelligence. The deal goes south after Copeland dares to make an Improbabl... Leer todo,-,winter smoke,2020;
"113,-,Sean Malady,Sean Malady,""STEVEN is an agent on a mission to rescue his mentor ORACLE after he was captured during a failed mission. Once he is rescued, Steven sets out to finish the mission that Oracle had started and fight against JIMMY and RICO to escape."",7,infiltration,2020";
"114,7.5,Simon Pearce,""['Tommy Draper', 'Simon Pearce']"",""A young British police officer, trapped during civil unrest, must overcome his fears and bias, to save an enemy that could be his only hope."",18,officer down,2020";
"115,-,""['Anthony s Parker', 'Andrew J. Parker']"",Anthony s Parker,-,-,tribulatio,2020";
"116,-,Darrell Harris,-,""As General Halcrow enjoys a leisurely train ride from New Optain to East City with his wife and two small children, the train is hijacked by several members of the eastern extremist group """"Blue Squad""""."",17,fullmetal alchemist manga dub chapter 4 - battle on the train,2020";
"117,-,Jacob Johns,Deaton Gabbard,""What happens whenever a heist goes wrong? The aftermath of a botched heist at a most unlikely """"safe"""" house. Join our characters as they plan out their next move as they attempt to escape the police, get the money they earn, and make it out of all of this craziness...alive."",-,falling out,2020";
118,9.8,Tom Lister,Tom Lister,The master thief Jeff Krönkermann is recruited by a mysterious businessman to steal an ancient artefact from an army of clones.,34,the unethicals,2020;
119,-,Austin Priester,Austin Priester,-,25,when,2020;
"120,-,Brian Wilmerding,Jacob Jon Parker,""""""Peru"""" Ex Agent Bentley is now living in various parts of South America hiding from his past. Special Agent Jay travels to Peru to search for his ex-partner to convince him to come back to America to turn himself in for his crimes. What Agent Jay does not know is Bentley was anti... Leer todo"",-,peru,2020";
121,-,Jay Nunez,Jay Nunez,-,-,jennifer: an assassin's tale,2020;
"122,-,Shiminga N. Forney,""['Reign Burton', 'Shiminga N. Forney']"",Two former assassins are forced to cooperate with an FBI agent to catch a multifaceted violent criminal that they've done several assassinations for. But things quickly heat up when he realizes one of them is too close to home.,15,amira 2: retribution,2020";
123,8.0,Sergey A.,Sergey A.,Angry shark attack Tokyo.,4,tokyo shark attack,2020;
"124,5.9,Todd Grimes,""['Mark Banker', 'Matt Smith']"",""In this interactive special, Harold and George need your decision-making skills to stop Krupp from blowing their beloved treehouse to smithereens"",37,captain underpants: epic choice-o-rama,2020";
"125,-,Christian Lora,Christian Lora,""In Cuba 2021, Arnold Palmer, a man of the future, travels back in time to Cuba in the year 2021 to avenge his father's death at the hands of Fidel Castro. Will he achieve his objective? Time will tell."",-,cuba 2021,2020";
"126,8.1,Miles Jay,-,""Starting with a high-speed taxi sequence, Daniel is constantly recognized as James Bond by surprised locals as he hunts down his missing passport."",2,daniel craig vs james bond,2020";
127,-,Jorge Silva,Jorge Manuel Silva,The family dog is kidnapped and a father goes a long way to bring it back to his family.,28,chasing paws,2020;
"128,-,""['Cengiz Dallikavak', 'Berk Devrim Özçelebi']"",""['Cengiz Dallikavak', 'Berk Devrim Özçelebi']"",-,10,reflections: yansimalar,2020";
"129,7.4,Chris R. Notarile,""['Rob Liefeld', 'Fabian Nicieza', 'Ann Nocenti']"",-,-,domino,2020";
"130,-,Caden Bittle,""['Caden Bittle', 'Ethan Kotas']"",After his dog is killed a man seeks revenge in his true form.,-,milkman,2020";
"131,-,Matt Strelecki,Matt Strelecki,""After rescuing a scientist from a shadowy organization, a black ops agent must make the best choice for the fate of the world."",-,project titan,2020";
132,-,Kevin Barile,-,-,-,lost souls,2020;
